author,comment
TimmeTehWise,"Seeing this, along with the other issues is really making me think quitting is a good idea, at least until BSG can fix this issue, because I really don't need to lose access to the game I paid 100$ for because I accidentally killed some streamer, this was the same reason I quit PUBG, and it's ridiculous but unsurprising.

At the end of the day streamers are just worth more as players,and BSG already has our money, so there's always going to be heavy discrimination, I just hoped that it wasn't to the point where I can't actually play the game for fear of getting my account locked.

If this is truly the case, that I can get banned for killing a streamer, I guess I'm just going to go play ER again... I really want to like and enjoy this game but every time I try there's some huge set of overwhelming flaws that make me realise the game isn't even playable, it's just the trailers that I enjoy, because the actual product runs at 11 fps on streets and is a massive unreasonable time commitment.
 And I was fine with those 2 large flaws, but when they set the precedent that you can be banned for killing streamers the game isn't a game anymore, it's just you filling up the lobbies as a bot so that the streamers can look more impressive when they kill you, and drag more people into the game. 

I hope this isn't the actual case, and if it is I hope BSG fixes it, because I enjoy the game when I can actually play it, but This like this make it unplayable.

This is just my opinion though, I really hope this is just a mistake on BSG's part, because Tarkov has so much potential ,and it is already an excellent game, when it works, but if this is the direction BSG moves in I won't be able to justify playing this. There are always alternatives, and even if this continues happening, if the price to play gets much higher I will value these alternatives more than this game, and I will move on to a different better product."
Xinexan,so they can just ban whoever they want because theysay you cheat and that means theydonteven need evidence? ngl this makes me want to uninstall even tho i played my first game today lol
Kadamace,"reng something better get this guys account back, dude's ego is all over the place"
Accomplished-Note386,Anyone see his video he just put up? How sad lmao
Sneaky_Rhin0,"i didnt even know who renga was but seeing how he treats enemy players and combined with pulling shady side strings, directly dming admins to ban without proof or when there are proof against cheating is disgusting, and he acts entitled and wont apologise, atleast man the fuck up and be a human being? honestly how is a person like that a sherpa? 

i had a guy flyhack and tell me where all the dead pmcs were when i scav into streets, i killed him & i recorded it and took his dogtag and sent it to bsg and they told me nah not enough evidence from the launcher ticket (they dont use video proof apparently) but a streamer can dm his buddy and ban others for no reason?"
Kerstekind,Tf is a 'Rengawr' tho?
,[removed]
Event82Horizon,He reminds me a lot of KingKongor.
J4LordoftheDudes,I might have also lost my 401k from killing rengawr.
Mad__Elephant,"I feel like i killed him too lol. I’ve also got 229 in 11 januaryz I’ve killed juicy guy that day on shoreline but not sure if it was him since i don’t have dogtag.

Edit: In what region does he play? I play in europe"
Sestos,"I do not understate why BSG bans people who streamers report but if normal players on a map report the same ""floating hacker"" with multiple reports nothing happens."
ecatillo,"https://www.youtube.com/watch?v=IU7zgqyxs10

He calls cheats all the time even when he wins… skip to 4min in this video and he calls cheats on the most mundane thing I’ve ever seen"
PharmAttack,"Why fix false reports by working on desync when you can just ban the people it happens to.

Duh."
Detiabajtog,"It’s really insane that they just allow certain players to ban others based on nothing but their own POV and opinion, especially when the servers are *so bad* with desync issues"
DrHighlen,"Yeah streamers are entitled little...... IMHO I'm glad eft will never be mainstream


stay in its little niche bubble."
Morrowindlover,What is still missing from both of these posts is a clip showing your OWN point if view of the kill. Weird how thats missing in the one that blew up.
