author,comment
,What a joke that we play a hardcore loot shooter and cant drop fucking bolts on the floor for a friend anymore.
Hexblade757,"I would say the fact that you can no longer post items on the flea market that you just bought from the market or traders was an improvement. 

I think a simple compromise would be to make everything FIR if you actually found it in a raid whether you die or not."
Firefly3564,"""Tarkov is not supposed to be a fun game"" The more and more time passes the more I think Nikita was dead serious with that line."
SpeedsterGuy,"Tarkov was peak where it really was ""The world is yours, do as you please."" 

People trading containers, borrowing keys, quest items, killing AI scavs for bags, it was so fun to just do whatever."
,[deleted]
Barcode_88,All the Anti-RMT measures just made the game less fun for regular players.
thetinker86,I do miss taking people stuff to sell on flea
glassbong_,I can't. Because it's too true. It's actually shocking to me that people who experienced old Tarkov and new Tarkov would actually think that new Tarkov is better.
LolzWhatIsThis,personally i think having the quests not requiring FIR status would be enough
iHateSunsetting,I don't mind flee market requiring FIR but quests should not require FIR. It feels terrible.
BARDLER,"I didn't play that far back, but as someone that has been playing for a couple years at a casual pace, I can say that this games identity is really confusing.

They market it as a hardcore realistic FPS but then the controls feel like absolute dog shit. Other mil-sim games, such as Squad, have realistic based movement and guns, but the controls feel good. They use their 'hardcore' description as an excuse for bad game design and UX for the way almost everything is designed.

The confusing part of the game is they have these RPG skills that when you level up make the game feel less like shit. You move faster, your recoil feels better, you can sprint longer, you can jump higher, heal faster ect. They also recently added those crafting buffs on guns that are basically RPG crafting enchantments. There is nothing wrong with RPG elements in games but their approach to balancing those skills is to make the game feel awful until you level them up.

Their entire balancing view is built around slowing down streamers and people who grind the game non-stop. They make early quests harder, they make the flea market harder to get, they make low level skills more punishing, they make the hideout harder to level up. Because of all that this wipe has been the least fun and least rewarding to play by far. I have barely made any quest or hideout progress because I am blocked by a couple key items. My raid survival is way down now too because of overpowered scavs. So at this point what's the point of playing?

There is a great game somewhere in Tarkov. It's just BSG seems hell bent on hiding behind a lot of really bad game design decisions."
generic_pog,"Fuck FIR I miss when marked rooms spawned weapon cases and shit. I remember I got one out of dorms and felt an adrenaline high I’ve never since it before experienced, and yes, I did die with it. Make marked rooms great again"
olishoplifter,"Man I miss fights pre-fir when you would actually be rewarded for pvp. Now Tarkov has turned into a weird crab simulator and everyone sitting in bushes/rooms hoping to get the drop on somebody. I agree some things needed to change, but the whole fir completely changed the game and I'm not sure if it was for the better. It was a lazy fix to a problem that required a real solution. Tarkov really lost it's charm the past few years, and I'm not just saying that because I'm ""bored of it"" or because ""I've done everything."" As long as I got a few good homies to play with I have fun even if I'm doing the same old quests over again. I just miss what this game could have become."
GaryMoMoneyOak,"I think Nikita is more focused on making an unnecessarily hardcore game than a fun game that seems to be actively killing the game. At this point, the game has complete disrespect for your time."
DSM20T,"Valid point.  The larger problem with this game is it's fundamentally broken.  There is no fixing it.  Awesome proof of concept, great innovation, basically created a new genre imo.  

I say congratulations all around but it's time to shelve this and get to work on a proper implementation.  

Booo hissss"
A1KMAN,"majority of people were dead in the first 5 minutes of the raid cause of people rushing to techlight/resort/dropdown/marked just so they could try and beat the hatchet runners before they shove anything of value up their ass and kill themselves to go into the next raid. if you werent doing that you were getting no action anywhere else on the map. if you did rush the high value shit, you were spending a cpl mins gearing, 5 mins queuing, another cpl mins rushing, for less than 30 seconds of action. traders would be instantly sold out of any decent ammo, attachments, etc to be sold for 5x-10x on flea. i dont miss that shit at all"
Verlas,I just miss being able to wiggle fast :(
cj__________,Is anyone old enough to remember this exact thing happening with runescape back in the day? Devs go too hard on combating RMT impossible because a core component of the game relies on it (full loot pvp) . Practically killing their game in process.
Maki_v1,"Removing FiR would probably reduce the aggressive cheating somewhat and more people would resort to hatchet-running. 
I would rather have 5 hatchlings running around instead of 1 cheater."
ASelfie,"New Tarkov is a good downgrade from old tarkov gameplay wise/sound wise/performance wise.

But FIR was kind of needed for these fuckers going hatchlings and jumping off a rooftop, you had a lot of them back then because lets say they would just rush resort, store one GPU and one Ledx, die afterwards, and still make near 1.5 million...."
Aceylah,100% I've avoided so many fights this wipe because I just want to get shitty tasks done.
-Here-There-,I’m just upvoting for the correct use of “peak”
Elowenn,Back when the Mosin was an actual equalizer and Shift+Ws couldn't get away with doing that 24/7 (yes they still won most fights but they still had to fear the Mosin man).
whoisgare,"I’ve only come to agree, not change your mind. Goodbye"
The-Poopfist,"I use to spend hours flipping shit on the flea market, made so much cash just reselling armor and ammo it was like a whole game in itself to me.

I was so sad when they made flea market FIR only"
NouSkion,"Finally, a post that aligns with how I feel. Full agreement from me on this. All these restrictions BSG has imposed in an effort to curb real-world trading have only negatively affected the player base and the game as a whole. Ever since I haven't been able to sell gear acquired through PvP, I have had absolutely zero desire to play. It has ruined the game outright and failed to have any meaningful affect on RWT.

Time to try something else BSG. This ain't working."
DeadMansMuse,"FIR *ONLY* *benefits the cheaters.*

The math is simple, cheater zooms to any item they choose, including people, loots FIR, kills all opposition (erasing the FIR on butt stuff), leaves as one of the only people to get FIR items. Easy monopoly.

The rest of us get lasered before ever being able to extract with our FIR salewas."
Rare_Lifeguard_4403,Not only FiR changes. Why the hell i can't drop some stuff to my friend who plays 2 hours a day just to have some fun. A key for a quest? Nope. Some items for his hideout? No way. A good armor so we can have fun on PvP? Fuck you says Nikita. A labs keycard so we can enjoy a map on a game that we paid some good money for? Neither. This is bullshit and me and all of my 4 friends who used to play this game already quit.
Rezhyn,"Hard disagree. FiR killed hatchet runners and made surviving mean something. Finding quest items or rare items you want to sell should mean you want to survive, not stick it in your ass and bunny hop to your death because you raced to the spot first or got a good spawn. 

Inertia is great and killed jiggle peeking, fights feel infinitely more natural - although weight thresholds need to be lowered. Progression feels better with flea bans and outside of Mutant/BP there is a lot more variety early wipe.

I will agree recoil sucks though. Controlled bursts should be more reliable and spraying can stay bouncy. It does feel pretty RNG and imo (head, eyes) increased very hard with new recoil that bounces around your face."
MadDog_8762,"No

Pre flea market was peek tarkov, as it didnt matter how much money you had,
Somethings you HAD to find

Fir is an attempt to fix what the flea broke"
uchihaoftheleaf69,That’s the point though.. it’s sucks but they want you to feel “scared” and avoid fighting.. making less money etc
Thug_shinji,No the game was far better before the flea market existed. I would love a wipe excluding it.
BetFit2122,You liked it when people flipped items from traders? Or when there Hatcher runners taking all the good shit before you could get there? I’m gunna have to disagree
blindhollander,"The games shit now. Like I get it, they are making changes and they are okay. The games great and dog shit at the same time. But old tarkov was 1000% better. 

They started dropping hints of what development was going to be and what they were working on and at the time it sounded great but 3 years later after they still haven't added more than half the things they talked about and it's just in a weird state on transition the game feels even more empty and incomplete after adding changes than it did 3-4 years ago."
thed0pepope,I think i prefer pre-flea tarkov tbh
matt2k14,"I agree 100%. The FiR bullshit was to help fight the RMT imo. There’s no need for FiR anymore when everything is restricted on the market anyway.  I’ll take hatchlings all day everyday instead of being forced to leave the raid once I find my quest item or loot. FiR forces everyone to go in get what they need and immediately leave and it’s dumb. Without FiR you could stick around(shove what’s needed up your ass)and still PvP and enjoy the rest of the time you have left in the raid, but instead you’re forced to leave ASAP."
teo5151,What is FIR?
OhHaex,pre FIR days were actually enjoyable. even with dying raid after fucking raid.
teamkillgreg,Agree. Once that quest item was found you could engage and fight. Now I bail and run every time because I’m a solo player.
BigShrekDaddy69,Fr needing tasks to be fir is such a piss off
notgaunt,"Get rid of FIR altogether (and the FIR quest requirements) AND also don't allow barter items to be sold on the flea market.

This makes finding a valuable item and stuffing it in your ass worth it no matter what while simultaneously making it useless to do so for Flea market profit/reputation. It achieves the slow down of progression Nikita keeps ham-fistedly trying to chase while providing an escape valve for lower/mid skill gamers to have some avenue of progression through a wall of death after death after death.

It eliminates some of the low hanging fruit of RMT people selling hundreds of graphics cards, etc. day three of the wipe"
PureRushPwneD,oh man I miss shoving flash drives in my prison pocket after looking for so long.. I am so sick of getting to level 25-30 every wipe before I'm done with that damn task and **finally** unlocking PK and skier quest .-.
Kozak170,FIR is dumb because of all the convoluted ways some items count and some don’t. Their efforts to counter RMT did more harm than good. Also hatchet running was honestly such an inoffensive problem to me. After a week or two of a wipe it’s just a shrug and a free kill for me.
Rk0,"Hard agree, I miss pre FIR tarkov."
ranopan0,"Good breakdown, I would add to that that the dynamic loot update of closed rooms made pvp disaster, nobody is even fighting over tech stores anymore, ultra, kiba, marked rooms, reserve servers, all absolute garbage

Wanna do some labs with friends? well too bad you cant even give them a keycard, wanna help late start friend/standard account giving him epsilon? fun detected"
inedibletomato,Hard agree. I got into the game about a year before the FiR flea market implementation got added so I do have a bit of nostalgia for it being my early days but it was great. Also added bonus of being able to play stock market simulator with my rubles when I didn't feel like raiding and it had a whole other element for me lmao
avowed,The game is too sweaty and ratty nowadays.
gearabuser,I agree with you. Post FIR stinks. I also miss high value loot rooms.
beattraxx,"Imo pre twitch drops was the best. 

Small, but super dedicated playerbase, devs weren't having god complexes most of the time, raids felt very intense when you found something valuable and tried to evac, no somewhat ""complex"" game mechanics - just build your gun, get that gen4 and attack backback and fight off the horde of heavy npcs in labs, WHAT A RUSH!! 

I really miss those days and i am glad i quit when eft was, imo, at its peak. Sad to see what happened to the game but at least i had fun most of the time."
DrunkPimp,"Pre-FIR was when I first started playing, so with rose-tinted glasses it was definitely my favorite period in tarkov.

That being said, non-FIR flea kills early wipe, and really ruins the economy and makes the game a meta gun, ammo and armor spam fest.

HOWEVER, casual players do deserve to be able to be enjoy the game and at least be somewhat viable. FIR changes, etc. did kind of kill the progression for those players and really widened the gap... We need a middle ground between pre-FIR and the current state of the game for more casual players."
Stunning_Hornet6568,"I still think they should embrace no FIR for more tasks. Flash drives and gas analyzers come to mind for things that are very early in the progression system task wise and serve no real purpose blocking progress especially later in wipe. Could even adopt a system where you have FIR and from Fleas Market marker and make those FIR be items you only found in raid (including those in secure container) and if a item is from Flea Market it gets its own tag and limitations. Tbh that idea sounds like a perfect middle ground between the two, for posting an item on Flea you have to get out alive though is what I mean but if you shove in your secure and die you can still use for task of course then some take like the stims one peacekeeper gives would be extracted alive."
KindSadist,"Agreed. FIR ruined the game for me. I work 50 hour weeks, have a two year old and other responsibilities. I don't have time to do tasks all goddamn day like a streamer. Not being able to buy anything on the flea market also ruined my experience. I never RMT'd or anything, never played the market, but being able to buy whatver I need was great. Allowed me to do nothing but PVP."
RJohn12,"I definitely agree. a good example is flash drives. right now I need two for a quest. the millisecond I find a single flash drive, I go 1000% invisible rat mode, zero pvp, zero pve all the way to the extract. if the fir stuff wasn't around I could just play normally and still get quest items. or just buy them when I find enough money's worth of loot"
craftySox,">Yes, it had its janky netcode and performance issues, and its ~~cheaters~~. But that.... Hasn't got better since. So not really a valid argument.

It has. A whole metric fuckton. It's still dogwater, but it has improved dramatically on both of those aspects. Cheaters though? Not so much. Although, actually, thinking about it maybe it has a little or maybe they've just got rid of the most obvious aspects of cheating. I don't tend to see many people flying about or speedhacking nowadays - it's just obvious walls and aimbots that stand out.

I agree though, pre-FIR was much better than what we have now and honestly if they buffed scav and loot spawns then I wouldn't mind removing the flea entirely - or better than that a key & container-only flea market.

edit: Yeah maybe not on the cheaters part, looking at the front page others have had a hell of a time with it this wipe it seems lol."
BlazingShadowAU,"I didn't mind the FIR limitations when it made some level of sense, but it so rarely ever did. 

""Hey, I need you to get 3 salewas and get them yourself""

""How the fuck do you know that Salewa was brought in by an enemy PMC?""

""Dunno, I just do, go fuck yourself. You engaged in PVP to no real benefit to yourself, maybe just rat the same fucking locations ten times instead."""
KomatsuCowboy,Been saying this for awhile. Pre FIR was the best Tarkov. Its just been a continuous downhill of fun since.
Kullet_Bing,"If you wanna go there I say pre Labs was peak Tarkov. When labs came, it was mad fun. When labs keycards came and around that time the big streaming event that expotentially boosted the popularity, the game went downhill for me. Labs suddenly was full of cheaters, RMT became a thing for this game, sus af deaths skyrocketed."
DropDeddBlue,"I played daily before FIR was announced, thought it was dumb af LORE wise. How tf would any trader know where I got my shit from? They shouldn't care since people are getting blasted daily in tarkov. I'm fine with the randomized spawns since it helped with hatchlings somewhat. 

But man that flea market before FIR was a whole game in itself. I loved being able to put anything on the market, tracking prices, and making my own missions bc of it. It felt like how a real market would work in a lawless land like tarkov. Saying things are banned from selling just doesn't make sense to me, a Scav would sell his left nut on the flea if he could.

I understood the changes to flea but it really helped the Timmy's out being able to penny and dime extra cash for the random shit they needed to keep them going. Zero to hero wasn't needed if you just followed the market well enough. 

Now I can care less about the flea, and if I find something decent I extract immediately like OP said."
Bulletspong3,"IMO this game peaked at 12.7, so the patch they introduced FiR (or the patch before 12.7, I can't remember). Every weapon was viable in some way because it didn't have mad recoil, the hideout had just been introduced so it was grindy but not too grindy, RMT preventions hadn't been implemented yet so the flea market was actually useful and usable and while there were cheaters, there were less of them or at least it felt like it.

Yes, I know some of you hate the flea market, but some of us don't have 12hrs a day to put into this game to relentlessly grind for what we need. Some of us just wanna spend a few hours a day after work having fun with our mates and enjoying some PVP.

I might be looking at it through rose-tinted glasses because this is the wipe that me and my friends really had a blast on. The game had the right mix of survival and the scavenging elements but also felt the best it ever had as a PVP shooter. The game has seriously regressed since then - performance is worse, audio is worse, the gunplay feels worse. Almost every aspect of this game feels worse now compared to 12.7, except admittedly for Inertia which was a nice change."
Booyakasha_,"The game it self yes, but i do think FIR is better for the game as a concept."
Breadbin3,"I couldn't agree more, it feels like they've took what was a good game (i started playing about 2019, a couple wipes before FIR) and slowly, over time, it's just gotten worse. I loved the game when I first started playing, when you could take a thicc items case into raid and drop it for the craic, or trade containers with people, now the fact that you can't even drop keys or valuable items, it's just a joke.

I've had so many times recently, where I've had like 9 labs key cards before I unlocked the trade from therapist, and wanted to go labs with my friends, but can't, because you can't drop them in raid, and they're rare af to get as a scav, so I can't go labs with friends at all. Personally, I think the game plummeted in quality the day they introduced FIR.

You used to be able to go loot, get some good stuff, stick it in your gamma, and go fight, and get some player loot, the game was fun, nobody was proper try harding at that point, cos what was the point. Then FIR came about, and the only way to make good money, was to rat as a scav, unless your absolutely God-teir at PVP, (which im not) its a joke.

I still remember the start of the hacking problems, the Chinese hackers, with names that were mostly numbers, I still remember, me and my friend were on labs, and this dude chases us around for a bit, hit me and my friend, so we went to go hide and heal up a bit, the guy railed me and my friend through a door, perfectly, head-eyes, both of us within a second.

I really miss the days of being able to just fuck about and actually have fun, not with inertia, that turned fights from who sees who first, to if you run, and someone sitting in a corner sees you, your dead, and can't fight back, recoil that in no circumstance is realistic, FIR, the ever-worsening hacking problem, nerfing fun guns into the ground because ""we dont like metas"", even though, regardless what they do, there will always be a meta, breaking audio that worked fine, the list goes on.

I saw someone make a comparison to warzone 1, and the development of that post-release, and how they just kept adding stuff to the game files, and eventually, it just became a buggy mess, that took up loads of space, and ran like crap, its starting to look a lot like that. Literally last wipe, I was able to run the game on all high settings, and get like 70-80fps, now, I have to run it on medium, and don't even get close to that, constant connection problems, and the serious problem with hackers. For a game, that they're charging well over 100 quid for EoD, I think this is really bad, I don't care if the games in beta, thats not how they're presenting it, and it's not an excuse for them to deliver half-assed updates, that make the game worse, the game is no longer what I paid money for, and is literally a different game, just because its hard-core, doesn't mean that it's okay for them to completly screw over 90% of their playerbase because they want the wipes to last longer, and deter any new players, because of all the dumb shit you have to learn now, like scav AI being broken, scav bosses being unbelievably hard to kill, then not giving any decent loot 99.9% of the time, like why the fuck did they stop scav bosses dropping labs key cards, that was one of the big reasons it was worth going to kill them, that was a guaranteed ~200k drop, but now it's gone.

Streamers didn't help the problem either, they made the game massively popular, and taught new players that the only way to play the game was with ""meta"" guns, a slick or a Hgrid, and the best ammo in the game, which made the game even worse, and even more grindy.

TL;DR - BSG are killing their own game, and ruining one of my favorite games"
Nevermind04,"Found in Raid is a failed bandage to the RMT problem and once BSG realized it did not fix the problem, they should have abandoned it."
acidix,"On the Pogcast, Veritas has told this story multiple times about how the reason that we have run-through as a mechanic in game is because a handful of players were just extracting from factory over and over trying to get their survive percentage up.  Nikita learned this and made them implement this feature.

There are things that just make the game artificially harder, that are really just Nikita or Nikita + a handful of devs, thinking that the game should be harder for harder's sake.  Like, Not having a mini map is hard, but you dont have a mini map in real life, so sure.  However, find in raid?  Why does Therapist care if I found my cigarettes in a box, or if some dude named joe found them and sold them to me for 2000 rubles?"
ezraindustries,"100% correct. If I find a quest item I need I will avoid all combat and leave the map. Before, I'd just throw it in my pouch and play normally and actually have fun. The single worst change ever made to the game. Adds absolutely nothing whatsoever, literally makes people just leave maps faster."
aeshredics,People actually used to push PVP when you could die with an item in your Gamma and come out ahead. FIR was the start of the rat meta.
BoostedWRBwrx,"I don't think anybody will disagree. Everything BSG has done to curb cheating has directly made the game a worse experience for the average players and has done nothing to solve cheating. FIR should be a thing for certain quests regardless but it currently hasn't done anything to benefit players, the game or the in raid experience. The only thing it did help to curb was hatchet running."
