author,comment
Alexxfernandes61,What in the Tarkov rp did I just fuckin read
arct1ccz,"greetings from a friendly gargoyle decorating the resort roof, ... People never look up lol"
NotTactical,You missed the part where you go MIA anyway because you forgot to check if you had Emercom or Railway.
Dayyyman,"Yep im checking that spot every raid from now on, fucking vultures haha"
therealgoodmans,CHAWWWWW!
ArkAbgel059,You could always use a pilgrim as bait with tp scattered in the slots at the bottom of the ramp
TheSaltySeaOtter,Good read. But hyenas don’t give a fuck.
YungJizzleSnitch,You are an emercom sniper one of many
ALDRFG,"I pray for the possibility to give tribute to the All-Seeing Vulture so that He may offer me safe passage to Emercom.

At the base of the stairs leading upwards towards The Roost, I lay some of my valuables, nuts, bolts and tools, some days gold and others modest sum of roubles or foods.

With my offerings and prayers made, I scurry towards my exit with only the hope that my gifts were acceptable and that the Vulture deems me worthy of Life."
osemaster,Between this and the rat to Chad post I'm fucking loving tarkov reddit today more this less whinin
RespectGiovanni,Im more surpised you arent getting shot by the horde of scavs that spawn behind oli and by emercom campers. A pmc’s body sticks out on the top of that roof
Jean_Claude_Vacban,"""and as a lone male""

Oh, we know."
-_Dare_-,“I squak in triumph and bristle my wings” lmfao.
guberNailer,"Bro wrote this mid game I’m pretty sure, while doing his ten minute wait for a victim"
BringBackManaPots,"We used to do this thing we called scav golf on reserve after the karma changes went through.

My friends and I would post up in black pawn and wait for the scavs to clear all the loot out. They all generally worked together thanks to the new karma changes so most of them would make it to ~~extract~~ us, brimming with mid tier loot. They'd get to the extract and then our firing squad would come alive. We'd split it all and pop out of d2 with a minute left, absolutely stacked with a maps worth of loot."
Vex192,A new species emerges in Tarkov
7r4pp3r,*SQUAK*
JavxF,"One of my best Tarkov Experiences was a ""Volture/Rat"" one. 

I went into Interchange, waited for many minutes to come and when the shooting stoped, I went in. I went to the Gun Shop to take leftovers but I found a fresh body with EVERYTHING on it, LVL5 armor, huge back pack, gun, etcetera...

After looting it I wanted to EXFILL! I was really new to Tarkov, so I never had such an invetory before, went down through the hole in the mall to take Emercon exfill, when I saw this dude who had the exact same armor as I, he hasitated and I gor a jump scare and just took a shot!... A burst came out and one of them got im in the face. I went to loot him and he as PACKED!... It was weird he had the same armour as I did... So I just took everything and plan to go for exfill... When I saw this OTHER DUDE! in the SAME kind of armor!... He hasitated again, he saw me and he just kept walking like if I wasn't there.. I got another head shot... 

Then I got it, they were all a team, they got the same Vest, Helment, Guns, so they wouldn't confuse themselves with someone else! But I already looted 1, killed 2... Perhaps there was a 3rd one... AND THERE HE WAS!... As I was going to the exfill he and I started a shootout... It was INTENSE! I was about to exit the mall, and shot my last burst of rounds! Only had my handgun left. So I came out, cross the road, jump the defense of the road and hid into a bush!... Waited for some seconds, he came out bursting. He came really close to te bush and I considered taking the shot, but then, he just walked away... Went to Exfill, and I never knew mor of him...

I was tempted on going back to the bodies, you know? A RAT instinct kicked in, I needed MORE LOOT! But I have almost no ammo, and only a handgun, so I waited untill there was only 4 minutes left.. I know as a good rat that people wait even more to exfill, so I had to be in between. I ran to Exfill, Heavy AF... Had 3 vest, many guns, etc. I wanted all of that. And I got it. I belived he was waiting for me at emercon, so I got there as slow as possible, with some rat knowledge not many people posses, but he was nowhere to be found. I got out, and never knew the guy. He tried hard to get me, but I was too much of a rat for him, and I got his friends loot with me.

In a single raid I took WAY MORE than I wanted too, killed 2 high lvl players and got out with 0 injuries... That day, was a good day."
LogNberry,"Lotta haters. Happy hunting, preying?"
JadenAUT,ok ok ok ok guess we have a new playstyle of ratiness :D so its chad > rat > vulture hahahah nice
JebstoneBoppman,"Hello, Vulture  


I am a squirrel. I believe we can live in peace and both get what we want. Does this proposal sound enticing to you?"
KniffelLive,I lold hard. Thanks
FlameForFame,"Great story. Absolutely love to see how many people are getting angry over this. Keep up the great work, vulture!"
Positive_Insurance_5,Bruh did I just read Tarkov rat poem lmao
Ted1590,edgy
Bonus-Representative,I am the happy Scav... I have great Fence Karma - I spawn with great loot. I can scav Factory for 5mins twice in the time it takes Vulture to wait until last the last 10mins - and I have 4 mins in hand. I am the happy Scav.
Caine_Pain333,Actually enjoyable to read very poetic lmao
Real_Holyfrog,"HAHA MAN, i loved that story"
TGish,Tarkov players are cringiest mfs alive I swear
Molojin,dont care about the playstyle but vultures scavenge dead animals the vast majority of the time and rarely attack animals. get your rp straight
DenOndeBonde,"I fucking love it.  
And I fucking hate it.  


Good job :)"
wpreggae,Extract camping the Emercom is way of life
voxyvoxy,"""Does the lion mourn the death of the gazelle?"" He does everytime he's not the one doing the eating."
Cr1t1cal_Hazard,"We that are above the scum and filth of Tarkov, us the refined gentlemen and scholars that chose to use our brains instead of brawn to best our enemies, we, the superior race, those that wait for the enemy to come to us, we need a universal way of signaling each other. It'll be our brotherhoods secret handshake to signal to each other that we are fellow Members, and that we seek peaceful passage through.

I personally vote for a VOIP ""SQWUUAAK!"" And flipping the bird if thy brother is out of ear range"
ChucklesAcademy,"I would like to read more of this poetic vultures tales.

What say you?

What say you mighty winged beast?"
delu_,"i mean, whatever playstyle you enjoy, but you are still just a rat no matter what your headcanon is."
igg73,How do you drink a slickers
timmy4937372848582,hm maybe I should do that
kona1160,You could just have said I camp emercom  exit....
FarTooManyReasons,"This is good. This made my day. And even tho I am currently 0 - 100 with you scum bags, my day will come when I catch you degenerate feasting and take the whole pot."
thfxyy,Imagine paying $60 to sit on oli 👀😂
VultureTX,Amusing
FellowConman,"Thanks for telling me your plans. I will look out for Ratata’s such as yourself. Some people enjoy the ratty style, some people need it. Either way it keeps it interesting. Sometimes people either can’t stand losing or don’t like the game that’s being played. There’s a work around to each extract camp. The game to me is being prepared for the right rat. Happy hunting"
appa_the_magic_bum,Fucking sky rats I love it
redeyezer0,Not my proudest nut...
DrMalware,I'm full chub right meow
Hybrid888,Bro go outside
Turok36,Cringe
loongod5,What’s with the cringey role play posts as of recent. Go LARP outside or something
iCrazyNoodles,"Hah! I killed someone doing the exact same thing on customs, got away with so much needed loot"
algumnome,We need to know more.
App199,I loved this lmao I hope it stays up for a week
artisan-,"Unless u have a jet pack unlock in your workbach..
U ain’t circling shit..
U just  sitting like a rat(no shame in that) and camp..

But nice story"
BigToasster,You misspelled “pussy”
Sp3ctre777,I mean if you wanna wait 30 min every raid for anything to happen be my guest lol.
Wunon,[https://www.usa.gov/unemployment](https://www.usa.gov/unemployment)
lixmk0,I threw up in my mouth a little.
Hungry-Opening-420,Another maniac naricissist.......boring.....
RoadGroundbreaking64,cute i guess but seek help man holy shit..
Lt-Courier,Who… cares?
DocShayWPG,Sounds dull.
Puzzlepea,"Anyone who actually extract camps better yet, makes a post like this is mentally unwell. I hope the best for you and hope you get well soon."
kasabian-7,"Your post rocks! Keep it up, Vulture man"
M1ster_christer,"yeah, thats extract camping..."
exsciled,Fking rat roleplayers fetish lmao. Wierdo
pio_11,tarkov poetry? 🤣
LilMountainHeadband,you're a rat.
ManyyBasedGod,"Weird flex, but okay.

If you just wanna spawn in for the last 10 min to pick around at some carcasses, just run a scav at that point? That’s kind of the entire point of scavving lmaooo. You can do exactly whatever it is that you’re trying to do, except without it being an extra 25 min of time wasted waiting for someone who may never even show up since many people avoid Emercom at all costs."
PanProjektor,Forgot about the part where for 20minutes vulture assassin just sits there listening to ambient noise. Fun evening
Killahdanks1,So your bad at combat. Got it.
TheFunkadelicOne,Edgy
PropitalTV,"Poetry, really."
droppedbombs,these roleplayer posts suck
svvrvy,"quit being scared and go fight, its more fun"
fifthg3n,cringe
VoidSythe,so fcking cringe
Richard-Long,Aye man we all got about 80 years to live so you wanna spend 20-30 minutes for every hour just sitting there be my guest lol
Upvotemeplzz,"playing solo feels like vulture style , it makes no fucking sense sometime you cant go loot until last scav wave"
Sargash,"Do you take the easy timmies as prey, or do you wait for fat and juicy prey only?"
Kulson16,So it was you last wipe i was scaving interchange and got to emercom when timer was on last minute and someone tried to snipe me
WrangleRdod,the D-2VpoBoss approve this !!!
slicktrickrick,This has some strugatsky vibes to it
JiffTheJester,Yeah if I had all day to play I’d probably do this too lol
ZyzzBrah_1,Take your meds bruh
CoolCrab69,"""My belly grumbles with hunger""  


  
Truer words nevermore spoken."
Alz0rLolz,Where is this spot??
LOOP16,My dude out here writing Rorschach log #320
mforsythh,this man had some personal vendetta's in this game
Skerxan,Glorious!
xbepox,"You would have loved Reserve before D2. I used to snipe from the hill and just stack bodies down below before going to collect. No scav karma, tons of loot and gear from players, scavs, raiders and bosses alike. It was a different time."
moctezuma-,Absolutely beautiful
ItsjuztD,KAW KAW . . . KAW !
xXBli-BXx,StankRat made a reddit acc
Its_Da_Muffin_Man,"Meds, now"
Adorable-Ad-4670,"Tex, is that u"
yoimakebeats,This whole post is literally me but instead on customs hiding uptop power watching stronghold and not leaving till 10 minutes left of raid
Magnific0420,This right here is why I only go night interchange
Big-Challenge-5020,"usually i skip big posts because i cbf but this was an interesting read, thank you"
Hunterslayz,Your now known as Mordecai.
HitEmWetto,"Why do i get ""The  mighty Lightning lord and the Balrog"" By King Gizzard, story telling vibes from this"
BecomePnueman,I play games to challenge myself and have fun.  You play games to make others feel bad.
Kindly-Mine-1326,"Careful dude. When you pick up a GPU, there will be still a cheater that comes flying over to you."
Beef_Boye,"I do the same, but in woods and streets. Feels like the raid goes silent after about 15mins are left, which is when I creep down from my hidey-holes and loot my goblin kills. I almost feel bad for the poor souls that try to loot the bodies. Almost."
Pyromanuel,"I, too, shall follow the way of the Vulture!"
GreNaderz,"i think i lost braincells reading this

not because of the extract camping or anything just cause it's really edgy"
goliath-og-2021,How do you get above oli?
goliath-og-2021,How do you get on top of oli?
Sloopydupy,"I am the vulture. I prey on dead players and scavs. You typically won’t see me until there’s 10 min left in a raid when I leave my roost and converge on the carrion for a feast.  
  
I’ve watched the whole raid from my perch above Oli, where I drink my water and slickers. Some rats and chads are able to scurry past unharmed, but many are not.  
  
I see a thick chad through my valday, crawling by the blue wall towards emercom, laden with loot. I almost feel bad as my silenced AKM rains PS ammo down on to him. There’s no where to hide, and he has no idea where to shoot back. His thick body laying lifeless, my belly grumbles with hunger but my instinct is to wait. Wait in my nest until the other scavengers come to feast. It’s not long before player scavs are surrounding the carcass. With a well aimed shot, they are put down, but more keep coming, unaware of the vulture circling overhead. After the bodies are piled up high, the vulture drops his insured weapon and armor in order to fully gorge himself as the raid timer drops below 5 min. A FIR Ledx on a player scav? I squak in triumph and bristle my wings. This is the year of the vulture!  
  
Being a vulture is a way of life, and as a lone male, I justify it as nature taking its course. Does the lion mourn the death of the gazelle?"
CeoOfLighthouse,"Me and some buddies did this strat two wipes back. It was sadly super satisfying to be a little vulture. It's a hybrid rat strat. Let em all loot up, wait for a juciy boi, drop him, and then wait some more. Interchange and Reserve were awesome maps to be a vulture."
synthetic9,……
noprnaccount,"Interesting but a culture shouldn't be seeking out combat, more like taking good scraps before the scavs get there"
GregasaurusRektz,"For those wondering my typical build.  

Helmet, cheap body armor, ears, large chest rig.  Basically anything around my stash.  If I’m not down bad I prioritize a decent helmet over body armor just in case I’m spotted and someone gets a lucky shot off.  

1 grenade, preferably vog or impact but any will do.  A LOT of scavs and PMCs will come out from the entrance right below you and opening with a grenade is pure bliss on groups of two or more

Gun - variable zoom optic like Elcan, valday, or vudu.  Silenced anything with semi auto capability.  My go to has been AKM but anything will work.  In previous wipes I’ve been sniping up there but I find the semi auto is a lot better since people are on the run and I can get 4-5 good shots off instead of 1-2.

Happy hunting"
iWanttoKillaMan,This made me laughs
theeliphant,This is Tarkov
xLegend_289,Now you've got me curious about your spot
Cautious-Wedding6674,So you're a rat..
Originally_Hendrix,I do this but only because I'm trash and new to the game 😅
JollyReading8565,"When I get killed standing in a coop extract 5mins left in match from PMC,  I imagine it’s from players like you lol"
DigitalMarine,"More like The Rat, as rat above is still a rat. Basically you are a rat camper just like the majority around, but at least you understand and develop the culture around it."
loongod5,Buddy you just described a rat.
