author,comment
reckless150681,"Hell yeah. Tarkov ruined shooters for me in a good way - there just isn't anything like the adrenaline rush of winning 1vX gunfights when half your limbs are blacked and - did I drop my mag back there, or not? The sound design, while messy at the moment and in need of serious rework, is at least damn realistic and intense as fuck in closed environments, and the muzzle flashes are hella blinding, and the sheer amount of fine motor control you need just to shoot your gun makes you viscerally *feel* the way a gunfight might pan out. Obviously, BSG needs to strike a balance somewhere between realism and gameplay, and to be frank, I don't think that balance is correct - but the reason I come back to this game despite its many flaws is because it provides that rush that no other game does."
renaldomoon,This is an incredible game when you first start playing. Enjoy the ride brother.
hansnicolaim,"I used to frequent this sub a bit but everyone just complains about shit now, thank you for sharing something positive and welcome to Tarkov."
areies88,"A good tip I was given when starting out was watch Pestily raid series on YT when not playing or off time. I started on customs but as people have said its more PvP focused then woods. Felt that was helpful as the main thing that gets you killed is PvP (altho scavs can be nutty) also if you have 2 monitors its a good idea to keep a map open on 2nd monitor as a guide to learning maps. For some maps that are more intense like reserve, maybe do an offline raid and get a feel for it, then scav it afew times before taking PMC in. I know thats super cautious but map knowledge is kind of king in this game."
immigrantMentalityZ,if u play a lot u will get better
KingintheSouthLA,"I went to fortress for the first time this wipe as I’ve finally gotten over gear fear and started trying to engage in PVP more.  I killed 4 scavs and a usec and almost won another fight with 2 bears.  It’s the most fun I’ve had this wipe after avoiding fights wherever.  I’ve lost a few fights which is frustrating, but it’s the most fun I’ve had in this game since I started in January of 22."
KnightsWhoNi,my number 1 advice: Get off reddit. You will find nothing but grief here about problems you don't realize are problems.
AntiSocial1313,"Like many others have said, it’s important to slow down. Tarkov being a fps game some people tend to run around like it’s call of duty and you’ll learn quickly that it’ll never work out. Focus on rotating during gun fights and slowing your pace down. It also helps to get in some discord groups and find a group to play with around the same level. Running around with someone a little more experienced willing to help you out makes the game so much more enjoyable. Finally, using your scav to learn maps is a good technique as well; having the map with the extracts up on your other monitor or phone is what i would tend to do when learning the maps. Starting out i would run my scav then while it was on timer, run my pmc to get quests done. Feel free to pm if you have any questions or wanna play sometime!"
Scavwithaslick,"Get something called the Kedr from prapor, any ammo works, aim for the legs"
Tremulant887,"I've been playing off and on for years and I still suck. I get an ego when I scav and run straight into death, then my asshole clenches so hard I pop a hemorrhoid when I PMC... Like oh man, don't wanna lose my 50k kit!

Keep on rocking that shit. It gets better. Not really but we stay positive."
JustMattLive_Twitch,Honestly bro you just got to keep playing the game and you will get better at pvp slowly its one of them things ive had this game since 2017 and im only just getting the hang off pvp knowing when to push when to retreat sometimes its better to run then just keep the fight going
AlwaysSunnyInTarkov,"Don't pay too much attention to the amount of complaints. The game has some big issues, but people are much more motivated to write up a post on reddit when they're unhappy than when they're happy, It's like reviews in the service industry. Enjoy your raids and good luck!"
Trill__,"I’m not sure if anyone has said this but I lived off of the Pestily Raid Series on YouTube when I was a new player. I still tune in every new season he puts out because early/mid wipe are my favorite aspects of tarkov.

I’m glad you’re enjoying it man. I wish I could go back a relive some of those early tarkov raids, they were the best."
OverBand4019,"Your not a pussy for leaving, it’s a tactical retreat."
CptBartender,"> after killing 1 scav and boy was that a rush.

This *rush* is exactly why we all [endure constantly being punched in the dick](https://www.youtube.com/watch?v=NzaNzJnh9l8)."
TheTrueQuarian,Terrible paid shill go away
GibFreelo,I'm a returning player after not playing for a couple of wipes. It took me an embarrassing amount of raids to start reliably killing PMCs again. After playing other FPS games it's muscle memory for me to go for headshots. I had to retrain myself to go for legs with shotguns for example.
Careless-Culture3305,"Just some advice from a veteran, I am level 42 this wipe. 

Do not take in valuable gear with you early wipe. The game runs rampant with cheaters and the second they see you have something they want you will instantly die.

Wait a month or so."
No_Interaction_4925,That experience is why I call Tarkov my “crack”
pylorih,Last time I got in a knife fight in Tarkov it was quite the rush - I got killed :(
TheBeanlettuce,"Hey brother, I just want to say it gets much much better as soon as you have map knowledge. There are apps on the play store, the one I use is ""database for tarkov"", I recommend it"
That-Albino-Kid,Use your scav to learn maps. Have a map up on your phone or a second monitor. Enjoy :) you will now be ruined for all shooters.
Saucyminator,"This game has very high ""highs"", there's no FPS game out there that can top it.

That said, I recognize the game has its issues and needs to be fixed/worked on.

Last time I played was 2 years ago and started again this wipe, I'm just a filthy casual. But so far it's been fun!"
keenhydra93,"You got the first objective, survive"
aSexyWaterScorpion,"Not to be that guy but dumping a full round of pistol ammo into a guy, missing most, is the epitome of an oxymoron lol"
BGPIFF,I’m a noob too. Wanna play together?
razor_sabre,Lol I’m so glad you are having fun. Great to hear
TheDutchDemon,Give it a few wipes for the resentment to set in...
omegapenta,i will message you
TuestoloP,Welcome to tarakovya má friend :D i hope you like it
fentanyl_frank,If you're new you should just leave this reddit tbh. It will ruin a lot of your enjoyment by pointing out everything that's wrong. Just be oblivious to it and have fun learning this game and all its weird quirks.
BloudinRuo,"Pestily just posted a video earlier where he talked about survival and extraction rates. 13 players per raid, 3-5 manage to extract, being one of those players even 10% of the time is doing well. 25% is amazing. I had never thought about it that way, but its true and it changed my perspective on survival rates.

Yes you've died 4 out of 5 raids. But that one raid you didn't, you were in the top 25% of that entire raid. Good job!"
StealthCatUK,"Keep going. Let's see if you say the same after 12 months when you die to stuff and understand that you probably shouldn't have (dsync, rubber banding).

And the BS quests you gotta do."
ClassicallySkeptical,This guy gets it
schlosoboso,the game is good despite the changes BSG has made over the last several years- they struck gold and no matter how much they try and bury it people keep looking for the gold.
Franklin_le_Tanklin,It’s an amazing game. Most people on here are snowflakes and don’t understand we are beta testing.
hondajvx,"Get off this subreddit as fast as you can. 

People here wax poetically about old wipes and how fantastic the game was, but in reality this subreddit was still a bunch of yammering bitches complaining about everything."
MisquoteMosquito,"Also, check out Zero Sievert!"
throwawaypoopgarbage,"This is the best game I've ever played, enjoy it my guy :)

The things people bitch about on reddit won't even cross your mind until you're nearly 1000 hours deep into the game, pay it no mind."
Aceylah,Everyone rats around to learn the game. Took me a long while to start confidently taking fights. Good luck!
LiveTheDream24,"I am envious brother. I remember that feeling and its SUCH a good feeling. 

Make good friends with map genie, Tarkov wiki, and ammo charts and reference them as often as you need (I still use tarkov wiki DAILY 2k+ hours in)

For all its faults there isnt another game out there like this one."
NoAcanthocephala5350,Yea my first I think 5-10 raids there was just an amazing rush I didn’t know who was shooting me or from where but even dying was so fun. After that honeymoon phase this game becomes horrible. It becomes even worse when you stop reacting to deaths
Lumpy_Upstairs8879,Stat away from reddit and just spend your first wipe learning. Use the wiki for quest help. And try to not get diacouraged
-S0lstice-,Biggest tip is to never let the game get to you. Tarkov has super high highs and extremely low lows. When you are in those lows just remember that you can always bounce back.
AverageMetalConsumer,"I actually love the state the games in right now, and I honestly think it's main problems are audio and cheaters. Other than that I absolutely love it."
Laittl,If you are interested watch pestilys raid series it really helped me a lot to understand the game more
CleatusCuckholdJohn,Glad you're liking it.  I reccomend grinding factory if you want to get better at pvp
Eduardo_Delgado33,This game is addicting but super punishing to new players. I still remember I almost quit the first week because I only extracted maybe 3-4 times Throughout the entire week. This is my second wipe and my survival rate is 60% which is a huge difference. It’s get a lot better once you learn all the places or good loot and maps and just overall become a better player. And welcome to Tarkov it’s gonna be a lot of rage inducing butt clenching satisfying moments.
Wisemagicalhags,i've always said that this game is the only game that gets my blood pumping anymore. after gaming for 10+ years this game never fails to give me that adrenaline spike
Alone_Manufacturer66,"There are way more complaints here than actual problems with the game. I’ve played almost since launch. It’s come a long way and is super enjoyable. 

I also had a pretty steep learning curve at the beginning this was also the first pc game I ever played. 

Helped me to play with a friend I think so we could learn together and both bounce different ideas and tactics off each other.  You’ll also find just time in game will help. Biggest tip I can give you is if you get in a fight don’t just stand there and try and shoot quicker and more accurate. Move around and keep them guessing."
rakraith,"You're not a pussy. 

start with small raids. 1 objective, then leave.

little wins go a long way. 

enjoy the fear, the immersion when you're new is a once in a life experience."
Sazbadashie,"So... don't listen to all the bickering here, use it as knowledge to understand the situation but after that go nuts have fun for the sake of having fun win or lose, don't get caught up in the rat race.

Welcome to the game"
H1GHF1VE_,"Oh man I love the rush and progression from this game. My first raid years ago and getting killed instantly. Finally extracting. Finally killing a PMC. Killing multiple pmcs and extracting their gear in one raid. Each step you get a little better. Many wipes later I’ve got like 30 pmc kills in like 60 raids, 60% sr as a solo. Never forget where you come from, Timmy."
tacticalxzebra,This is so similar to my initial experience lmao. Have fun and stick with it!
niarferf,W
janksnake,"Hey fellow first wiper, I'm also having fun in Tarkov :D

It clearly has it's issues, but I havent been playing long enough for them to become obvious or painful yet.

For now I am really just enjoying exploring the game and starting to learn the maps and all the various mechanics.

I've played a lot of games. In my experience, there are no games that do not suffer from bugs, performance problems, design decision flaws and all of that stuff. That's just how it is.

Anyway, my begginer tip from a beginner to beginners I learned from not-beginners! -

practice using your preferred loadout in offline factory raids, with scavs on horde, tagged and cursed if you want immediate action.

Up the difficulty of the scavs if you want more challenge.

It's a great way to get better at Tarkov movement and engagement and learning how to use your guns effectively.

Also, scaving a fair bit initially on maps you know you're going to spend some time on is a great way to learn those maps and pick up some tastey loot on the way. Also helps you learn where the better loot lives for when you're doing your PMC runs."
KookyCrazyCat,I definitely had a very similar starting experience when first getting into tarkov. I joined the EFT offical discord where there’s definitely more then enough players for each map and you’ll run into people who are willing to help you in-game with tasks and basic stuff.
stride630,Knowing what items you need for future quests and hideout upgrades is extremely useful and will save you a lot of time. [wiki quest items](https://static.wikia.nocookie.net/escapefromtarkov_gamepedia/images/4/48/QuestItemsToKeepByBewserkVert.png/revision/latest?cb=20230111004511) and [wiki hideout items](https://static.wikia.nocookie.net/escapefromtarkov_gamepedia/images/5/5e/Hideout-Requirements-Items-to-Keep.png/revision/latest?cb=20220716162040)
JJdisco21,"Lmao this guys plays for 30 mins and gets a melee kill, I’ve been trying for a few wipes now"
Little-Ad-6332,Bring in extra mags and loose your melee slot
JmJ3106,"fellow beginner with survival rate of 30-40 percent,

&#x200B;

Go into the game with the mindset that ur gonna die so fuck it anyways.

In those (potentially rare) raids where u do survive, often you will leave with a few guns or items to add to your stash.

Insure everything, keep to budget guns and start playing as much FACTORY as you can. It's the easiest and the hardest map, but if u learn spots u can pile up loot!!! but also the most fun.

ALWAYS BUY HEADPHONES AND ARMOUR!!!!!

Final tip:

Find the secret caches on shoreline they are easy to find. seek a guide or pictures of their locations. They really have spicy loot."
Wunon,"And another ""durr me have fun, no issue with game, all complainer skill issue he he"" post from a completely new player. 

Play a few wipes, then you'll see why we complain."
wnukson,"Mine was different - everything is bullshit that needs to be read on wiki. Even simple quests are bullshit. No map no clue where to go the game requires heavy metagaming or wasting time to figure it out alone. Even those useless maps from traders arent accessible at first. Why would they do that? I don't know.

After you accept this fact then the rest is very good until you start seeing desyncs, cheaters, poor performance and other stupid decisions like some quests."
Minasmins,If you don't want to see all the negatives just leave this sub and join [r/tarkovmemes](https://www.reddit.com/r/TarkovMemes)
ElderSafe,"Trust me when i say: The more you play, the less you will happy to play it and still be addicted like a heroine junk in frankfurt mainstation"
AlwaysGamerQc,"Don't let those whining at everything ruin it for you. Yes, there are issues in this game but people here often exaggerates them or they just got unlucky.
Speaking from experience, I would highly suggest you to find a group of people that would take you in and teach you the ropes of Tarkov. There's so so many things that you can't know from just playing the game. You need to search the internet, watch many YouTube videos and have ton of experience. Starting to play this game by yourself is very very hard"
CheesecakeDiscoParty,"Unfortunately the fun will wear off pretty soon once you realize how many cheaters plague this game. After they use radar and xray hacks to track you down, they'll get to choose between shooting you through any surface, flying around in front of you taunting, or just kill you with a command and you just fall over dead. Sadly doesn't seem like BSG cares about addressing the cheaters"
Dartiboi,"Keep it up, this game has so much to offer if you’re already enjoying it :) as for the negative posts, just ignore them. This sub sucks honestly. BSG has made a ton of progress on development since I started playing. Tons of new mechanics, content, bosses, maps and expansions, etc."
