author,comment
pennyclip,"Scav spawns have been real flippin early this wipe! Streets and Interchange I might as well just be spawn killing PMCs as they load in. And not like here and there, nearly every single scav raid is like that. If it was more mixed it would be fine, but I feel like I'm just PVPing for high tier loot at that point with a shitty character. 

They certainly don't release a lot of opinions on the design. I wish they would. I feel like this is another case of someone thought player scavs early adds to the threat of the raid for players. It does, but not in the best way. If every corner is infested by someone who spawned in front of you with a shotgun it's just not that fun for players to risk any valuable loot. Which means more players fight less and get out of raid quicker. Feel like adding some thunderdick AI, that don't sit in a corner, around good loot locations with roaming is a much more immersive and fun experience.

Yes, I personally don't get TOO bothered as a PMC by player scavs in corners every raid. But your average timmy might be, and that's who we are all wanting to be in the game for more than a week."
straight_lurkin,There should be an 8-10min grace period before player scavs can spawn in imo but then again the first 10 mins would probably be super quiet until player scavs start spawning in again
qleptt,I lived for 20 seconds once and was killed by a player scav
Semper_faith,I thought player scavs didn't spawn until around half time into the raid..what the fuck
MrPatri0t,Get better. Player Scav’s aren’t that hard.
Khronus6,"I don't mean to sound like an elitist but I have scav'd once this wipe and last wipe barely at all. I've played 6 wipes total and the last 5 have ended with a stash value of over 100 million. A scav spawning i nat the start of my raids or half way through is all the same. Just blast them and loot them.

Against what is popular, I use the best flesh damage ammo 95% of the time so I expect to demolish every scav and scav player I see."
LinkinBreak,"I almost exclusively scav in on Interchange. When I get in and there is 35+ minutes left, I know I'm going to die from some random angle. Between 15-25 minutes is the sweet spot as I can still scavenge the map and still possibly find some PMCs to either kill or at least try to use the shared extract. Especially since I get more scav rep for the extract than killing them.

As a PMC, I don't want to have to deal with a bunch of other PMCs and a group of player scavs as well. That's just not fun."
Empty-Confection-513,"Spawned into a Scav on interchange last night with 37 on the clock. At that point it's not even fun for me as a Scav either, sure a lot of look but I spawned with a pistol and a Tbag I can't exactly put up a proper fight..."
ZeusDaMoose,"This is tarkov, home of the scavs. Why should you, the trespasser, get a free pass to roam their streets without restitution."
uniqueeveryone,i read somewhere player scavs spawn as soon as the first pmc dies
PckMan,"They're not free high value pmc runs. Whenever I spawn in early raid as a scav I'm pretty much certain I'm gonna die and try to avoid high traffic areas for most of the raid to hope to get out alive, and usually I don't. What's a scav with a clapped out gun with shit ammo gonna do on a fresh raid? Unless you're a very good player, the answer is not much. The chances are that if you spawn in early raid the high value areas will be full of players and you're at a disadvantage. And if they're not? That comes down to luck really, some times nobody goes there because everyone thinks they'll be highly contested and assumes chads will be there, but that can also happen joining in late raid. I've found good loot in high value areas as a scav joining near the end many times, it's just pure random chance that nobody went there."
Prestigious_Body_997,"Not to mention that the scavs are spawning in new spots. You think you are fighting pmc only to find out at the end it was a scav. For instance, woods between the crumbling wall and bunker near the UN exit. And, these scavs don't miss at night."
Nokami93,On Streets are scavs literally spawning with PMCs it's absolutely hilarious.
Significant_Lime7370,"Unrelated vent, was on customs upstairs Crack house and got hole punched by an ai scav who put one through my class four chest with the mount MG through the green glass lol. About 1 min into raid"
Separate-Advance-453,This has to be an easy fix for them to implement - agree though scavs should be getting the last 11-13 minutes max on raids. Those that have awful rep bc they’ve been on killing sprees should get 3-5 minutes
BlackPrincessPeach_,Ur right player scavs should spawn in the millisecond a rogue dies and on top of the corpse.
ke2_1-0,Probably a result of the community trying about to long scav matching times  no?
Aggots86,"That’s the main reason I don’t play pmc or scav on lighthouse. When I’m a scav I don’t want pmc’s and when I’m pmc, I don’t want scavs!"
Cpt_Garlic,"Weaklings die, big deal"
Maxalite,I’m suprised you even stay that long. I do my quests and go to hotspots and get out. I understand when you have a long gunfight with other PMCs but my thought process to this game is get out before the map is riddled with scav players
robinjinxed,Gotta git gud! I actually like that player scavs are loading in quicker gives me a chance to get some more loot from spots they’ve visited and nothing decent gets rammed up their butts! Plus they have inferior gear with inferior ammo. PMC should clap player scavs 99% of the time. Higher fence rep should give longer scav raids else what’s the point! I rarely scav but prefer killing players in PvP whether they be player scavs or PMCs to killing AI.
Spitfire15,There's bad guys in PvP shooter game :(
Win_98SE,Bro you can fight player PMCs at raid start but not a player scav? Major cope post
jsylvis,Waaaah
CarlosMingos22,I like to camp on the outside corner of oli looking to emercom and all I kill there nowdays are player scavs that sometimes appear even before I can get comfortable on my rat spot.
Marvelous_Mushroom,"Honestly I would be okay with them getting rid of player scavs. Only running scavs because I was too scared to pmc was one of the biggest hurdles to getting better when I was a new player. I’ll bet the average gigachad per lobby count would go down a bit too, since they would be diluted with scav mains forced to pmc."
lucasantarella,Sounds like a skill issue...jkjk
CoatAlternative1771,I just don’t think scavs should ever have potentially first dibs on loot.
AgileSatisfaction260,There has always been a chance to get in as a scav fresh like that it’s tarkov expect to die
Cptnslapah0e,"Streets difficulty reads “insane” so if you aren’t ready for it, go play a map that says “normal”"
