author,comment
PureRushPwneD,"I've been saying this for a long ass time, **tarkov needs a replay system**

Had a dodgy death? or just wondering what happened? Well how about checking it in a ""theater mode"" like in call of duty games? once the raid ends, you can just go in and look at the raid from anyone's perspective. That solves literally almost every issue regarding cheating, as local replays with shadowplay etc. doesn't help shit. 

Personally in games, I very rarely report people. Games that have chat where someone's being a massive racist/homophobe etc. yes I will immediately report them. Anyone else being salty and toxic? I can just fucking block them if it upsets me, it's that god damn simple. People that just report everyone because they're salty need to re-evaluate what is **actually** worth reporting. The quick report button after dying in tarkov is too fucking quick, it means too many idiots will just go ""oh yeah he's hacking because I'm salty. let me just press this button as it only takes me half a second""

Ever since I saw people getting falsely banned in tarkov I've legitimately been scared for my account, as it seems to be very easy for them to just dick over a loyal player who's spent countless time and money on their game. Only way for us to actually be heard, is to hope it gains traction on reddit like this. But then the mods come in and lock the posts and shit (:"
ASDkillerGOD,"This is a gaming issue not a developer issue tho. In almost every game you can be permanently banned any time without any reasoning. Sadly most people arent very smart and downvote similar posts with a nice ""haha you deserve it cheater"" comment. With this mentality nothing will change."
Fr4rion_,"Im safe cuz im trash, I can kill nobody"
anythingfortacos,No. I am just starting to improve on PVP and now I feel like I can be banned for legging someone w 7mm
sulowitch,just dont kill streamers and you will be safe!
umpekakana,"I'm going to probably start posting this on every thread like this.  
  
Stop playing, stop watching streams, and stop watching YouTube videos.  
  
This is so incredibly common in the industry. Want the game to get fixed? It needs to start to die."
abtei,"> BSG really needs to start communicating with their player base or this will go downhill pretty fast as with other games that abandoned their players and kept them in the dark.

I legit seeing parallels with how World of Warships handles their community, representatives and state of game.
Hind, not good."
marniconuke,"the fact htat only streamers get access to proper support it's what irks me, aren't we all clients?"
MateriaLintellect,"I one tapped a PMC doing Tarkov shooter pt. 1. He was full Chad, lvl 4 helmet, level 5 body armor. Straight up just a ridiculous lucky shot to his face with iron sights from over 100 meters. My first thought was, Am I gonna get reported?"
TheOriginalHealz,"The fix to this is being so bad you hardly ever kill anyone, so no one ever reports you and simply laughs. :D Fool proof plan i've come to realize."
Ohertek,"I have EOD, helped a friend get EOD as well, bought game for GF, 3 friends standard. Its infuriating this is happening

I m lvl 7, usually play with bullets that make heavy and light bleeds, like HP and I play on sound and take my time, can't move fast, small space for mouse, small office

To get banned due my playstyle, desync  or kiled wrong person  its crazy"
DarthSkath,Nope which is why I’m not playing right now at all
coxamad,thanks god I suck at this game so Im safe (i guess?)
devon223,"Sad truth is BSG is a small indie Russian studio, they aren't going to change."
imdeadinside420,"download obs and record every play session you have on this game from start to finish. will it be enough to convince bsg you werent cheating if some fuckshit gets you banned? maybe not, but its better than nothing"
PckMan,"I'm not worried. I can barely kill the regular dudes I come across, how would I ever kill a streamer."
HappyLife94,I don't play atm because I fear my account. Doesn't feel safe.
larrylee13,Hutch who plays with summit did this exact same thing. Said he’d have the dude banned in 10 minutes after being killed. All streamers do it.
beensoko,"Buy cheap rus accounts for $15USD, worry less."
WrangleRdod,The reality is they are in a club and we are not a part of it.
fredriilf,"someone gained access to my email and eft account and started logging in from ip adresses in russia. sent a mail to support to have my account frozen so i could change all passwords, never got a response, a few days later account got permanently blocked, presumably because someone used my account to cheat. tried to appeal it with no luck, 100 euros down the drain."
kUdtiHaEX,"Our accounts are safe as long as we do not interfere with the primary driving force behind Tarkov - streamers and (probably) cheat sellers.

&#x200B;

After this shit fest, there is no one that could convince me that BSG is not, on purpose, avoiding dealing with cheaters and cheat sellers. No. Way."
Nuggetsofsteel,"The short answer is no. There is a lot risk that you will be left out to pasture by BSG. They simply don't operate their development of the game from a perspective that providing their players with a stable working product is important. That clearly extends into account security and review.

And the real kicker is how a big component of the vocal community has helped foster an environment where BSG can be totally complacent. I mean, just look at the reaction to the Rengawr twitlonger. Yes, he acted like a complete dick getting the guy banned and his initial responses on the matter were out of touch. Regardless, in the twitlonger he apologizes, takes responsibility, and says he won't use the system going forward. That being said, if you go to comments you have swarms of people acting like he didn't apologize, putting all the blame on him, etc. Very few people put any blame on BSG. This is a BSG system, and a BSG decision. Yes Rengawr was complicit in that he pushed this through that system, but it is insane how few of the comments actually point the finger at the party that ultimately hit the ban button."
5BPvPGolemGuy,Today I turned on EFT after 2 years not playing. Only to find my account banned. GGBSG.
lithium500,Personally I’m bad at the game so I think I’m safe
TheSpitterOne,"Have the russkies from bsg not addressed the issue yet? 

The fk they doing, fighting on the front?"
Bl1ndVe,It is pretty crazy that a company can charge 140$ for a piece of software and take it away with any concrete proof. GET A REAL ANTICHEAT not this BATTLEYE SHIT
Rokto6,"No they are not   
I got a 60 day ban  
didnt recieved any answer or a reason for my ban  
Never cheated ,I mean my Account had a 40% surv rate and a shit k/da and over 1500h of Playtime  


This ban is stupid , I mean they gave me a 60 day ban ,so they want me to play again after the ""punishment"" and then I guess to behave better ? but I dont what I should change to not get banned again, to meet their expectations of playing"
Lopsided_Pension8724,friend got banned after not playing for 6 months
ZlNGlEE,"Our accounts have never been safe…

My mate, just last wipe, had his account stolen by a hacker who then proceeded to get my mates EOD account banned. BSGs response to my friend explaining the situation to them was “Too bad, your account, your problem”.

BSG does not give a fuck about this community unless you are giving them free promotion, like streamers/YouTubers…"
Medium-Argument908,"false bans happen in all games you couldnt name one game that doesnt have false bans

they should just make this game super hard again and let t0he streamers bandaid all the booboo"
No-Concentrate641,I bought a 13900k and a 4090 to upgrade my PC to play tarkov at 4k native. Installed it and next day im 60 day banned. I dont get it
Mad3yez,I know mines safe cuz I can't kill anyone
WorldlyDivide8986,"Well, feels like we are all just talking to ourselves."
DiffuseMAVERICK,"I use to stream a decent bit. No where near a point where I had any power to get someone banned or unbanned. But I had a viewer come to me and tell me he got banned, and BSG wouldn't tell him why. Around that same time which was this time last year a lot of people were getting hit with bans hard. It put a bad taste in my mouth so I kinda just quit playing EFT. My viewer never was unbanned and he never found out why. I've been playing DayZ more and honestly enjoy it more than EFT."
Kestrel1207,"Uh, no, they never have been. It's not like this is something new lmao. People acting as if this is the only type of false ban bsg does. There have been dozens and dozens of threads of people losing access to their accounts and customer support being a complete brickwall."
Roman576,"well. Fun part this is basically how things work in russia. You have a vluable position (or you are valuable for somebody who is in power) - you have connetions in gov oranizations. E.g. in police department, you tell that you want someone's business to be shut down across the street cuz you lose money - it happens. Interesting that this mentality transfered to a game where people that are more valuable for game dev can do things like these"
radeongt,I refuse to believe people who say their account got banned falsely. I have seen so many say that just to find out later they were just cheating.
TheMrSanta,"How do I get unbanned, I got random error 229 permanent account block, I even paid for edge of darkness account, can I get my money back if I can’t get unbanned"
Matiasfrodr95,"we still dont know if the guy was cheating or not, devs didn't say anything"
