author,comment
jarejay,"I’m going to have to disagree here with a wildly unpopular take. 

The majority of the player base seems to think this game is about combat; about killing other players. 

I think this game is about survival. 

The thrill of “escaping” (the fucking title of the game, let me remind you) with that one item you need to finish a quest you’ve been on for 4 days is so much greater than just killing a dude with an AACPC and a 7.62 MDR, at least for me. 

The way I play the game is goal-oriented. Sometimes I work on tasks to get PMC kills, and in those cases I’m incredibly battle-hungry. If not, I’m just trying to get what I need and get out without taking a bullet to the bucket. 

Some of my raids are 7:04 long, but award 15k exp because I did two quests. I get back in the game quickly because I didn’t loot a bunch of garbage and my servers are selected correctly. 

Basically, the more stakes there are, the more it sucks to die, the more the game feels like actually trying to escape a hostile warzone instead of just playing CoD and shooting guns at people for fun. 

FiR status makes that possible, while still allowing us to have a secure container. They could remove FiR, but they would also have to remove secure containers and the Flea to make it still work the same."
VittorioMB,Disagree. Don’t miss the filthy hatchet runners
ShaddyDaShadow,Pre flea market was peak tarkov
Puzzlepea,"I have to agree partially, I think old Tarkov was peak but not maybe for the reasons you mentioned.

I started playing Tarkov when reserve was released and the wipe after that was peak for me. Being able to carry whatever you could Tetris into your bag without being weighted down was so good. Being able to find 1mil+ in marked room from a weapons case was too great.

So many good memories on raids where we find these massive ticket items and you want to survive. So many awesome fights over marked rooms. I haven’t really bothered trying to buy marked keys since then"
Ch1naNumberOne1,I fucking called it when they made the FIR change. Everyone downvoted me. I hated this change from day 1. And I still hate it. My opinion means nothing and I get it. Just yelling into the void.
FrozenBiceps,The last wipe that you could sell and buy everything on the flea market was the wipe where all  my friends (we had group of like 10 people) used to play 6-7 hours a day cuz it was so much fun after that wipe only like 4 stayed to barely play the next wipe (where everything had to be found in raid) and nowadays not  a single person plays. We just occasionally check this reddit to see if they remove endurance strength or at least revert them back to what they used to be. And also make everything sellable/buyable on flea market like it used to be.
theEdward234,"Absolutely agree. Fights actually meant something back then. Killing a couple geared players meant that you not only make your money back but you also made profit. Most importantly it did absolutely NOTHING to the cheating situation. Even for quests it doesn't make any logical sense. ""Oh sorry I can't take this labs card that you bought, I need that old and nasty one you got from a scav"" did the game have its issues back then? Yea of course, but I would take that tarkov over this one any fucking day of the week. I am truly angry because of BSG running the game into the ground. It's 2 weeks into wipe, 90% of all the posts are negative here, a crazy amount of players already stopped playing, even drops aren't helping, and what do we get from BSG? A fuck all. Their stupid secrecy, the not telling anyone anything, thinking that it's cute and fun is absolutely idiotic. A proper and competent company would bother to learn how to communicate with its customers but no, not bsg. ""Ignore everyone, never admit wrongdoing, ruin the game"" has to be BSGs new moto."
Legendary_Lootbox,"Glad you and many others agree, PRE-FIR Tarkov was best tarkov. 

I used to really love spending hours working on the market, flipping items and letting the rubles pour in, to then go into a raid kitted with friends and just enjoy myself while not having to worry about anything. And It was not that I was OP in any way, I ran LVL 4 armor with an AKM PS rounds so, but back then 7.62 PS was da bomb"
Youdontknowmypickles,"Very strong disagree. People forget that traders would stock up and **immediately** be out of necessary items. Hatchet running made maps die too many times. GPUs were going for 500,000+. It was a shit show. FIR makes the game more tactical and playable."
Dangeroe,But you are assuming that Tarkov is all about fights.
Midgetben1234,I just shot a scav in the face with a Mosin and he turned and looked at me and bam head eyes thats enough tarkov for the week
Subsonic17,Pre sweat streamer tarkov was peak. Just zoomers now
cyberattaq123,"Agreed. It was nice to find your quest items in raid but it was also awesome to be able to just buy them from the flea market. Flea should probably be behind level 10, which is a relatively easy time commitment that most people can hit if playing consistently.

BSG has crossed the rubicon of Realism and Grind versus Fun and Accessible and the game is suffering for it. The game needs to have a gameplay loop to keep you engaged, but in my opinion the loop shouldn’t be grinding skills and traders so you can craft/mod an actually decent gun with bearable recoil that’s using ammo that will actually pen the Chads’ armors their using.

Tarkov is a daunting task now, and god forbid if like me for the past couple of wipes you come in late. There’s no chance. Sure the early game quests are basically totally abandoned and empty for you, but your weapons, mods and skills have no chance against the level 50 professional no lifers of tarkov.

The games time commitment is simply just too high to make any meaningful progress. Maybe when or if the full game is out and progress is permanent and drastically different (if this ever even happens) it’ll be better. But currently with the stage the game is in as a whole with wiping every six months and BSG continually adding more and more roadblocks and things you need to do, it’s just too much.

It’s too many hours of commitment, even beyond games like Destiny 2 or other MMO like games. Realism does not equal insane grind and BSG just doesn’t seem to understand it. They add cool stuff like new maps and cool weapons and systems and then they do shit like lock flea behind level 15, implement found in raid, and more.

Idk man, ive been playing a lot this wipe and really enjoy it, but I wish it was better and that BSG would address the issues the community has instead of just blindly pushing forward and continuing. But whatever I guess, it’s their game right, just don’t play if we don’t like it. /s"
plagueapple,Sounds kinds shit. Didnt play then but without fir but wouldnt lot of the progression of the game be gone and finding an item you needed wouldnt be anything important if you can just put it In a secure container.
raxel82,About two wipes ago was peak for my group. No FiR. Flea at 10. Btc farm worth it. So much fun.
mmpa78,Fuck Found In Raid. FUCK Found in raid being taken away from item in your safe box when you die.
pennyclip,"Yeah it was 100% better with no FIR requirements. There were so many more people fighting back in the day. All these systems to either punish new players or restrict how easy bots/cheaters have it just make it worse for everyone. Seems like a failure of incorporating many different viewpoints in development. 

There were issues of course, like butt running was insanely popular on interchange. I think there are different and better solutions to that problem though."
ShiddyWidow,100% it was peak Tarkov.
dendofyy,"Honestly I think the main issue with FIR quest items is that the items it asks for are generally (sometimes very) rare items, especially at the start of wipe. I personally think it works great that you HAVE to take out the item correctly to be able to hand it in, but lord knows I’ll be crafting flash drives before I ever get them in raid…

It’s also just unintuitive for new players, “find 2/3 of these rare items, in *some* location, without dying on a map that you don’t know, surrounded by people who eclipse you both in equipment and knowledge.”, I’d be very happy if they replaced ONLY earlier Find and Transfer story quests to the type where you pick up a quest-only item, like the bronze pocket watch. More intuitive and teaches lil’ Timmys’ the maps"
koalabat,"100% - honestly tarkov sucks now.  I play it early wipe, only because it's fair for a couple weeks.  Then the gap widens and it becomes pointless and not fun.  I also feel like it goes against the 'spirit of the game' that got me hooked on Tarkov.  The exhilarating feeling of finding something valuable and making it out.  

Back when they implemented the NightVision being un-pouchable was super dumb.  They did it to stop people from using Reap-IR and then pouching it while not in-use....fine...make it so you cant pouch things that you brought INTO raid.  

Pre-FIR was 1000% better because just like top-comment said...it put everyone on an even playing field.  I still haven't read a single argument that this system is better and the 'it prevents cheaters/abuse' is absolute hogwash...its a fucking lazy argument and tbh it makes me kinda mad the developers because they seem to have endless time to add dumb shit to the game, dumb mechanics, dumb weapon parts, and then they hide behind 'oh we have two teams' one for fixing shit and one for adding shit...well guess what - in my eyes you are ONE team, making ONE game, and you need to prioritize making this game playable. 

The theory I have in the back on my mind is kindof racist, but I think the team/developers themselves are behind the cheating in some way.  They probably sell the cheats, when sales slow down, they do a small 'fix' that forces the cheaters to buy something new.  I mean think about it....there isn't a logical argument for BSG's methodology.  It always creates more problems then they 'solve' and if it weren't for their influencer-approach to keeping the game popular, this game would die out and no one would return for another wipe.  

Personally - I would focus on making the game MORE accessible (ie. grow the active player-base instead of promoting this wipe-die out-wipe-die out cycle they have going that clearly doesnt work.  Do they honestly think people will ever treat this game like an MMO where they invest hundreds of hours to level up if they don't even stand a chance as a new player?  Flea market warrior style gameplay allowed me to introduce new people to game, and immediately gear them up to have a fighting chance (they still would get out-played, but at least they had a CHANCE)...that is ruined.   

Honestly writing this made me realize Fuck BSG - can't wait for a clone from a developer that understands how to manage this style of game.  

Dear BSG - thank you for creating what you have created.  But you need to start taking some steps towards listening to your community....it is your MOST valuable asset - the second twitch influencers get a viable new game, you will be left with nothing.  Just (take a look at the history of Heroes of Newarth and how LoL/DoTa destroyed them)."
Phishman9,Remember the old rush to reserve drop down room? That was so much fun!!!! Even if it was filled with hatchlings
Mr_robasaurus,"New tarkov is trying far too hard to cater to the pvp no-lifers who treat the whole game like one big battle arena, and the playstyle of pvp over everything instead of what made old tarkov charming."
frolie0,"This 100%. Even the fact that things lose FIR when they are taken into raid is stupid. I get it for your own stuff, but why is the gun I loot off my kill not FIR? Just a dumb way to slow progression."
EmmEnnEff,"Yes, hatchet running to tech loot that you'd stuff into your ass to sell on flea was peak gameplay. /s

Get your SR to above 30%, and you'll not have a problem with FIR and 'rolling RNG'.

> equal playing field

You know where most gear comes from, even for end-game kits? Vendors. Flea completely removed any semblance of *progression*, by making them irrelevant. If you want to play an arena shooter, Valorant is a much better game. If you want to play an arena shooter with Tarkov mechanics, Arena is coming out sometime this year.

> everyone that finds a expensive item or quest item will just avoid fights and try to extract as fast as possible.

Whereas without FIR, a pistoling or a hatchling loots an expensive item and may as well run into a scav to kill himself, it'll get him into the next raid faster.

People risking a pistol and a paca when going into raid, dissapearing loot into their secure container, and retaining full value of it when they die were a fuckin' plague. You kill them, and you get literally nothing."
dudewist2,I personally like fir because having a grind is fun
mikeinottawa,Uhm.... 2/3rds of the raids were just hatcher runners who died... it sucked.
Scav-STALKER,"I’m not going to change your mind, because you’re right and I absolutely agree. I actually used to have fun with Tarkov. FIR and flea market restrictions have made the game nothing more than a chore"
Dat_Innocent_Guy,Pre fir tarkov you could just study the flea market and make bank flipping high value items. Good old days. Could have like 30 raids and millions upon millions of roubles.
hellhound998,"It feels like we were all punished for the RMT Cheaters, I see no problem with rats, a rat finds 1 item that they want and leave, people who stay find the graphics card on the other side of the shelf that rats didn't check."
RobotnikOne,"Rose tinted glasses always in effect. 
All I remember from old eft is people flying through the sky one shotting everything on the map while immortal. The game is far more playable then it’s even been."
sidvicc,"Hatchlings were a far worse curse on this game than people remember.

People avoid fights now when they find FiR items? Well back then half your PMC lobby would be hatchlings.

What kind of PvP are you going to have when half the people in your match don't even have a gun or any intention to actually play the game."
juicebox_tgs,"I completely disagree, FIr for tasks and flea is amazing. It gives you so much more enjoyment and actually forced you to play the game.

The meta used to be just buying shoreline keys as a hatchet runner and then buying your way through the game. It was terrible"
Sokolberg,"I like FiR more. Back then I would spend an hour a day buying stuff in the flea cheaper and selling later on for profit. Made millions just sitting on the flea. Made no sense.

I think FiR makes more sense for the type of game EFT is. It’s not COD, believe it or not but a lot of players don’t care that much about PvP."
HellDuke,"For some people yes, for other no. I can never get behind the argument that ""people will find an item and will avoid fights and try to get out"". Well... Yes, why is this said as if it's a bad thing? A bad thing would be if there were no reason to avoid a fight at all. When ""shoot first, ask questions never"" is the only logical way to play then the game is going downhill in the wrong direction.

I like another argument with FIR that gets brought up. You can't just go around and sell the gear of your kills, meaning that unless you want to use it you just lost money on the bullets you used. My answer  good, then maybe don't use the bullets if they were not a threat and leave? Going after a fight and complaining that you wasted more money on ammo than vendoring the gear will get you is just like driving your car into a wall and then complaining that repairs are going to cost you money.. Now naturally sometimes you are the one that is attacked, but at that point it's not like the money spent on bullets is there to obtain value, it's there to make sure you are no dead. That completely throws any argument about selling the player gear out the window.

I will just re-iterate something that should be becomming common knowledge. This game is very often picked up by people expecting a game that EFT never was trying to be and should not become — a PvP shooter with some survival and looting on the side. If the one and only thing you come in is to find players and shoot them then all the game has to do is not prevent you from doing that, it does not have to make it easy or the best way to play."
Xitereddit,Nah fam youre insane
Core770,"Nah, pre fir tarkov was a cheater meat grinder with hatchet runners on top. Thanks but hell no. I'd love to play no flea at all but this won't happen most likely"
artosispylon,"i started playing right before FIR and i had way more fun, then every single wipe after that they nerfed players to the point i cant even go into a raid without being overweight and the inertia really is just dogshit."
jakelewisreal,"This sub used to bitch pre-FIR about hatchlings running to popular loot spots and getting it all, which means less actual PVP and less loot.

There’s no winning on BSG’s side. FIR was the best outcome to prevent hatchlings and keep PVP up."
Life_Extension_8258,i like current inertia tho
mackie5283,Yeah for sure nothing better then 80% of the server being hatcher runners.
Mr_Bleidd,The old pre market Tarkov was best
Fairwell08,It truly was. Laser M4s I will take back any day. I was toying with different builds in my hideout today. The AK recoil is so bad alita actually shocking haha and when labs had no key card. Everyone had the ability to run gear and play for what was actually really good PVP. The amount of rats now because of FiR and all that is wild (not complaining) I just would rather fight someone with gear than naked mosin or dick helmets and brown stock SKS.
Boreal_FarOut,"It was great except for such a lack in pvp, everyone I used to kill in resort was a hatchet runner that already had all the good rooms loot shoved in their prison pocket"
Fictitious1267,"Maybe if they removed secure containers, and gave us a secure docs case you can't access in raid."
josephtule,Used to love playing the “stock market” good times
NaNiBy,You shuldnt need FIR items for most of the quests. I have put 80 hours in this wipe so far and I wasnt able to find a single flash drive despite running reserve and only hitting cabinets for pretty much half this time
monet820,Best for tarkov would be removal of flee market.
Ranger1803,"Nah, buying through quests was stupid. Easy max traders in a week for everyone whos half decent"
HumaDracobane,"I think they peaked with the patch that added the SR25 and the X-5000, iirc. That patch also added the postFX.

The FIR was good when you couls sell anything as long as you had the object with FIR, that prevents from people just going arround shoving expebsive gear in the secure container and roll in millions even being killed. Yeah, some of them could run away from the map as soon as possible but was a good change."
xzGomez,Facts
TheHappyMile,"I think FIR and other ""annoying"" mechanics are good.

You know I am missing? The old ""spawn on one side, extract on the oder side"". :/ 

That was really great. Atleast on some maps like customs that rea really linear. Shoreline would probably benefit too due to one side being useless. Obviouly this would not work for maps like Interchange, Reserve or Streets.

And yes, it would meanless room for spawning, that's why it will never ever happen. I know."
AueR6,Yeah. That and many other bullshit changes like 5% boss spawn chance. This game has become more of a grind than typical Korean MMORPG. Imagine making games for fun...
DawSkii,"Nah dude i feel like they even should remove the flea cuz it breaks the game, but also make traders have more items for barter, and add more hideout crafting, then the game could be so much fun, but i think if they would do this they should make wipe longer, like 9 months or even a year for players to be able to grind it"
JVTAO,"Yeah, remember really good when I played before FIR, things like, ""wow, a gpu, this is much more value than the gear I currently have, just put it into my pouch and PvP now, even if I die, It will be worth it""   
Then, after FIR, whenever I played with friends, they started to say things like ""Wow, a GPU, I have to leave now the raid guys, and please avoid PvP"""
Cold-Produce4770,no need to change your mind
WhiteLightWarrior,"Not to mention you literally didnt even have to do quests.  I could just pvp and be better than everyone else, make 100 mil, and be a fucking juicer all wipe.  That was the dream. Now im forced to suck off these traders with lame quests."
Ziomkowsky,Pre flea market Tarkov was even better
N1LEredd,"Y’all forget that pre fir 80% of your server was naked guys hatched running high value loot spots - disconnect once the ass is full and sell it all, rinse repeat. 

We don’t want these times back."
zazasLTU,Pre-flea market. change my mind.
Psychological-Arm-22,"Nikita is in tears of laughter and wiping them tears with our money. Cash. 
- And let me tell ya he has plenty to wipe with."
InfantSoup,Peak RMT is different than peak enjoyability.
Remote_Age8506,100%
NabuBot,Old tarkov played more like cod while new tarkov is more like arma. Since the game is supposed to represent a hard-core shooter I think new tark shows that better even if there's a lot of drawbacks.
sanctionTheOrcs,I think about scav karma same way you think about fir.
nekronos,Before Fleamarket was best
Certain-Mulberry9893,"Yeah, def. Imo they should keep the fir for quests only, but let people be able to buy and sell stuff on flea regardless of fir. If they do that, then they should remove all the global trader limits and set personal trader limits for everyone and every item. That way you can buy off a trader and sell it straight to the flea for profit, but you also then have to wait until the next restock to buy it."
coolstorybro42,flea market is a scourge to eft and should be removed would make the game a lot better
oliot_,I think found in raid is definitely a positive adds way more risk and makes the game more intense. Game would be too easy if you could just stick anything in your gamma
DrMalware,I enjoyed it when we didn’t have med animations and you could just spam heal
DaBluedude,"Disagree.   I think fir adds complexity to the game that creates way more risk / reward analysis.

Tarkov was peak before dynamic loot. When key rooms reallllly meant something.

I like inertia, I like fir, I don't like whatever this audio system is, I don't like content over making the game run smoothly.    I don't like garbage servers. And I think the anti cheat is laughable.

If we made the big change to register player movement on server side, then why are there still impossible movements happening from accounts that aren't insta-banned?"
SUNTZU_JoJo,Nahh...pre flea market days was peak.
OscarPapa1,Pre flee was peak
Mikey3DD,"I'm gonna throw my 2 cents in. So most people who pay for RMT or carries, and I am making an assumption here but I feel a reasonable one from previous discussion that have been had. Most paid carries and RMT transactions are likely carried out by people who have lots of money, but little time. People who want the best loot, keys and gear, but don't have all the time in the world to get them. People that are bad at the game and don't have the time to put into getting better.....

Well hear me out... Surely every single decision BSG make that makes the game more Grindy, and even harder for casuals will drive the rate of paid carries, RMT and casual cheaters UP, not down. The more of a timesink the game becomes, the harder it is to aim and shoot, the more these people will use artificial aids just to play the game and not continually get shit on. 

I believe the decisions they are making to combat cheating at having the exact opposite effect."
BigAsian69420,"This is very true, tarkov now is just dull. You can actually test this out, go back and watch any tarkov video pre found in raid or pre inertia like landmarks lab video where he brings in like every case and feel the feels."
tacobellisdank,I agree.
Not_B1M0,"so sad i missed it
pretty sure by one wipe too
so many people want it back too but bsg doesn’t care sadly"
Paythunder4,I agree
shilunliu,yes this is what nikita wants the less fun the better
MyHouz,"Agreed. Personally, I also loved the one or two wipes where there was FIR but no restrictions on ammo, armor, etc. 

You could sell the 180 rounds of Igolnik and the Slick you just got off the raiders, which felt like a worthy reward, but there was no incentive to hatchet until you could shove a few GPUs up your ass.

My feeling is that the fewer the limitations on selling, the more fun the game was. Just me though."
h0nk1337,"Hard disagree. Just buying stuff for quests was boring, the little dopamine (or endorphine? serotonin? idk) spikes when you finally find that third gas analyzer or whatever you're currently looking for and the increased thrill of making it out alive because of it are much more engaging.

Personally I'd just completely abolish the flea, piecing together a decent gun with stuff you found in raids is much more rewarding, at least to me. But I realize that not everyone feels that way."
Moeswack,"Say what you want but cheating is much much better than it was back in the day, but old tarkov was best tarkov 100"
lnfestedNexus,i miss pre fir.
