author,comment
malapropter,"Oh, I can answer this outright: no, your account isn’t safe. 

I had my account falsely banned at the beginning of 12.12 along with a few hundred other players because we all had the same MoBo. The response from BSG: “we can ban your account for any reason at any time without telling you why. Get fucked, cyka.” I’m paraphrasing slightly, but the general thrust is there. The language in the EULA is quite clear.

“ To restrict or terminate the User’s access to the Game on the conditions hereof, including if the User violates the terms of this Agreement or the Key Documents. In exercising this right, Battlestate Games Limited is not required to provide the User with evidence of the breach by the User of the terms of the Agreement resulting in the User’s access being terminated or restricted.“

Ironically, considering the throbbing hate boner this sub has for streamer privileges today, the only reason I’m able to play is because we caught the attention of Pestily who brought it to BSG’s attention."
DickeTitten69,"No they are not. Furthermore, I’m shocked BSG’s user data hasn’t been breached yet. Maybe it has and they haven’t reported it. Why would they. They seem to lack rules in their neck of the woods."
Secuta,"Dw as soon as the next big ban wave hits, there will be another 75% off if buying eod 4 times"
D0LPHUS,"I know for a fact my account is safe.

I can't even kill scavs without dying.
Now if that's a good thing, I'm not so sure"
Scarity,"I have several friends (4000+ hours), that almost report EVERYONE who kills them. It's fucking annoying to look at, because it makes me wonder how many 10+ times a day I get reported, since I blast factory and sometimes get 20+ kills an hour.

I sometime stream on twitch, with no cam, no voice, just to have some sort of 'record' of my games. But even then, getting unbanned seems impossible, even with proof.

I'm super glad you made this post, I feel the exact same 'stress' you talk about"
Minimum-Impression63,We are dealing with a Mickey Mouse company. This is par for the course.
Ovnii3,"I want to say 2 things

1. No, our accounts aren't safe.

2. BSG needs to wake up, and streamers could maybe get real one day and stop whining, they should realize that it's not cheaters that kill them, it's the shitty game tarkov has become (not that I won't play it lol). 

No, you weren't killed by a cheater through the wall, it's just the common desync.

No, the guy didn't tp behind you, you just couldn't hear shit with this audio.

Chill, this game isn't perfect dear major streamer, everyone faces the same issues that you do."
Solaratov,"Of course not.

Just look at the clowns on BSG's support team. They do nothing. They're worse than useless. So not only are we at risk of false bans, but we can't even appeal them."
Bheks,"To point out this isn’t the first we’ve had drama with a streamer getting an account banned.

I think it was a couple years ago, before lighthouse and when reserve was filled with loot. Tweak got merked by a player who was “teleporting”. The player was promptly banned.

The player was a small streamer/YTer (I don’t remember) who fortunately had a full recording of his POV and his end looked normal. So it was concluded that it was desync. Tweak ended up pleading for players case to BSG. So a much better outcome than what recently happened.

On a side note: I’ve been thinking about a most likely rare but possible scenario. Say there’s a cheater and they spam Player A in the head but the rounds don’t pen or just don’t kill them. A third non-cheating player B sees sees the fight and takes a shot at player A and it kills them. What’s player A gonna do? Report player B because it’s obvious that the way they died was a result of cheating. 

Obviously I’ll say, once again, that this is incredibly rare but possible. But taking a step back it seems like BSG have a game where even they can’t reliably ban actual cheaters vs. innocent players. 

The reality is that this game wasn’t built with cheaters in mind. The server sends all raid info to every client making radar hard to detect when ran through a second PC. Items being hard to acquire means the door has been opened for a lucrative black market. And now we’ve a dev team that won’t manual ban if a regular player provides concrete evidence but will do manual bans if a streamer sends a DM with no concrete evidence. It’s at the point where we’ve seen “white hat” cheaters who go around killing other cheaters so the lobbies are safe for regular players.

I’ve been playing the game for years on NA East. A region that’s typically the safest from cheaters. I can can’t on one hand how many times I’ve encountered a definite cheater. But now my concern what happens if I’m accused? What happens if I kill Landmark, Rengawr, Pest or Jesse? On top of spending $150 on EOD, do I now need to spend $100-$150 on 6TB HDD and record every raid? And just deal with the performance hit when I play Tarky.

And even with that setup it’s no guarantee that if I’m falsely banned I’ll get my account back. So then do I need hope and pray that I can make a big enough stink about it on Reddit and hope that the mods don’t take down my post? Right now I don’t want to play the game. I enjoy the game but I don’t want to risk being out the money. And I’m sure I’m not the only one.

Edit: Tweak got banned. Other player showed their VOD to BSG. Tweak was quickly unbanned."
eXiDeviiL,"I've migrated to SPT already, so much less migraines due to BSG's sheer incompetence or sweaty, ego-tripping streamers, also scavs can be made just as deadly there as this wipe's."
lupetto,"(this is a copy/paste from another thread, just to not type it again)

I also have a friend who has been banned a year ago (check my comments on this sub) under misterios circumstances (game ban, not BE ban for ""botting""). He had the bad habit of camping gate in Factory (bad habit = 30 times a day sometimes), stoped so many chads with the same saiga-12 with very little effort, with all this stories coming out (the admin banned guy, this) we wonder if that was the case (at the time we only speculated an error on BSG side). The guy is legit, he plays all kind of FPS and never had a bad track. 

This would not be an issue if this game actually had a costumer support. I remember one time I got permabanned from League Of Legends (i had the same account since S2 and never had a restriction of any kind, very rare for lol). Contacted support, replied within 20 minutes ""hey sorry, yes this is a big issue on our system, here is you account plus some stuff for the issue"" (they gave me 10 crates & keys).

Here the only thing you can do is HOPE that you make noise on Reddit to get an account back."
vgamedude,Bsg doesn't care about you or any normal person. This game is exclusively made with streamers and only streamers in mind.
infamous-fate,"No they are not safe. If anyone has access to your email your account will be fucking wrecked by them if they just spam different passwords. They dont even have to gain access to your account completely.

It was wipe day, i was so excited to get on after a year break.

I opened the browser and type in my information to sign in. Guess i missed one of the characters and got my password wrong one time. I got a 60 day game block until mid February.

Usually it doesnt give you game blocks for that long on your first mistake so someone knew the email i used for my account was compromised in someway. Support doesnt give a shit. I cant change my email. Its probably going to happen in the future if it really is compromised and it fucking sucks. My account has easily over 1500 hrs and ive been playing since it was publicly released as alpha. Goodbye eod"
fpslane,"Just a reminder that if your account gets banned falsely you will probably never get it back. I got banned over a year ago for running awakened poe trade in the background. I got banned for ""automation"" from battle eye. I had a edge of darkness account that I had played for a few wipes. Bsg will just ignore you if your not a big streamer and battle eyes support is non existent. It's so frustrating because if I could talk to a real person from bsg or battle eye I would be unbanned easily. All they have to do is see check that log from the anti cheat but since I don't stream $145 gone."
Grizz3d,"I'm still inexperienced enough that I don't think I'm even capable of killing a top tier player or streamer. 

Still, this is the only game where I always have Outplayed recording my gameplay 100% of the time as a precaution. I understand that many on this sub are tired of the subject now, but it's thanks to the outrage that a very bright light is being shone on this nonsense."
Leytarkhan,"I mean even when you are a streamer you are most likely allowed to cheat and not get banned for it.

There are numerous clips of streamers obviously knowing more than they should and they still play. I mean I remember a incident where a streamer litterally got called out in a match for using cheats by the guy who made the cheats as he claimed he can see the script running.

Strangely enough after that incident how the person played drastically changed.

I am convinced that a considerable ammount of streamers and a considerable part of the playerbase is cheating with either radar, some wallhacks etc. just not something outright obvious.

I am also convinced that the more people cheat and dont get banned for it more people will hop on cheats just to level the playing field. I mean we allready have cheaters that only hunt cheaters \^\^"
PoperzenPuler,"BSG is a Russian company. Russians associate the word ""transparency"" with a glass of vodka at most. 
That's why everything the BSG clowns do on the subject of banning is completely non-transparent. They constantly ban something randomly. The game has no replay function, not even BSG seems to have access to a replay. They just ban people like that. And if they can't get out of the number... no comment and ban is withdrawn. And here again... non-transparent. 
Sometimes I have the feeling BSG has banned at least twice as many innocent players as cheaters. 
In short... nobody is safe from BSG arbitrariness. Arbitrariness is a living culture in Russia."
SchurkjeBoefje,This is exactly why I never bothered to upgrade my basic game edition.
Leinharts,"I cant play the games for months now, i cant loggin because im supposed to receive a mail with a code but i dont have it. I check folder spam and numerous solution from reddit, nothing work. I also tried to reach support multiple time with no answer... im EOD supporter and i cant play anymore..."
mmoarpgfps,"Got banned at the start of 12.12. Whats funny tho is that it was a manual ban 229. 3k hours to the trash. Whats even more funny is that 229(manual bans) cannot be appealed or lifted(accordong to their own saying). But here we are, the guy the got manual banned got the ban lifted. While people like me and many others did nothing and still being banned with no way of recovering or appealing for the ban. 

If im not cheating and i still got banned i might better use cheats since, i will get banned nonetheless. Fuck bsg."
Hungry-Bullfrog-7887,"It’s rusian. Don’t expect a proper customer support and don’t expect it to not be corrupt. 
I just hope they will sell this game to some good developer who will fix it and release it."
FetishForSex,"Just stop playing the game. I know it sucks but this is not going to change. These developers do not care about players, they only.give a shit about people promoting their game, and it's not gonna change.

There are plenty of other Tarkov like shooters that give a shit about their players and actually look for Anti-cheat solutions instead of just whimsically banning people.

The Cycle and Marauders are two of my favorite you should go support."
Certain-Mulberry9893,"Thank you!! I personally feel that Rengawr is def at fault here for rage reporting through a more direct line of communication, but at the same time, BSG is at more fault imo cause they didn’t review the clip or any background info. Even though bsg is giving streamers the ability to directly report someone (which I think they should, because they will run into more cheaters since they play more), bsg should still take time to validate a streamer’s report."
MyluSaurus,"As a rat that avoids combats and fights with a Mosin most of the time
I hope mine is safe
EoD is expensive"
squidgamer420,"You just have to look at the stories about how hard it is to recover accounts when they arbitrarily stop sending recovery emails to certain mail servers or your account gets compromised.

Or the complete lack of customer support.

BSG in general has little to no regard for it's customers. They truly don't care as a business.

Streamers are free publicity so they get special attention. They've always given streamers free copies and extra gear, even before the big popularity boom in 2019"
Phantom7835,"Lost my account last wipe to an unexplained ban, had my call for help deleted here, and play every raid in fear I might get banned again on the new account"
GTCitizen,"It’s a russian devs, they do what they want"
WWDubz,"Mean while, the actual hackers have 9384839383738 LEDs listed on the flea and are not banned. 

People are literally flying around reserve wiping lobbies, not banned. 

Thank god I can’t drop a screw driver for my buddy, or the cheating might REAAAALLY be bad. 

The devs of this game are among the worst in gaming."
sashisashih,"im just here for the very polite reminder we bought into a russian videogame and for us westerners russian culture can be very hard to understand. if you need to speedrun some understanding, google totalitarianism, whats happening in the biggest country in the european continent right now and navalny; dont expect your european freedoms and rights when dealing with people who arent raised to enjoy those priviliges themselves."
Frosty252,"it's absolutely wild that BSG can just ban players with zero warning, and if you need support? good luck. this probably wouldn't happen if BSG wasn't a russian company, they can basically get away with anything.

fuck BSG."
iamanoob420,Fuck all these top streamers and their little power trips. Legit stop watching them. Unfollow. Unsub. No more support to people who can’t take a death like a regular player. Fuck anything anyone can come up with to justify these streamers into banning whomever they deem as “sus”.
FreakLikeChewy,"Streamers know this is a thing, but they won't say anything or speak heavily on it because it attacks the game / company that is pretty much making them money. 

We shouldn't have to go into a popular streamers channel to ask them to talk to the devs for us. That is beyond unacceptable."
beans_lel,Never have been.
WarmanreaperX,"They've been doing stuff like this since launch lol. every body was just on that massive tip of saying every false ban is a cheater, even when shown or disputed with proof otherwise."
Haydechs,I can’t kill anyone so I’m probably fine
Aluminarty666,"BSG don't give a shite about the game, nevermind the safety of your account."
Drpeppercalc,For once I'm glad I'm trash at the game. No suspicious activity coming from my account.
zero_tha_hero,">Streamer gets banned for whatever reason, looses gear, etc.? Solved within minutes to hours.
>
>Normal player gets banned? Enjoy ban for life.
>

This is in no way a BSG specific issue.  I got false positive banned by EAC (known for producing many false positives) from BF2042, and the response to my support tickets was effectively ""we do not make mistakes, go fuck yourself"".

Meanwhile, big popular streamer gets ban, tweets about it, and gets unbanned within a couple hours.

It's just a shitty fact of life that devs rely on streamers to advertise their games, creating a tiered system of support for players whereby the support they receive from devs is directly proportional to the press and hype they generate for the game."
ThorvonFalin,"If I get this right, either don't play or play bad is the only way to not get banned. I'm at no risk then"
Exo-Shvdow,i love that the last post about the guy who was banned thanks to that stupid streamer had the comments locked because “comments have resulted in insults toward others” yet we were all talking shit on BSG and how they don’t address the actual problem. fuck BSG.
smokebringer,"Last wipe I killed a 5 man squad in dorms. I was lying in the 1 floor corridor, hided in the dark and the trashes.

I had a good silencer so they never saw my fire.

I head eyed all 5. 

I encountered the 4 days later. Same shit.


I was permaban for cheat 2 weeks later."
Xinexan,i only ever played one game and that was yesterday.. can i get my money back? dont want a game where i have to fear getting banned for killing streamers etc.
jsomby,"If CPU/GPU have enough horsepower (who am i kidding, tarkov takes it all) you should always record all your battles to be sure you have enough evidence."
Minimum-Impression63,Onepeg needs to post a video about this on Youtube.
CodingAndAlgorithm,"Your options are:

- Ignore the drama and play the game.
- Uninstall the game because you might be one of the unlucky few to receive an unjust ban.

I know which option I'd pick."
Ikiller123321,"Streamer gets 1 person banned, because crazy desync made it look like he was cheating and everyone is scared for their lives"
ZeroCh4nce,"People its simple tarkov is a cash grab period. They dont unban unless you are a big streamer. Why? Simple they want you to buy another account. They love cheaters because its a constant money stream for them . You think someone is going to pay a large subscription each month for cheats and isnt going to rebuy the game if they get banned once in awhile? Its also why there isn't a active and rolling anti cheat instead they do ""ban waves"" every few months. 

Its rather simple you have 3 options. 1 just play the game and accept that your going to die alot and cheaters run the game. 2 play the game and constantly complain about cheaters, unlawful bans etc and be stressed and miserable.  3. Accept that it hasn't changed in 5 years and probably isn't going to change anytime soon and quit."
Difficult-Isopod6895,"I've found a great way to protect yourself from bullshit bans in this game, start by having the game open (alternatively, skip step one.)

1. Close the game.
2. Uninstall, or, if you are somehow not confident in your decision, simply remove all shortcuts from desktop. 
3. Open steam / epic / chrome and Google addicting games or some shit
4. Play a game worth your time."
brendo2013,Time for those passive playthroughs everyone jokes about... real talk though this is a serious issue and it definetly needs to be spoken on from BSG. RENG needs sherpa removed. Other streamers need to be vocal for either side so the conversation stays relevant.
yologamer45,"This is exactly what’s keeping me from popping for an elite account.  I’d spend the money, but I don’t see the point if I could get banned on a whim.  Particularly because Streets crashes so hard with rubberbanding that it triggers the anticheat"
Sanctif13d,As a white name semi-chad I always have that little fear in the back of my mind that every time I get some sweet 1 tap on someone that I'm getting reported and eventually I'm going to log in one day to see that I've been hit with an unjust banhammer.
Hegipo,Do like me: You can't get banned if you don't play 😎
Ok_Artichoke5604,"I was going to buy this game, but fuck this crap."
KEROSENO93,"nope and accounts are still being stollen on cheaters forums they sell stollen acounts i can´t link here the forums because the moderators

remember when BSG striked eroktic for point their security flaws and denied it when a a week later they added the verification codes to increase security? still happens just search for cheat forums and discords"
Speedy0407,Just imagine where we would be if some actually decent dev studio had this ip.
Janitor_,"BSG can fuck around and fuck out then. If I somehow get banned because BSG or some streamer cunt thinks im sus just because they died is some massive bullshit. 

I will be all over my CC's ass to get my money back and to file a formal complaint. I have money to burn BSG, please try my ass."
OwnedARG,"The moment your money gets into Nikita's hands he doesn't give a flying shit anymore, unless you are a streamer. That's why this game is fucked up and he does nothing to fix it.  


He. Doesn't. Care.   


Stop playing this shit game."
rinkydinkis,Cheaters are going to pile onto posts like this spilling out of their Cheeto infested forums.  They are going to try and make this seem a bigger problem than it is.  These should be locked mods.
murderxxxx,Yes they’re safe. Why is this community so dramatic?
Dildosauruss,"This sub is overreacting again, just like always.

Yeah, shit happened, it's stupid, unfair and I feel sorry for the guy who got banned, that Rengar guy is a man child who lives in a video game and should pull his head out of his ass.

People who are afraid it will happen to them too tho... wtf guys?

Are you also afraid to go outside because you might die to random bullshit like a brick falling off the roof or getting hit by a car?
Odds of these happening are probably higher than you getting banned just playing the game."
Chadgiggs,"Why do people get butt-hurt when a corporation acts like a corporation? BSG is not your BFF lmao. All you losers put too much trust and faith in a RUSSIAN CORPORATION. FUCKING BOZOS, ALL OF YOU."
TherealPadrae,Do you know this guy is 100% a normal player? He didn’t show us his perspective and all we know is he got banned after killing rengr. Even though he seems legit what if bsg looked at his account and found he was cheating even though rengr was just raging like a idiot?  We need a investigation.
AngryBullbog,I suck so maybe.
SuperMoistNugget,"Man i hate how devs cow tow to ""streamers"" as if there are classes within gamers or customers period. But that being said I would hope they require a it mkre evidence tha. Just ""idk hes just sus"""
Atlas_Sun,My account is safe because I can’t kill anyone to get reported.
_Bike_seat_sniffer,Just make the paid actor meme a reality. Hire 100-150 third wordlers to play with streamers and leave the rest of us the fuck alone
5william5,"Just ban me i dare them, so i can stop playing this game."
TheJonJonJonJon,For the most part? Probably. If they aren’t then I won’t be buying another one though.
MrLuchador,"Every kill I get I assume the other person is fuming at my luck, as I know I’m laughing at those lucky spray and pray headshots"
TryingToBeReallyCool,"As someone on the outside who has been thinking about buying Tarkov, this situation has definitely made me reconsider. I don't have enough money to get a new account if I happen to kill a streamer"
pEppapiGistfuhrer,Bsg and preferential treatment is a classic combo at this point
THE_MUNDO_TRAIN,"I've not spent over 90 euros just for some neckbeard with facecam to make all of that disappear.

Still I've stopped playing this game for the cheaters, but with this as a side dish then I would proudly never return."
Didki_,"Streamers having Lvndmark syndrome is one thing, BSG actually listening to their drivel is another, I'd understand if it were blatant cases (guy flying in the air), but this is just BSG seeing one man's POV and doing a manual ban cuz the streamer went into BabyRage mode."
Event82Horizon,"I feel a red line was crossed and this time BSG has to address this issue as well as the cheating issue and others. Yes, we all know BSG stays silent, etc...But this time feels different. The community is really fed up with all that BS."
Decidedly_Average,"Similar to the top thread, got myself banned around the beginning of 12.12 (possibly end of 12.11 cant remember the date) and yes, u get stonewalled and ignored, awful feeling when u havent done anything wrong."
Eugyoli,"Everyone should watch out these days on this sub about people saying they were falsely banned, don't believe everyone, we already had instances of players actually cheating and coming here to cry they weren't"
garack666,They never communicate because this would make things worse
Yuh_yuh_yuh4,"I suck, so mines safe :)"
DmMeUrTits-IfItsCool,Bsg wishes it was a real company
francoispaquettetrem,"Dont forget that some streamers get ""false positive"" three times and each time get unbanned. Kind of fishy. Especially when there are extremely sus videos on youtube showing sus gameplay."
