author,comment
A_Hideous_Beast,"Gamers doing that thing again, where they confuse different art styles with quality, and forgetting the myriad of issues Arkham Knight had on release, and how much people disliked that game. 

Now people are all defending Arkham Knight. I swear Gamers have really bad memories."
Leedleheed,"Actually it doesn't. If you play both Gotham knights blows it out of the water, texture wise, graphic wise, combat wise. Instead of comparing a single screenshot actually play the game."
Apokolypze,2022 does have a far cooler logo though.
kimmycolden,your fault for buying shitty games
Phatz907,"Gotham knights looks really good at high settings. The problem is that it’s pretty unstable. When it runs well, it’s beautiful. 

I haven’t played Arkham knight in a while so I can’t compare the two but… I wouldn’t say it looks “leagues worse”"
Andrew1990M,"Charitably, you could argue that Gotham Knights is designed to be an online co-op game so you have to reduce fidelity. 

Problem is apparently the world isn’t contiguous when running online, am I right about that?"
charlesbronZon,"And it runs like shit while looking worse too!

That level of fuck up almost sounds hard to achieve, like they had a bonus depend on it and they worked hard to make it happen 😂"
TheDirectTV,Ur TRIPPIN😂
fuzzmeisterj,"GK looks fine if you played it at all.  AK has better art direction, but the ""graphics"" are hidden by rain and a small low quality image."
Bowling_pins_10,Look about the same to me
SnakebiteSnake,7 years is a long time to find ways to cut costs
VoodooStone,"It’s not worse, it’s different. Gotham Knights also has a lot more going on in it then Arkham Knight could even begin to process."
Rat_faced_knacker,Gamers learning about art direction for the first time.
m0rl0ck1996,A little bloom can hide a multitude of sins.
CutMeLoose79,"I've played Gotham Knights at 4K 60fps on ultra settings with ray tracing on. It's actually quite a nice looking game and people cherry pick their photos for comparisons to make it look a lot worse than it is.

You've picked the most boring, suburban street without all the nice neon signs scattered throughout the game for starters. Also while it isn't raining and not showing off any of the really nice RT reflections or the good fog effects filled with the lights of the neon signs.

The Gotham Knights / Arkham Knight comparisons are generally shown in bad faith, just like this one.

I'm not saying the overall art style and world structure of Arkham Knight isn't better looking, but this is a badly made comparison."
Ghost-of-farta,"Yeah I guess ""gAmInG iS mOvInG BaCkWaRdS"" 🙄"
Eswift33,"You obviously missed Battlefield 2042 🤦‍♂️

This shit is happening a lot lately. Game Devs don't play games anymore 🤷‍♂️ 😂"
etcumtyrannide86,"One is an online game, and the other is a single-player game
 Due to latency and communication between computers, it's a better running game if it isn't filled with graphical clutter."
HerakIinos,Battlefield 1 was released way back in 2016 and still looks better than any shooter released since then.
BadSaltLundgren,I think a lot of AAA developers are kinda falling down the uncanny valley of videogames
