author,comment
Papaofmonsters,This picture smells like lilac and gooseberries.
WickedSlice_,She looks like she is about to give a prostate exam 😂
novacdk,"Nice try, Olivia Wilde! I see you!"
petite-cherie_,"As someone who used to do photo editing, you might want to ease up on the face editing, especially under the eyes. Less is more, and you want to go real easy on certain parts if you don't want it to look over worked"
Zettomer,"IDK, it doesn't look right. One user mentioned the use of a face filter and perhaps that is. But there's something very cgi esque. Maybe the photo had a touch up in something like photoshop or extensive make up, but this photo seems extremely unnatural. My money is significantly editted in photoshop, the shadows in particular seem artificially enhanced..

That or full cgi. The whole thing looks unreal. IF it is real, consider this a compliment I suppose"
Icy_Level_6434,Be nice to see without photoshop
ClankyBat246,"This looks a lot closer to good cgi than it does irl...

So that's a win I guess."
GamersLaboratory,Yennefer was my favourite character in the Witcher 3 . . . . image looks like it resembles a wax model version of the character
SomethingPersonnel,This looks like it was rendered in UE5.
ThatFeel_IKnowIt,RIP this subreddit.
the_dudeNI,Face filter makes you look like a sex doll.
atlrabbit,Cgi
BigandBlackk,Look better than the Netflix adaptation of her 10/10
Punk_Says_Fuck_You,"Hot girl post cosplay to gaming: Reddit-awesome job!

Not hot girl post cosplay to gaming: Reddit-stop posting cosplays in a gaming sub."
AdamNRG,"""cosplay"" is starting to get an extremely loose term nowadays..."
box_me_up,Either your skin is amazing or heavily edited. I cannot tell though so nice work!
Melan420,I'm getting uncanny valley feeling from this
FearTheReaper73,Cosplay and Photoshop should not coexist in a same sentence. However…
BlueInfinity2021,"Extremely well done.

If someone had posted this as a leaked screenshot from The Witcher 4 I would have believed it."
TheRealJayk0b,"Lol, at first I thought it's a Render, but that's meant positively."
NayMarine,You could also pull off any Olivia Wilde cosplay you wanted like that character from Tron.
tvirustodd,Looks like CGI
retrorays,nice CGI
beardingmesoftly,"Turn the light down, wear less makeup"
lepercake,Holy shit you actually look a bit like a 3D render this is tite
TheNegaHero,"Looks amazing! Scrolling down my Reddit feed and thought ""oh wow, are they putting Olivia Wilde in the Witcher?"""
AlwaysUseAFake,"Nice costume.  

Is your hand really small? Or is it a camera trick..?"
Tasty01,Your eyes look off and so does your hairline. Also looks like your face has been cut from a different photo and pasted on this one. The longer I look the weirder the picture gets. Your right arm als looks copy pasted from a different photo and you have a really small hand.
dougiefresh236,Alot of airbrush/editing but cool
Adeep187,No
darkwombat45,Its quite good because at least it looks like her. That actress on the Netflix series was a brutal choice.
Lyceus_,Great cosplay!
matTmin45,What Netflix character should have looked like.
McWeaksauce91,I thought this was a picture from the game
lumiranswife,"I've read but not watched the shows, this was my mental depiction. Nice cos, OP!"
Jericho_Initiative,Still looks better than netflix.
CremasterReflex,The drastic contrast in focus between you and the background (whether from focus length or green screen) and the rest of the postproduction really sells the video game character look. Good job!
rdldr1,Better than the Netflix Show.
DesignerFox2987,way way better than netflix yenn
Atomsteel,"10/10 tasteful cosplay

Your others are great too."
kinemator,#teamtriss
RastaImp0sta,"Take my hand!

No, ugh, give me your other hand!

I can’t, this is my strong hand!"
guilen,"Ignore the reddit twats. You've nailed the look from the game, fantastic work!"
thaneros2,Nice! Looks like you could pull off a great Baroness from G.I Joe
JP_GamingOnline,Gorgeous indeed
Slash_Raptor92,Are those your real eyes or contacts? They're very pretty.
Dcor,Netflix should have cast you.
lan60000,Looks like Sasha grey
Majestic_Preparation,It looks very nice. should have shared full outfit.
,[removed]
sashinexists,Are you sure this isn't a screenshot from the Witcher 4?
temetnoscesax,Incredible!!
EmEmPeriwinkle,Looks great to me! Can I ask where you got your contacts?
WCGWjoiningReddit,"Hooooly SHIT, look just like her!"
,I refuse to believe this is a real image.
camlo316,Uncanny valley
Korimthos,"At first glance, it looks like a Madam Tussauds statue"
TomasdeVasconcellos,Too much photoshop
istandabove,Better than Netflix yen.
Virtual-Appeal-8504,This is even better than the casting done for the Netflix show. You make a wayyyy better Yen!
steeze206,"I swear the only things I ever see from this sub that hit front page are attractive women cosplaying something and people self promoting the games they are developing with some fake sob story behind it. 

Unless I actively seek out this sub, the only thing I see that comes from it is someone promoting themselves. Just nonstop ads to wishlist something on Steam or follow someone on Instagram. Do you guys never get tired of this stuff? You guys don't actually care about how accurate the costume is. If the woman wasn't hot literally nobody would care about this post lmao. It's gotten to the point where posts like this easily surpass actual discussion about gaming each and every time. Unique game clips, of really anything much more directly linked to gaming. 

This sub has some good stuff. It's hard to find though because soooo many horny Redditors upvote any decent looking woman with a DSLR and a costume to the moon lmao."
kehmesis,Wow. Absolutely stunning. 😍
peedi1603,Should have casted you for the Netflix show
Metalomeus,Looks neat.... But I don't understand the need to to show themselves like this... Maybe I'm too old for this ....
Zalar01,"Personally I would love to see more of the cosplay instead of a mugshot, but whatever."
-wtfisthat-,Looks better than the girl who plays her in the show lol
KingCrow27,Foreheads too large and cheekbones protrude too much.
RudegarWithFunnyHat,wonder how lilac and gooseberries really smell
moldawgs,Love the cosplay but maybe it’s just me that thinks the hand seems like out of place/doesn’t match the rest of the photo due to the editing - don’t get me wrong the editing is amazing just the hand throws me off 🙈
Raph2051,Wow
rastagizmo,Wanna come over to my place and see my expertly stuffed unicorn?
Wrymn,"Wow, this looks like some amazing render from a Witcher 4"
biggiesmalls421,WB
Pizov,\#ishot
kemar7856,😳
ProfitInitial3041,*Hmm*
Goldillux,pls do keira metz plsplsplspls
ecowall,Cosplay Yen’s opening scene from the Witcher 3? Thaaanks
Efficient_Bat_1812,I legit thought this was a 3D render.
Dunbar247,I'd brave a Djinn for you
Zargo1z,Looks awesome! I bet you could also do a great Miranda Lawson cosplay from the Mass Effect series
Broken_CircleYT,I legit thought that was a screenshot from the game at first.
ducktor0,"The picture shows only 1/3 of Yennifer, where is the rest ?"
garlic_nacho,"Ok, now you need to do the face in season 1 before she slug witched it up to become pretty."
DaGoob,Yennefer the Wish version.
dehblackbeltah,Hmmmm... *Nodding approvingly*
jholden0,I am so confused right now.  Is this a real person?
Sigg3net,Why did you pose next to a drowning Hitman?
shocksalot123,The sheer amount of editing/filtering on the face tho....
MagsNfragS,"Fair skin, Raven hair. I'm only hoping you smell of lilac and gooseberries."
Mirthyhux,Where were you when Netflix was casting for the show
HorrorBusiness93,I swear the hottest chicks have a mole near their lip. It’s a thing
ranchwriter,Meh… oh Yen what’s up you seen Triss around?
budyll66,"Far, FAR too much makeup."
knockout1021,Wow awesome cosplay!! 😊
themaniaxx,x999 better than Netflix series' Yen
Mammoth_Elk_3807,You’ve embodied the Yennefer of my imagination. Brilliant job!
MichaelTLincoln,God dayum this is well done
lispy-queer,10/10 very original cosplay choice
bewarethetreebadger,Cosplayers be looking like they just walked out of the game these days. Seeing this in thumbnail I could easily believe this was a screenshot from the game.
HotelSolid9731,Zach?
HW_Fresh128,Yes.....this is perfect.
MotorVariation8,"Resting bitch face makes me truly appreciate this, probably my favourite cosplay of Yen ever."
Miqatsum-1997,"Holy hell, is that irl yen"
nightingaledaze,I don't care for the plastic face. Even the video game character has a more realistic face. r/Instagramreality
blank7589,Wow you look so 3D
9_Stars,Even better Yennefer than the original
thedoggydaddy,You actually look like Yennefer should. The one in the show doesnt look fierce enough and like shes seen some shit over the years.
SkRtMkGurt,woof
AsteroidTie,"""..I hate portals.."" lol"
AValentineSolutions,Mommy likes. 😻
gooberfunk,Ughhh fell out of love with my SO. Dead on. Love it!
Joskrilla,youre a better yennefer than the show
ShopWhileHungry,better than Buttflix version
FullGore1,Netflix i cant do this
Megaverso,Cosplay ? You’re the real Yennefer
PuzzledMoa,Beautifully done!
,"I need to see you get out of a hot bath naked. You know, for accuracy."
Akira282,Looks like your about to give a prostate exam all gloved up 😂
H3LLGHa5T,"I usually don't care about these cosplay posts, but damn you managed to make her game character come to real life."
thepoorking,simply stunning
lSquanchMyFamily,"Okaaaay.. We see you, Olivia Wilde.  😍"
broogbie,Im ready for my prostate exam now
Ljcrocks,Can I be your Geralt ?
Addy1738,Absolutely stunning good job 👍
kam5150draco,I think this might be the best cosplay I have ever seen. So well done!!
Natujr,How do you get it so right but Netflix can't lol
Rectal_Fungi,"Better than the show.  Though that bar is low. Still, good stuff."
pepsisugar,Better than the actual series
SwordMaster78,Nailed it
copingcabana,"10/10 would [Geralt grumble voice] ""Fffffuck."""
Jazzlike-Bed-2413,Mommy...? Jk the cosplay is amazing though
Interesting-One4461,"I like the one from the show better lol 😆 
Nah you look good ☺️"
Seth_Gecko,Holy *hell*
hypersucc,But do you smell of lilac and gooseberries?
muihuddin,Where the unicorn at
KnockoutNed85,When I click on the picture to go to fullscreen from main feed the necklace lights up. Not sure why but looks cool.
Dangerousrhymes,When did Olivia Wilde start doing cosplay?
tidytibs,Amazing! I'm still not changing my Last Wish choice!
Mcjoshin,Are you Olivia Wilde?!?
XxMasterUnicornxX,"""Take my strong hand!"" Lmao"
Fenstersmith,But do you smell like lilac and gooseberries?
Odd_Radio9225,Stunning.
erosennin69420,Yennefer cosplay looks better on a horse. IYKYK.
Hannasaurus101,"Holy moly, the detail!!! Well done *claps*"
GuestNumber_42,I think you'd be a great Hela from Thor Ragnarok too!
SJWCombatant,Amaze!!!
NameOfNoSignificance,The Witcher 3: Wild Hunt - Game of the Year Edition
Constant-Put-6986,Looks better than anything Netflix did. Great job
Pankekifureiki,Good fucking god.
porchpooper,Does Denise Gough do cosplay?  She’s the voice actor and on Andor
MarkatChilis,i would
MightyTaur,Better Yennefer than the tv series one.
,Ask her for her number and when she says no would you rename this the Bitcher? 😂
DangKilla,Dig it.
ImIrvThePerv,"Excellent! Have you done Miranda from Mass Effect? If not, you might want to consider it! I already see her in your face (or vice versa). Great cosplay!"
Fat_Nerd3566,"That's good, thought it was a game screenshot at first glance."
kelkiiii,Amazing!
Euphoric_Service2540,I love that Yennefer's look could with just some tiny alterations become a hot biker chick.
Coldoldblackcoffee,I thought this was from the game very well done
deathlord02,God damn your rocking it
zvalentia,did you bring the stuffed unicorn? asking for a friend
NoSitRecords,"Now this is a live action Yenn!, not that bullshit Netflix had, looks great the outfit is spot on"
AnonyDew3,"I genuinely thought this was ripped from the game for a second! Absolutely brilliant cosplay, well done!!!"
Skullhead_LP,"I like the expression of your face

It's like you were saying:
""What the f*** Gerald"""
thinkingitthru,Accidentally Megan Fox
AZShabrani,When yen cosplay look better than yen in the show
beardobreado,No netflix adaption is good adaption
JJknight04,Killing it
the_Great_OldOne,As Jane Cobb would say .. “ I’ll be in my bunk”
ninjanokami,Bring on the unicorns
xmaswiz,It would be fun if you did a Yennefer cosplay before the character's glow up.
RaiDeN779,At first you didn't remind me Yennefer but Miranda Lawson from Mass Effect.
Far_Beginning935,Stop lying! That's a picture taken straight from The Witcher 3
Xindependent777,Wow you look like that one actress can’t recall the name though !
PaVaDeDu,Stunning
Xu_Lin,Should be in the show!
matei1789,"Actual cosplay and not thot play. Well done. If I hadn't played the game to exhaustion( bout 400 hours), I'd be driven to play it again :)"
screamtrumpet,I’d love to make an Eredin cosplay. His Red Riders armor.
scaleddown85,"That’s insane lol but awesome,natural beauty"
christianton,It would have been great if we could see the full body
