author,comment
justxkyle,"If it ain't broke, don't fix it."
BLUEacrossthepond,Lmao I drive past this regularly and never once stopped to think how old it is.
Lahoura,We have Mario Galaxy in Goose Creek SC too
Natalia_Groznaya,"The year is 2123.

The parking lot is now a row of hyperport docking pods. The streetlights are gone, light now being provided by the glow lamps of Sky-dome 37-g. The Gamestop is now a McZornalds, serving fast Centaurian cuisine at affordable prices.

In the window, the faded image of an extinct Earth Aboriginal wearing retro military gear can be seen. The Centaurians call him Master Chef, and it is believed by some that tentacle-tapping his image before meals brings good fortune."
SilverMagnum,Finish the fight.
thethesperos,I did NOT expect to ever see this GameStop show up here. Drive past this almost every week.
Papaofmonsters,"It's like movie theaters that keep old classic posters up.  Sure it might not be the feature, but it's a piece of history."
sirtagsalot,Here is crazy coincidence:  I have to go to a neighboring town in a couple of weeks. Rock Hill. I've never been to that area ever. I'm visiting a friend that is temporarily working in Fort Mill. I may stop by this Gamestop now that it's Reddit famous.
Arleen_Vacation,SC gang 🌙🌴
ElahaSanctaSedes777,"That’s a beautiful sight, nice looking GameStop"
topchief1,"Hey, that's my home store!  Best employees in the greater charlotte area, hands down."
McStabYou,That image reminds me more of GameStop than Halo by now
Automatic_Anomaly,That game really was perfect.
Chemical-Frosting909,IS THAT TEGA CAY -a sc native that now lives in CO
YuutaKenzigeki,3 of the GameStops in places I’ve lived has had one of these. Great game and certainly a staple when it comes to physical games
Socratease1885,"Do GameStops have to be next to SportsClips, or is that only the law in some states?"
,[removed]
Specialist_Meal_5732,Best game ever
MODALLSOUL,I’ve smoked weed right in front of master chief. Insane how many locals are in the comments.
LavenderCrownedCrow,"There's one in Sumter SC with Halo 3, Tomb Raider: Legend, and Sonic the Hedgehog: 2006 ads still up. Very nostalgic."
MetalDragnZ,"My first ever midnight release was for Halo 3. Being a teen that didn't drive and lived 4.6 km from the nearest EB games, that was one of the most intense bike rides of my life, balancing that big legendary edition box on one leg while trying to maintain balance with the other hand."
autumnaki2,Holy shit. Home town hit the front page. It's nice to see.
adamr94,Simpler times.
tteuhcsJ,That gamestop and the walmart behind it was my main source of video games most of my life. Always weird to see it on reddit
Sharpshooter188,Jesus. I cant believe that was almost 16 yrs ago. I was 23 at the time.  Miss those times. Bunch of us nerdlings set up 4 360s and ran 2 4v4 matches constantly.
Beautiful_Exam_1464,Still one of the best ad campaigns ever. Keep it up. Literally.
EstablishmentShot232,It's going to outlast the franchise soon enough.
landdon,The good old days. Hanging out at GameStop at like midnight with a bunch of nerds talking about whatever game you were all there to get. Getting free stuff occasionally and making new real friends. I met a friend many years ago in high school waiting on a Diablo release and we became close enough that we started monthly lan parties. I want to say it ran for at least 2 years and probably had somewhere around 20 PC nerds. What a time to be alive. So glad I got to do that stuff.
BangerBeanzandMash,Fort mill hell yeah
06EXTN,Fort Mill is so interestingly odd. I have cousins that live in Baxter Crossing and every time we go I kinda like it even more.
mr_edgeworthvii,Same with a GameStop on south hill in Spokane WA. Also has super Mario Galaxy as well
BigD905,I bought my switch at this GameStop
toomanygear,The GameStop in my city still has the same one!
Bl1ndMonk,"Gamestop in Ames, IA on Lincoln Way still has this!"
summernightsmood,And Halo 3 is still going strong too!
ITheNub,Hello fellow South Carolinians
VVolfGunner24,"As jealous as it makes me that other people get to see this, I'm also wowed by the places people are talking about in SC. I've lived in (still do) in SC my whole life and never heard of these towns/cities"
CorellianDawn,"Poor Master Chief, at this rate he ain't never gunna Finish The Fight"
nstav13,I remember going to blockbuster back in the 00s and seeing the posters for Halo 2 and later Halo 3. I remember renting and playing Destroy All Humans and Godzilla Vs Monsters a ton. That poster brings me back. H3 is still a banger.
Jsmoove1992,I drive past here almost every day lil
thegingerninja90,The gamestop near my house still has a Sonic and the Secret Rings window setup.
Mobius_196,"Ah, this is the GameStop that I frequented in my teenage years. Still live less than half an hour away.

Good ol' place."
Yogathin,"Absolutely insane to see this on my front page. Lived in Fort Mill until a year ago, my mother still lives right by this GameStop and I went to it for years"
Unique-Ad4786,"Fort Mill, I miss that town I remember when it was nothing."
digitallandscapetoon,Same in Rochester ny
a3663p,Best halo in my opinion 🤷‍♂️
Catwitch53,Reach will never fall
Edwardc4gg,Oh I’ve not been by there in a few weeks. Thanks for sharing!
DancenOrigins,Oh shit that's close by. I should go sanp a pic
EvilDarkCow,"Man, that's a really nice looking GameStop. The ones in my area look like gas stations (and not QuikTrips)."
MinunsPlusle,Man I miss Fort Mill.
atk700,I'm going to look for that on the way home.
TT_Zorro,"I feel like the GameStop in Franklin Square in Gastonia still had this window last time I was there just a year or so ago. Hard to improve on, really."
Sambo_the_Rambo,Timeless
,[deleted]
jonstarks,its still bad ass
juicy-heathen,Theres one I'm Spokane WA with halo 3 and Mario Galaxy
VestPresto,Time is extremely slow in SC
krakenmyboy,Still got my legendary helmet out. Stay strong!
brucebanna34,Finish the fight
Kimmalah,My local Gamestop also has this picture on their window. I suspect a lot of them still do.
NEDGO,if i had the money i would fly there just to catch a sick photo in front of that bad boy
TheCreator777,"Don’t blame them, it genuinely looks good and it’s reminiscent of better times. I still remember the night I played Halo 3 on my brother’s 360 for the first time."
griffraff0701,Remember Halo
tylerprice2569,This made me happy
Jordan1719,Tega Cay rise up lol
Dude_Illigence_,And it doesn't look like it's faded one bit
InkSymptoms,I’ve got sonic and the secret rings at one of mine
stegasaurusteeth,I'm sure they'll update to Halo 4 any day now
Finnish_Best,Stronger than the franchise
BuSsYBoI-sTaYpOpPiN,"I swear this exact same shopping center exists in Buffalo, NY. They're just printing these things!"
Deusvalhalla,Man I miss the 2000s...
Gloomy__Revenue,Are these stores *always* next to SportClips?
tempest_wing,How has it not bleached from the sun?
bilko797908,That’s Tega Cay not Fort Mill
AAMCcansuckmydick,If only HBO had the halo IP and not paramount with their master cheeks version…
jkess04,They know how to HODL
Xsylium0722,Was just there picking up my dead space copy. Tega cay sc
volcanostephen,Nice OP! I live in Fort Mill SC too! I recognize that Game Stop!
snarefire,"Don't draw attention to this! 

Otherwise some gamestop corporate shill will call the store and demand they switch to whatever new bullshit they think of"
topchief1,"TIL that most of us live in fort mill, and based on the traffic, that doesn't entirely surprise me"
radabble,I remember when this was installed. Crazy that it still looks so good after all these years!
Crafty_Substance_954,The gamestop in my college down had the Halo 3 window up until they moved locations in 2021!
OtterChrist,Hey this is less than an hour away from me. May have to stop by and pay my respects soon.
berensona,Lol golf cart town looooool
TheNappingGrappler,Load bearing poster
BCCDoors,We refuse to acknowledge that any other Halo exist beyond Halo 3.  The franchise ended on a high point... It was great.
LincolnParkZoo2,I hate the new Halo
FictionalX,They said they'll replace it when a better halo comes out....
Xbox,"""Welcome to our historic downtown."""
jjbombadil,"Nice! I grew up in Fort Mill. It used to be a small town but it blew up. Also the “ain’t broke don’t fix it” doesn’t hold up there now. Its all fancy now. There was a time when it was the southern equivalent of Letterkenny.

So just Letterkenny but we say ya’ll not aboot."
Adeep187,I'm more surprised Gamestop is still goin.
agnostic_science,"Makes sense because Gamestop itself (brick and mortar video games seller) is a dated a concept as anything else. Quarter after quarter it continues to do poorly. Its future is doomed. As there will be no place for middlemen players like this for where the video game sales landscape is inevitably going (direct, streaming, digital, and maybe shrinking amounts of hardcopy sales sold through online vendors where there is loads of competition). Attempts to re-invent itself have failed. If it weren't for the meme stock craze and gme cult that sprang up, we'd be talking about this company like Bed Bath and Beyond right now. It will still get there. It will just take more time now and take a lot more investor cash with it before it finally goes."
Bigfan521,The Blockbuster in my hometown had a big Halo 2 poster in one of its windows until they tore the place down in the mid-2010s.
AlbertManus,Hope whoever takes over the store after Gamestop's inevitable bankruptcy keeps it.
hitmannumber862,They will all be gone [eventually](https://www.reddit.com/r/gaming/comments/cogexn/).
Bigly_Star_Hole,GameStop is too cheap to replace that. It will be there until the store closes or the image is so faded it looks like shit.
Kushykush_,Salute this GameStop
Yohder,So excited for what GameStop has in store this year
12Southpark,Love GameStop
Charming-Forever-278,You get dibs when they go out of business
RedPanther1,"This is a pretty accurate picture of SC, and I don't even live in bumfuck nowhere SC."
AlbertHofmann01,This picture reminds me of looking at blockbuster when it was 2010.
phoenix7700,big prints like that are expensive and gamestop isn't doing that great. It'll be up until they go out of business and someone else buys the place.
bluegemini7,"As a former Fort Mill resident for about a decade, I actually think those windows aren't accessible. Not just because there's a wall-shelf of games on the other side but I believe they actually put a wall up so they could do hooks and stuff, so I think it's physically impossible for them to get to the window.

All is as it should be."
PrincessHootHoot,I've lost interest (and hope kinda) in GameStop
,[removed]
mynameisalso,3 window?
Guitrdude,I bet the cash wraps are by the windows. The window decal blocks on people outside from seeing the cash handing. There’s a cost for type of window tint and that’s probably why it hasn’t been changed.
ItsameMatt03,It's a classic image.
OHoSPARTACUS,2007 was truly the purest year for gamers.
Festey-The-Messy,"North Augusta, SC still has the Mario Galaxy window"
rage1026,The UV index most be consistent low to not be that faded.
MajorBaines,Spartans never die.
RedGhostOfTheNight,It's a monument to all of our sins...
Mofiki567,Seeing that image gives me such nostalgia
JCMJones,Haha there’s one of those on the wall in my local mall
Perilous_Percival,I think ours in corpus Christi got taken down not too long ago :(
AnOrangeCar,That is KICK ASS!!!
Jacksmagee,Ames Iowa has one with the Halo3 window up
Advanced_Entry1833,The good old days…
Sweezenator,Yo I’ve camped out there for a couple of games!
SpiderDetective,It's a good decoration. I wouldn't take that down either
S7E4Z3M3I5T3R,"Same in Lee’s Summit, MO."
gentlemanbadger,We have this *and* Super Mario Galaxy at our nearest.
cloudcity,i have eaten at the italian place in that strip mall lol
Giga7777,"Master Chief, mind telling me what your doing on that window for this long?!?!?"
Volsunga,It's too bad they never made more *Halo* games. We'll wake him when we need him.
esoteric_enigma,How does one improve upon perfection?
letmeusespaces,"don't ever ever change it

[cherish it ](https://i.imgur.com/UeUZM0I.gif)"
vpforvp,Most memorable midnight release I ever went to. Was 15 and tired as hell at school the next day after ripping mp all night
2Much2HandleNow,Howdy Neighbor!
Blu-Shells,They are still trying to “finish the fight”
ChevyChaseFallDown,Master Shake! Tight!!
uhh_yea,"Ames, Iowa Gamestop also has their Halo 3 sticker up still. Looks great and is practically a landmark here"
Frago242,OG poster checking in digging vibe
Toe_Itch,"What the hell, I get my hair cut at the sports clips next to that"
No0delZ,Heard the music immediately.
CurtisMaimer,I used to drive past this every day!!! I bought Halo 3 from this game stop
zknight137,Mine still has Halo 3 and Super Mario Sunshine
King_Artis,"It took for the store closing in east Lansing for them to take it down. 

And that was around the time the pandemic started"
Manboober,I don't know why but that looks like a CVS building to me.
zombieconker,"Still got ours in Sandy UT as well, love it."
synthwavjs,Remember...
AliceFaust,It's going stronger than the current Halo universe is....
elytraman,itll be tragic when they remove this
Falcone24,beacon of hope
Protesticle,"Halo, Halo never changes

master chief collection ❤️"
techniqular,Back when you could Finish the Fight
Sk00zle,"Been a few years since I've stopped in that store, glad to see it's still up! Doubt they'll ever replace it at this rate."
Me_Want_Pie,That spicy gamer fuel was just the best.
maesterbae,Crazy it hasnt washed out by the sun yet
Burt_McNasty,Ames IA still has the same one
_gnarlythotep_,I can think of no reason for them to ever change it. Still looks badass AF.
Wiggie49,My local Gamestop still got Sonic Unleashed on their window from 2008
GraniteMtn,"The Bungie glory days, before 343 took over."
mathfacts,It's John Halo. Dude is timeless.
crypticfreak,"I swear the east coast (especially the Carolinas and Virginia - included super secret West Virginia) have a thing for Halo. 

When I was doing AIT in Ft. Lee someone on post had an actual Warthog and it looked sick as fuck. I think it was a recruitment tool but still it was sick. Couldn't recruit me, I was already dumb enough to join. I've actually seen multiple of them while in the army. Once at freakin Ft. McCoy of all places."
ProfessorGlaceon,"I live close to fort mill, but everything I do has me heading north"
Liune,I mean… it’s ft mill
leviathab13186,I remember when that game came out you can hear the chant in every dorm you walked into. Everyone was playing it.
Waggmans,Master Chief will end you if you try take him down.
Cryinglemon,"Sumter, SC still has there's up too!"
Kivble,"Portage, Indiana still kicking as well!"
Lampshade_510,Halo 3 is actually the first Halo game I played lol so that has a special place in my heart
Panzerpython,"Dun dundun, dun dun dun"
Arsnicthegreat,"It's twinning with the GameStop in Ames, Iowa."
DoomOne,The last time Master Chief was strong.
Trextoasty,There's a store near me that still has a power rangers poster up from like 12 years ago.
helios210,"Is this the store from ""Blame it on Halo 3""? It looks extremely similar..."
Pale-Wind282,Man I remember going to the midnight release for the game and skipping school the next day to lan with my buddies…time flies to fast.
unal991,"We have this one tech store with Skyrim, halo and mass effect 3 poster"
moenchii,The town I used to work in until last year had a clothing shop aimed at a young demographic (teens to mid 20s). On the side of the building in a side alley they had bug windows that were blocked by a vinyl wrap with advertisement of that store. That shit was straight out the early to mid 2000s judging by the outfits of the models on there...
cjchrist1,Holy shit. This is where I grew up and where my parents still live. I know that GameStop VERY well. Lol
huskyghost,Haha same in texAs
AL_MI_T_1,"Ames, IA still has theirs up too"
WakaWaka_,"Must not get much sun, or would've turned white long time ago"
baconriot,The best halo for 1v1s ever made.
malturnbull,Infection and sandtrap map forever!!
dontworryaboutitdm,Mine is Sonic and the Secret rings.
chadman350,How is there always a sports clips next to a game stop?
thesamuraiman909,That's amazing
godai88,There's a local theatre near me that still has Small Soldiers balloons hung up. A film from 1998.
cataclysmicgamer,Is that a two story game stop ?
BannedfromTelevsion,That GameStop is huge
yungjed,Fuck yeah
UnfeignedShip,I think it's a toss up between Halo 3 and and 2 as to which is the best in the series.
hunter503,"I wonder if they still have the old school game fuel hidden somewhere in there. I miss that flavor sooo much, idk why they never made it a full time flavor."
UnfeignedShip,I think it's a toss up between Halo 3 and 2 as to which is the best in the series.
Cheezitflow,"Anytown, USA"
EnJ-Khaled,Damn didn't expect to see so close to home on the front page of reddit this morning
OP-69,meanwhile theres a GTX 780 poster thats been outside my local pc store for 10 years
Tulaash,"There's one I occasionally pass by in Spokane, WA (for anyone curious, it's on the South Hill) that still has this and a Super Mario Galaxy poster in their window! Makes me so happy to see it every time c:"
lallapalalable,Why get rid of some badass decorations from one of the best games of all time?
thatdude658,"Hey I went to high school in Fort mill! Been to this gamestop many times, that whole area has blown up with new construction and new businesses like crazy. Really cool to see someplace so close to home on reddit for once."
boomtox,There's a GameStop in Nampa Idaho that's still rocking a big Mario Galaxy window
redconvict,I wonder if their still selling copies to the original or just the MCC.
Knassius,Is that in NTC? They have one just like it
Jojo-Action,I know a gamestop that still has one for new super mario bros wii
manning_harrison,Looks like a Barnes & Noble
Canilickyourfeet,"It's a reminder of what was.

It's saying, *Remember, Simba.*"
Whalers7997,Everything is slower in the south
ChrisInNJ,"I mean, think about it, they had to buy custom window graphics for each glass panel there, might as well keep it forever"
umjammerlammy,Can't say the same for the Halo franchise though.
MindSteve,"Hey, they'll change it when they make a better Halo game, alright?"
Abiduck,It really ties the room together.
tiwalterite,Nice Rubi!
rachael-111,wake me when you need me
daking240,Halo Infinity!
Megalorye,"That's a beautiful GameStonk, is it 2 floors?"
elit3spartan,Respect the classics man
SilkyG51,Bro show some respect to Tega Cay! This ain’t Fort Mill!
waxen_biscuit,I got my copy from here
Lamontyy,Unequivocally based
epsilonzer0,"Finish The Fight!
Man the marketing was strong with this game"
farkasmcmillan,Always ready to finish the fight
BleedingCPU,I bet it provides some much needed shade.
Killertigger,It’s still 2003 in South Carolina.
budyll66,It's pretty much the only Halo game which I've enjoyed.
KriegerKlone,I live 20 min from here in CLT
