author,comment
AutoModerator,"
As a reminder, this subreddit [is for civil discussion.](/r/politics/wiki/index#wiki_be_civil)

In general, be courteous to others. Debate/discuss/argue the merits of ideas, don't attack people. Personal insults, shill or troll accusations, hate speech, any suggestion or support of harm, violence, or death, and other rule violations can result in a permanent ban. 

If you see comments in violation of our rules, please report them.

 For those who have questions regarding any media outlets being posted on this subreddit, please click [here](https://www.reddit.com/r/politics/wiki/approveddomainslist) to review our details as to our approved domains list and outlet criteria.
 
 **Special announcement:**
 
 r/politics is currently accepting new moderator applications.  If you want to help make this community a better place, consider [applying here today](https://www.reddit.com/r/politics/comments/sskg6a/rpolitics_is_looking_for_more_moderators/)!

***


*I am a bot, and this action was performed automatically. Please [contact the moderators of this subreddit](/message/compose/?to=/r/politics) if you have any questions or concerns.*"
I_fail_at_memes,Anybody else surprised the President of  McDonald’s makes only $7 million a year?
Hiei2k7,"Maybe if paying the workers is job destroying, maybe it's a job that shouldn't exist in the first place."
logicalnoise,"So here's the thing that all this talk keeps quiet. The company is the least important part of this. If the business can't keep going while it's employees are gainfully employed then it's a failure and should close. Instead the media, government and companies all seem to agree that the employees should bear the brunt of keeping a bad business plan working."
rintryp,"Someone should ask him how they can afford business in Europe then if it's so 'job destroying'.

Edit: I was pretty sure we had higher wages in Europe, but I checked, and it's only 12 EUR/h, at least for Germany - so I was wrong in that regard!"
cheap90scigar,"> In the letter, Erlanger noted that the company wasn't against increasing the minimum wage. ""Let me be clear: we support legislation that leads to meaningful improvements in our communities, including responsible increases to the minimum wage. Our business does well when our employees and our communities do well,"" he said.


It’s incredibly expensive to my community for people to be paid under a living wage. The FAST Act passed because the fast food chains in our communities failed to increase wages and improve working conditions on their own."
fencerman,"In 1975, the average grocery store clerk was earning the equivalent of $29 an hour, or about $58,000 a year.

(Edit to fix the link: https://fraser.stlouisfed.org/files/docs/publications/bls/bls_1925_1976.pdf)

From the article: 

>""Full-time grocery clerks, numerically the largest occupation, averaged $5.33 [an hour]""

$5.33 an hour in 1975 is the equivalent of $29 an hour in 2022. 

https://www.usinflationcalculator.com/

And it was a stable, unionized job with health insurance and a pension. 

So that fat overpaid POS CEO can go fuck himself.

(Oh yeah, and the average house at the time cost the equivalent of $177,000 today)"
Suspicious-Artist465,Imagine thinkin $22 an hour is too much money 😂
damnedspot,Is this like Chevron reporting that they had $35.5 billion in profits for 2022 (vs $15.6 billion in 2021) and yet gas prices were Biden's fault?
ksiyoto,"Costly to whom?  McDonalds

Saves having to pay taxes for AFDC and food stamps for the rest of us."
homelaberator,"The prime market for McDonald's is people on lower incomes. If you give those people more disposable cash, they will buy (amongst other things) more McDonald's.

The whole broad sweep of that is true for minimum wage in general. Putting more money into the pockets of ordinary people grows the economy bigly. They are the ones spending the money, creating the jobs that give others money to spend.

The ultimate end of shifting wealth up, into the hands of fewer and fewer, is feudalism. A handful of wealthy and powerful people that control everyone else with most the population too poor even for anything but subsistence farming. It's the death of civilisation."
naththegrath10,9.5% increase in profit last year. Bringing their total net profit to $13bil. Plus a $870mil stock buyback.
TronCarterIII,The man makes $3560 an hour if you factor it for a 40 hour work week.
fardough,"I have some sympathy for franchise owners because corporate controls price increases, so they don’t get a say in passing along the cost.

However, this claim is bullshit.  We are talking about a 30 cent increase per item to raise the wage to $22.  We saw double this level of increase this past year, and barely any of that went to higher wages.

I call for a new company tax.  If your employees pull government subsidies, the company gets billed the cost of them.  We can no longer let companies pass off the cost of living to private citizens, and allow them a subsidy for employee wages.  Pay employees wage or pay for the social safety net.

Edit: I now have much less sympathy for the franchisees after being informed they do get to set their own prices."
hopeless_queen,Wah I need more money! The poor's don't need it! It's not fair! - Literally every CEO
Skyzfallin,Fuck the CEOs and the board members that collude together to give each other raises
FaydingAway,Dude makes $14 a minute. He has no grasp on what normal money is like
sfmasterpiece,"The rich assholes that run this country are rewarded when they treat average person like they don't deserve a livable wage.

Why do people bootlick for millionaires like this?

Take a look at the Reddit mods. They do the work for a 1.8 billion dollar corporation for free. The corporation values them as worthless, yet most of them are so brainwashed that they continue to produce value for the corporation."
,[deleted]
paininmylefteye,"I think we also need to start giving people the yearly equivalent when discussing this issue. $22/hr may sound like a lot to an older, salaried individual who worked for $5.25/hr in high school, so also describing it as $44,000/year ($22/hr working 40hrs/wk for 50 weeks) might people make the connection that it is still not a huge salary in today’s economy.

Include the fact that there often zero benefits like healthcare/dental, PTO, or disability insurance, it’s just not much to live on, especially in a bigger city. Also, home ownership?  Phhht. Good luck saving up a down payment while paying rent and coving other bills."
trongzoon,🎶 *Bada bap bada* I’m not loving it because I can’t afford basic necessities while working at McDonald’s…🎶
thomport,"Prove it.  

Give us the cost breakdown and analysis.  


McDonald’s is not cheap anymore."
anebbish,"Amazing that people still don't understand capitalism. You don't steal alot from one person, that makes you a thief and you go to jail. You steal a little from alot of people and that makes you a CEO, job creator and you go to Congress  and become an alleged Senator."
Tough_Reddit_Mod,"My father was one of the most dedicated and loyal McDonald’s corporate middle managers in existence. 

They shit canned him after 9/11 to give shareholders more money. 

Nobody ate less cheeseburgers."
RickTracee,"Yeah because putting more money in the hands of people who will readily spend it helps the economy.

Increased wages and spending raise demand and create more jobs.

Workers stay with employers longer (instead of seeking out better-paying work with other companies) reducing businesses’ turnover, hiring, and training costs.

Lower unemployment and higher wages increase tax revenues.

When workers earn higher wages, they rely less on governmental “safety net” programs.

So yeah, it would be 'costly and job destroying.' SMH"
Character-Education3,McMurrays a piece of shit
ndngroomer,"I own what I consider a fairly successful small business in the pet services industry (grooming, pet hotel, daycare, dog/cat training, vet clinic, etc) currently with three locations and am in the process of opening up my fourth location this summer. My wife is a doctor who also owns a fairly successful medical clinic and she also has four locations in our community. Against everyone's advice and to great criticism among our family friends and peers in our professions we felt that we were going to pay a fair and livable wage. The starting pay for anyone who starts to work for either of us is $22/hr with the exception of my dog groomers. They get their own ridiculously generous pay commission structure.  In fact, I take great pride for the fact that several of my groomers have made over six figures the last couple of years when they were lucky to make $35/yr working their asses off before working for me as pet groomers. 

We still do very well financially and our businesses are still very profitable and growing faster than we know what to do with even though we pay these wages. Our employees are amazing. They work so hard, are so innovative and extremely dedicated and loyal. This year I decided to give all of my staff a 10% raise because of inflation. I also decided to do a very generous bonus payout to my staff. I was called a fool by my many, including family members and friends for this but it's my money so I figured that I can do what I want. This year for bonuses I took 30% of the total profits and divided them evenly among my employees. I have a little over 60 employees so that came out to a little over $6k per person. The looks on their face and the letters of appreciation I got were worth it alone. My thinking for doing this was that this was the third year in a row for record breaking profits because of everyone's hard work. This absolutely wouldn't have happened without their hard work and dedication so I felt that it was wrong not to share this profit with them. 

So I say all of this to say that if my wife and I can afford to pay $22/hr as the starting pay to our employees in our professions then I truly believe other businesses can too. I guess what makes us different is that we just are not greedy and arrogant people who have big egos that has to be constantly praised. I grew up in extreme poverty. I'm saying I'm a native American who grew up on a tribal trust land kind of extreme poverty. Now that I have the resources to help others in my community I feel it is what I must do. My wife on the other hand grew up in extreme wealth but she's also one of the kindest and most generous and unselfish person I know. 

The thing I honestly don't understand is that even tho my wife and I have consistently and continue to prove all of our critics wrong we still get called all kinds of horrible things and criticized for how we pay our employees. Especially by our competition and colleagues in each of our respective professions. If only more businesses would only open their eyes and see the big picture, maybe look at it like an investment even, that by treating your employees with respect and paying them a fair and liveable wage the return on that investment far outweighs what so many companies are currently doing now instead chosing to work their employees hard, treating them like shit and pay them poverty and slave wages. I just don't understand why they are so blind to this. Especially the ones criticizing me and my wife so harshly even tho they can obviously see our success that is proving them wrong in real time. I honestly just don't understand this. 

Anyway, I just thought I'd share my anecdotal experience with everyone. Thanks for reading."
americanspirit64,"What McDonald's is railing against is a business model based on corporate greed and the exploitation of workers in order to make huge profits.  One of the ways they do this is down-playing how difficult the job can be.  This isn't about just flipping burgers it is about working at a business that treats workers badly, as if they don't matter and paids them shit.  If covid taught us anything, is that essential workers are essential, not a throw away job population.  It is the same song and dance they want us to believe about trash collectors they are essential.   This is all about people doing a competent job under bad working conditions for a living wage, nothing more.  Whether they call it pick up trash or flipping burgers.  School teachers are one of the most highly abused workers for low pay.   They don't want good workers, what they want is an endless supply of low wage workers they can employ for pennies.  The $7.25 dollar an hour federal minimum in this country, won't buy a worker or their family two loaves of bread for an hours work.  What it will buy them is maybe a dozen loaves of bread a day. Changing that is simple, lower the cost of bread.  Please this is slave labor at its finest.  It is also why we are facing a Health-Care crises in this country, no one can afford it.  If McDonalds had to pay their workers health-care you can bet insurance would be lower.  America would also make a higher tax base.  This is the America, our Capitalism environment wants, to make Capitalism only benefit the rich.

Our true economic problems started, when we decided we could use food as fuel for our cars from corn.  It raised the price of every grain on the planet.  There are other plants that have a greater bio-mass and can product more ethanol per acre than corn.  Those plants just don't have the American Corn Association lobbying for the use of corn as fuel.  It should be illegal to use food in such a way."
Theelfsmother,"I bet he claims that he started making fries and worked really hard to get where he is today. He got there on nothing but hard work and a good attitude. 

If the workers want a payrise they just need to work really hard like he did and get promoted, stuff like that."
hand_of_satan_13,"when the economic shit hits the fan it's always the fault of the working class

get ready for some austerity politics comrades, the 'poor' rich aren't rich enough apparently"
lollipop_nuts,"He is a Hypocrite in Chief .  McDonald's is the company which moves money around the world to avoid paying taxes.  McDonald's pays their hourly staff non-living wages. Staff must seek government welfare to survive. Welfare is underfunded because some wealthy companies and folks do not pay their fair share of taxes. So goes the downward spiral and destruction of an economy.

https://youtube.com/shorts/CbgJcohqoDg?feature=share

I NEVER eat there because it is run by self-serving a-holes."
DoughnutPi,"Considering McDonald's just opened a fully automated restaurant in Texas, I think what he is saying is accurate. Once humans cost more than machines, companies will make the switch to machines."
Tim_Allosaurus,"Depending on the area this is a 100% true. 22 hour for McDonald’s in LA, New York, Miami, ect. Is probably fine. 22 hour in bumfuck WV is way over the median income for the region and would cause a lot of regional issues. Pay, and housing are regional issues there is no blanket fix each region has a different figure."
ferret1983,"It can be done no problem. But the hamburgers would be more expensive - similar to Nordic prices.

Main difference in labour market Sweden/Nordics vs USA is that -ALL- jobs here pay a decent living wage.

It's because the Unions here have so much power and negotiate salaries and benefits with the employer. We have no minimum wage. 

So, our hamburgers are more expensive. Taxi, barber, cleaning services are more expensive. 

In return noone needs to have two jobs to survive and there are fewer problems in society."
BitterPuddin,"Dunno about the rest of you, but I think that approach is self defeating.  Fast food isn't fast.  It isn't cheap.  Usually the order isn't right. The employees often have attitudes because they have shit pay, and after covid knows that life doesn't have to be awful.

I have a business that has me often going on service calls, and I used to get fast food breakfast pretty much every day, and often lunch.

Now, I just scarf oatmeal for breakfast, and wait til I get home to eat.  I have lost weight, and I bet I have saved thousands since covid hit.

""nobody wants to work"""
donedoer,"Look up what McDonald’s pays in Denmark. We need to hold our govt accountable to regulate for the people, not protect corporate interests. Plan and simple. Can’t fault a business for wanting to make profits. But I can fault the fuck out of elected reps that kiss the boots of the rich."
Guy0naBUFFA10,Deadass 7.4m is actually pretty reasonable for the size of the company he leads.
cashrchek,"It drives me batshit crazy to hear McDonalds franchise owners being described as 'small businesses'. If you can afford to become a McDs franchisee, you *could* afford to start your own independent business. You are not the same as someone running a mom and pop.   

 If anything is truly anti-business, it's allowing these franchises to establish themselves on every fucking block and drive out the *real* small businesses."
mtarascio,"I moved to the US and the density of your fast food and restaurant options is insane.

I went on Google Maps and literally counted McDonalds within a 20 minute drive. Australia was 2, America was 20.

That's even not accounting for the fact the other chains dwarf Australia 10 to 1 as well.

The spread of of these restaurants allowed due to low wages has done harm, unfortunately Mr. McDonalds, yes you overextended and rising wages will probably mean stores need to close.

Government needs to ensure social safety nets are in place and education opportunities are open to transition this as they increase minimum wages."
Murderousdrifter,Some capital offenses seem less egregious to me than the existence of overpaid CEO’s.
elpmet76,Wait….he only made 7.4 million last year?
IUsedToBeACave,"> ""The state is teaching us a powerful lesson about what our future could look like if this one-sided style of democracy is mimicked elsewhere or goes unchecked in the Golden State,"" said Erlinger

Right...because we all know that up until now, these businesses have quietly sat on the sideline and would never use their money or power to influence legislation."
Badwins,"Notice he says job killing, not business killing.

The days of relying on labor are ending. Vast majority of McDonald’s supply chain can be done without humans working traditional jobs.

At $15/hour there is less incentive to invest in robots. At $23/hr, there is more pressure to invest in robots.

Do you want a team of 5 on shift at McDonald’s each earning $15/hour?

Or, do you want a team of 2 earning $22/hr where are expected to do more work with their robot coworkers?

That is the *only* possible outcome."
HoosierDev,"People are going to say, they’ll get replaced by a machine like that’s a bad thing.  The less people work the better.  We just need to tax McDonalds in a way where people who no longer work make UBI.

The less work people do the better."
NotthatkindofDr81,"It will kill a lot of jobs, and it should kill a lot of jobs. We DON’T NEED a McDonald’s on every damn corner!  Less restaurants, better food, happier employees!"
Missterfortune,No! It can’t be that!! I thought it was (insert youngest generation here) fault for not wanting to work that was gonna destroy the industry. Man I just can’t keep up.
Majestic-Contract-42,Don't they get paid more than that in Europe?
techsavior,"He’s not wrong.  The stockholders will never agree to raising wages at that level.  They’d rather see automation increased, in order to reduce payroll overhead and improve the company’s P&L."
Zealousideal_Mix4250,This sort of hypocrisy is EXACTLY what’s wrong with America✨😡💥
Otherwise_Syllabub57,Make publicly traded corporations illegal then. Execs have a fiduciary duty to look out for the best interest of shareholders.  It sounds cold to the employees but that’s the way it is.  He has done nothing wrong
Gallops77,"Ballsy for him to say, but his salary is paid by McDonald's corporate.  

The guy working the counter at your local McDonald's is more than likely getting paid by the franchisee, who is not making $7 million a year.  The franchisee's are the ones who are going to get slammed with the large raise in minimum wages.

Which in the end will result in either employees getting fewer hours (Maybe 24 instead of 30, or the FT minimum of 32 instead of 40), or not replacing employees that leave and just working short handed to keep payroll costs steadier."
adamempathy,Why can it be done in McDonald's all over Europe then?  Denmark McDonald's make 22 bucks and a big Mac is $4.87  Compare that to the $7.25 people are paid here where a big Mac averages $5.66
pirateGHOSTsGHOST,“Man making $3500/hr doesn’t get it”
NarfledGarthak,Would it be bad if McD’s wasn’t a thing anymore?  Close them and let local restaurants pick up the slack
scriptfoo,"But, we also think they're essential workers."
Hot_Cold9680,"""Job-destroying"" meanwhile, they are actively working on a fully automated McDonald's 😐😑"
TheyCallMeButch,I work for healthcare company and our CEO made $16 million and they continue to tell us we’re “overstaffed and overpaid.” These executives are leeches to our societies.
MeatTornadoGold,"It's incredible. Top people could cut their salaries by 10%, still remain in the top 1% and suffer no hardships, and be able to afford benefits, better pay, etc for everyone and solve a lot of social issues"
cascading_error,"If you can't pay for it, you can't afford to buy a a workers time."
pharaohmaones,Costly and destructive to *his* job.  The one that pays 7mil a year
DenikaMae,Maybe it's time for us to stop eating McDonald's and start eating the rich.
myfirsttime68,Just as a reminder. They pay $25/hour plus 30 days PTO at McDonald's in Europe
mbelf,"When you said the McDonald's president, I thought you were talking about Trump."
Werealldudesyea,Imagine if companies used their stocks to pay employees instead of C level employees hoarding them for leverage to borrow against to live tax free.
iama_homosapien,"I find this funny because I bet you anything if it was raised to $22 an hour, you would have a lot more people applying and actually staying. One of the reasons I quit was because I was not being paid enough for the amount of stress I was put under"
aquarain,How many sammiches did he make?
Character_Jaguar1704,How difficult can it be to be the CEO of McDonalds.  Surely the company can save money by eliminating that position.
CleBlackCats,"There actually is not a mathematical formula or force inherent in the universe which states ""wages increases = cost increases"" but people really believe there's actually a magical, invisible, omnipresent Hand that determines this. It couldn't possibly be that the capitalist class, whose only motive is increasing profits, is responsible."
LegalBrandHats,"Ask him how much did they raise their food prices by, including how much their raised it on Ubereats, AND if they were impacted by inflation. 

The answer is yes to all of that. So they should also say yes to wage increases.

Ducking greedy fucks."
Number-Thirteen,"Maybe that sack of shit could lower his own salary to help out paying his workers, huh?"
No-Analysis-2420,"I'm not even gonna bother reading this because I've read enough like it so downvote me or whatever but this guy and all like him can get fucked! I just had to go through a 2 stage interview for waiting tables just to make a few hundred bucks a week which I am grateful for, but damn how does any expect me to a high productive part of society when this is the best they have to offer?. I have a bachelor's in history and was trying to go to law school but I got shafted on a few things and yeah some of them are my own fault but I'm still trying to survive, I'm still trying to hang in there! This shit is depressing as fuck I'm just so deeply tired trying to just stay alive"
Trooper057,"Yes. It could cost some of his inflated salary and it could cost some unnecessary office jobs if the company wanted to still run correctly. Instead it will cost essential low-income jobs and cost the company money as the service and quality deteriorates. They've made this same choice before, which is how they find themselves with an overpaid CEO and trouble maintaining enough essential workers to operate effectively."
Jedi-MindTrix,They want low wage slaves.
pachaneedsyou,"Did you guys know that McDonald's has a no tip policy? And their rationale behind it is because they pay higher than the minimum wage. Now wait, it gets more fucked up. In countries where there isn't a minimum wage ( e.g. Saudi Arabia, UAE, and Kuwait) they still stick to their policy 😅"
mammaube,It's costly cause now you can't buy another yacht for your mistress
cj-oak,“man scamming you desperately pleas to allow him to continue scamming you”
blutch14,Theyll raise the price of a happy meal so consumers will hate the employees rather than the greedy CEOs
splurgeoverthem,"He’s absolutely right. 

Think how many jobs they’d be able to fill and how much higher the wages could be if they just got rid of him. Losing one guy could free up so much more potential!"
Appropriate-Coast794,Eat the McRich
RememberSLDL,"I thought the McDonald's CEO made money primarily through franchising and land leasing fees? Wouldn't it be the small business owner, who runs the individual locations, hurt the most by the change in wage?"
