author,comment
AutoModerator,"
As a reminder, this subreddit [is for civil discussion.](/r/politics/wiki/index#wiki_be_civil)

In general, be courteous to others. Debate/discuss/argue the merits of ideas, don't attack people. Personal insults, shill or troll accusations, hate speech, any suggestion or support of harm, violence, or death, and other rule violations can result in a permanent ban. 

If you see comments in violation of our rules, please report them.

 For those who have questions regarding any media outlets being posted on this subreddit, please click [here](https://www.reddit.com/r/politics/wiki/approveddomainslist) to review our details as to our approved domains list and outlet criteria.
 
 **Special announcement:**
 
 r/politics is currently accepting new moderator applications.  If you want to help make this community a better place, consider [applying here today](https://www.reddit.com/r/politics/comments/sskg6a/rpolitics_is_looking_for_more_moderators/)!

***


*I am a bot, and this action was performed automatically. Please [contact the moderators of this subreddit](/message/compose/?to=/r/politics) if you have any questions or concerns.*"
HenryChinaskky,I feel like this would be a huge violation of like my child’s privacy and what’s it called oh yeah big government.
,[removed]
effieokay,I would start mailing my used tampons and pads etc to this fuckass.
SpaceLaserPilot,Can we have just one day where Republicans don't discuss other people's genitals?
M142Man,They can fuck off because ain't getting that information about my daughters.
AriBlue626,"Oh look, fear of trans athletes is morphing into more control over women for their protection, who could have guessed.

All for entertainment."
momentum77,So much for small government.
No-Consideration6589,Your conservatives are creepy asf America!
datfingtrump,"Lol, Gilead keeping track of the fertility of school girls"
hauteteacher,Next we'll get a headline that he's now requiring all women to register their periods online.
MidSp,"How would they even confirm any of the information they are given is accurate?  Vagina inspections?

Get the fuck out of here."
Busy_Appointment6932,I think this has more to do with monitoring teen pregnancy & potential abortions even more so than the trans issue. Seriously scary Nazi shit however you slice it.
dances_with_cougars,Just send them your used tampons ladies.
,[deleted]
Eric_in_America,"*The athletic association’s current Preparticipation Physical Evaluation Form, which must be completed by a student and their physician and kept on file at their school, asks female athletes five questions about their periods, but they’re all listed as optional.*

*The proposed revisions to the form include four mandatory questions about menstruation, including if the student has ever had a period, the age they had their first period, the date of their most recent period and how many periods they’ve had in the past year.*

Yeesh, this is coming from the party that's spent the last couple of years crying about their medical freedom. 

Make no mistake, Republicans are more then a eager to abandon their so called ""values"" if it's for the sake of their culture war. Desantis has shown us time and time again that he's willing to justify flagrant government overreach, censorship, suppression, discriminatory and ambiguously framed legislation, among other things of course, as long it preserves the culture war. 

It's the Republican M.O after all. Manufacture a problem to justify its solution. In this case, Desantis and his fellow scaremongers paint a picture of a transgender boogeyman, they overstate the impact of things like the transgender athletes in women's sports, they convince their voters that these issues are inescapable and ubiquitous, they peddle their propaganda and their alarmist rhetoric, and in turn it grants them all the support and justification they need to target the LGBTQ community through measures like these.

As long as it's in the name of thwarting the radical left's depraved, woke, subversive plot to establish a new world order, anything goes. Keep in mind that this isn't just about pursuing a regressive agenda or about justifying needlessly heavy-handed legislation, it's also about justifying the underlying attitudes that Republicans feel they've been forced to repress. 

The chauvinism and bigotry, the enmity and antagonism, the disgust and contempt, the ceaseless outrage, the discrimination and the feelings of entitlement, with the existence of this radical left-wing villain comes the power for Republicans to vindicate themselves, it allows them to indulge their own worst impulses and it helps them rationalize these subdued feelings."
I_downloaded_a_car_,"Hi America, how are you enjoying being the best, freest country on earth?"
hdiggyh,Seriously this is perverted and disgusting. How can anyone support this
NoMaintenance6179,Guarantee you this will be used as a weapon and tied into abortion clinics.
3dddrees,"Oh please do. Don’t just float that balloon, do it. I have to believe the blow back on this stupidity will be tremendous. If you think the overturn of Roe vs Wade didn’t go well, I’m thinking this will be worse."
kponomarenko,This is a party of small goverment reaching into your vagina.
,[removed]
Kvltadelic,"This headline and opening paragraph is what’s wrong with entertainment journalism. The first paragraph says the headline is false. Clickbait to churn the algorithm. 

Don’t get me wrong those lunatics are just crazy enough to do something like that but still."
WeaselTeamSix,What is the deal with these sick fucks?  Is it even the 21st century anymore?
hamsterfolly,The Party of personal invasion
Kannazuki1085,Soo is DeSantis going for cartoon villain?
MadEyeMood989,Petition to saw off Florida from the rest of the country like Bugs Bunny did in that one Looney Tunes short.
allegedalpaca,"Directly from the article:

CLAIM: Florida Gov. Ron DeSantis is requiring all female student-athletes in the state to provide detailed information about their periods in order to compete in organized sports.  
  
AP’S ASSESSMENT: False. The Florida High School Athletic Association is weighing the recommendation from an advisory committee, but no final decision has been made. DeSantis’ education commissioner is a member of the association’s board of directors and the commissioner also appoints three others, but the association is a private nonprofit organization, not a state agency under the purview of the governor’s office.

..."
Chrisbap,"So creepy and awful for these teen girls.  

Also, what’s to stop them from lying and/or giving false information to F with the system?  Or maybe that’s when Phase 2 (the inspections) kicks in.  🤮"
NeedMoreGreenBacks,"**The article was issued by AP to correct online misinformation per the below footnote.**





*This is part of AP’s effort to address widely shared misinformation...to add factual context to misleading content that is circulating online.*





The opening paragraphs are as follows:





**CLAIM**: *Florida Gov. Ron DeSantis is requiring all female student-athletes in the state to provide detailed information about their periods in order to compete in organized sports.*





AP’S ASSESSMENT: **FALSE.** *The* **Florida High School Athletic Association** *is weighing the recommendation from an advisory committee, but no final decision has been made. DeSantis’ education commissioner is a member of the association’s board of directors and the commissioner also appoints three others, but the association is a private nonprofit organization,* **not a state agency under the purview of the governor’s office.**



The article then goes on to say:



*Robert Sefcik, a member of the sports medicine advisory committee, said making the menstrual cycle questions mandatory rather than optional is consistent with* **national guidelines for sports physicals** *developed by the* **American Academy of Family Physicians, the American Academy of Pediatrics, the American College of Sports Medicine and other groups**.





*He said having a form that has been vetted and published by national organizations provides an “extremely credible resource” for doctors conducting sports physicals.*





*“We appreciate the medical necessity of the questions, including menstrual history, that are included on this form and support their inclusion on the form,” Sefcik, who was the committee’s previous chairperson and voted in favor of recommendations, wrote in an email The national guidelines say menstrual history is an “essential discussion for female athletes” because period abnormalities could be a sign of “low energy availability, pregnancy, or other gynecologic or medical conditions.”*





**“Menstrual dysfunction is 2-3 times more common in athletes than nonathletes, and 10-15% of female athletes have amenorrhea (loss of menstrual cycle) or oligomenorrhea (a decrease in number of menstrual cycles per year),” the guidelines read. “Amenorrhea occurs more frequently in players of sports that emphasize leanness, such as running, gymnastics, cheerleading, dance, and figure skating.”**


Edit:


Per **Outsports** (an LGBT sports website):


*""At least 44 states currently require or request the asking of female high school athletes for information about their “menstrual period,” Outsports has found through a state-by-state examination of publicly available “preparticipation physical evaluation” forms, as they are commonly called.""*


*Many of the states asked similar or identical questions to one another, as their forms are derived from — or copies of — the pre-participation evaluation form suggested and written by the **American Academy of Pediatrics**.*


*“The AAP has included these questions because medical providers who perform sports physicals recognize that they are important,” said Dr. Rebecca Carl from the Institute for Sports Medicine and an AAP representative. “It’s also important to note that we take the concerns about privacy seriously. The information is not designed to be shared with schools. That information is to document the information between the person performing the physical and the student-athlete and their family.”*


*Of the 44 states that include these questions, there was no significant difference between how often Republican-led or Democratic-led states utilized them on their suggested or required forms.*"
mrhooha,Read the article everyone.
NuclearFoodie,"Ugh, I was hoping this would have died after the backlash when it was first discussed in October. This is absolute madness."
guyhavingfun6969,This is crazy
PurpleSignificant725,"What a bullshit, unneccessary proposal. Fuckin flotida, man"
ZubLor,Closer and closer to the Handmaid's Tale...
IJustLoggedInToSay-,Starting to think their objection is just that they think women shouldn't be athletes in general.  They are just using trans people as an excuse to harass all women at this point.
mjg315,Small government my ass.
zjd0114,Have any of you read the fucking article
MetalGramps,"So this is what ""smaller government"" looks like."
magician_8760,"AP’S ASSESSMENT: False. The Florida High School Athletic Association is weighing the recommendation from an advisory committee, but no final decision has been made. DeSantis’ education commissioner is a member of the association’s board of directors and the commissioner also appoints three others, but the association is a private nonprofit organization, not a state agency under the purview of the governor’s office.

**READ THE ARTICLE**"
East-Laugh6023,"Sounds like a good way to get girls to quit sports. Could you imagine, ""Is it that time of the month yet? Why are you late? ""
Edit:Also
This probably won't be, but this is hopefully closer to the straw that breaks the camels back with support for DeSantis. Although, they supported Trump through a lot of BS, and I guess still do"
ranchoparksteve,"Why not cut to the chase and demand weekly hormone tests of **all** athletes, regardless of gender. To be fair, make the alleged guys continually prove they’re actually guys."
Elliott2,Lol what a shithole
Vreas,What the actual fuck. Can they focus on actual issues please? Like climate change? Considering Miami is going to be underwater in 20 years if we don’t change course now
topplehat,They really want that red wave.
beamrider,How soon until they expand it to all females of child-bearing age?
ScarcityIcy8519,"Florida has become Gilead in 
Handmaiden’s Tale"
summerll0ve,That’s so fucking invasive. Party of less governing tho amiright
okiedokie2468,Gilead…. Under his eye
cssualgoddess,Republican politicians and their fans are vile scum bags.
SetterOfTrends,Pedo groomers
mechabeast,Alienate 50% because 30% have issues with 0.5%
fdc7719,"Since the Nixon administration, conservatives have pushed all of these non-social issues in front of us to draw attention away from how badly they are fucking their own constituents. A lot of it was insincere rhetoric to get the Evangelical vote every 4 years. Except now we have true believers in the rhetoric. Every day they have to keep upping the outrage to drive conservatives that buy the narrative to the polls. If they did anything less, they are deemed a RINO and abandoned by the party. Honestly, after Obama was elected the first time, in my own lifetime, I saw the true face of conservatives. All of this morality bullshit that they claim to hold so dear clearly isn’t what’s actually important to them. It’s a convenient excuse to push horrific agendas that harm various minority groups. I thought I had seen the extent of how badly they would throw a tantrum during Obama’s second term. I’m now horrified every single day that they somehow manage to keep lowering the bar. Fuck these assholes who haven’t had consensual or pleasurable sex since the Carter administration and feel the need to punish everyone else for it."
Griz_and_Timbers,This is some crazy ass evil shit right here.
biskitheadburl,"If you are a woman living under a conservative regime and you are not fighting to rid our nation of these freaks, what the hell is wrong with you?"
Shank5ter,This is against your right to medical privacy and won’t stand up in court for even a second
aod42091,we need to codify constitutional body privacy rights
Wwize,The athletes who's privacy is about to be violated should go on strike.  Stop playing until the fucking nazis in the Republican party back down.
Batman282009,"I don’t like Desantis…… I want to make that clear…….

But did ANYONE actually read the article??????"
billsatwork,"Anti-trans rhetoric in 2023 America is VERY, VERY SIMILAR to anti-semetic rhetoric in 1932 Germany."
CricketKingofLocusts,Note that the article posted states that the title statement is FALSE
DisingenuousTowel,"Did no one actually read the article?

Desantis' office didn't create this proposal and was developed by the medical body that oversees intercollegiate sports.

The questions already existed but we're optional.

Maybe they shouldn't be mandatory... But this wasn't created by the governor's office.

""Robert Sefcik, a member of the sports medicine advisory committee, said making the menstrual cycle questions mandatory rather than optional is consistent with national guidelines for sports physicals developed by the American Academy of Family Physicians, the American Academy of Pediatrics, the American College of Sports Medicine and other groups.""

And don't think I support Desantis' - I'm transgender myself."
Saltlife60,Women students and the elderly have no freedom in Florida. This is outrageous.
AssociateJaded3931,Why is Florida abusing its girls?
openly_gray,"Quite honestly I don’t understand how this is even legal, esp if that info is shared with non-medical personal."
betteroff80s,So the article is saying the opposite of the headline? How does this shit get posted?
UtgaardLoki,"The American Taliban is trying so f**king hard. I urge you, disappoint them at every turn."
mdruckus,I don’t care if the democrat nominee is Biden or my dog. I expect more than 80 million votes this time to beat out these perv republicans. They are so messed up.
Jpar4686,Ah yes the party that screeched about bodily autonomy and freedom from large government over masks in a pandemics wants to know intimate details of women in an act of blatant transphobia. Consider me shocked.
19southmainco,i think he outright loses a general presidential election if he tries to mandate monitoring menstruation in his state. i don’t think you can dig yourself out of those attack ads
CatAvailable3953,When young women are bleeding they shall be banished from the community as unclean. It’s happened before. It’s in scripture. Now Florida Man is bringing it back. To his Florida. Y’all who didn’t vote for him will soon his to keep.
Psychological_Lack96,Adolph De Hitlertis pandering to the Monsters..
ioncloud9,"The party of small government, so small it can fit in your panties."
TheButteredBiscuit,How can you even willingly raise kids in Florida at this point?
fallingfrog,"If I was one of these girls I’d organize a walkout across the school.  You’re going to treat them like that, you don’t get a sports program.

Of course, conservatives would probably rather have no sports at all than allow trans kids in them.."
Reptorian,"Essentially, Republicans are debating if women are breeding livestocks or nothing more than a cattle."
BoyScoutReddit,"…yo. It’s crazy to me that I keep seeing headlines like this. Absolutely fucking not. 

What the fuck are we doing here? What is going on with parents in Florida? I’m getting to the point where I want them to secede."
Methoszs,They really are using the Handmaids Tale as a guide book aren't they.
NicCagedd,"So is this being talked about on r/conservative, or are they choosing to ignore this fascism and just talking about the laptop?"
wodthing,"So, is he also volunteering to provide the schedule of him jizzing in his cum sock?"
FindingZemo1,Florida is becoming a middle eastern country at this point
Slightly_Smaug,This sounds like a dystopian start to a mandated breeding program.
moodyblue8222,The war on women in full view!
LeekGullible,Why does any female vote for any current republicans.....your just asking them to get in your business.
hanker30,Why is there a war on women going on in the states? It seems to be like an oxymoron that a party that says it promotes less government intrusion in peoples lives is getting way more intrusive into peoples lives? Is there nothing else going on in Florida for the state to worry about ?
Alternative-Phacts,Wasn’t this a reason why Europeans wanted to come here? The “religious” wanted to be much more stricter than the “liberals” in Europe would allow?
KittyL0ver,Would they have a case to sue for discrimination based on sex?  They aren’t collecting health information from male athletes.
oiransc2,I keep scrolling down and every comment comes from someone who didn’t click and read the link.
