author,comment
This_Egg_348,"She’s saying I want to be on all the choice committees that can persecute the FBI, Fauci, and the January 6th committee."
thowaway274298,"Sounds like the kind of moron that shpuldn't be in government.

This is the same one who just *recently* learned to stop downplaying the holocaust."
Cauldkiltbaws,This scumbag will say anything if it advances her agenda
felixbotticelli,"""I used to be a fucking idiot, but I'm smart now."""
selfimmolations,"if you get sucked into lame ass conspiracy theories that easily, you probably shouldn't hold office. but that's just my opinion"
SkywalknLuke,She said what she needed to say to get elected.  Grifter gonna grift.
BasicBitch_666,"""I might have been wrong about that whack job conspiracy, but I'm sure I'm on the right track regarding all those other whack job conspiracies."""
High_Pains_of_WTX,"Ohhhh, someone wants to do POLITICS now, huh?"
aStoveAbove,"So she's saying she's not hateful, she's just really, really, really fucking stupid?  

She's either got the IQ of room temperature in the Arctic during a blizzard, or she's a hateful piece of shit. I'd argue both, but the fact she thinks she can play off all this shit as ""I just got sucked into some stuff online"" isn't the absolution she thinks it is lmfao"
fenris71,"Everybody say it with me….Jewish space lasers. 
Gullible is not the word"
