author,comment
1jobonthislousyship,"Resubmitted because I referenced another user I thought had a good point. I offer my sincerest apologies, and will never, ever, again think of anyone who uses reddit as an actual human being. Shame on me. It would be a real bummer if someone who doesn't suffer from coffee withdrawal read this.

––
OP:

Regardless of what this thing looks like on its face, has everyone forgotten how difficult it is to get a Constitutional Amendment passed? For reference, the most recent (27th) Amendment was first proposed in September of 1789, and only passed in May of 1992. (For those of us who can't do math in our heads, that's a 203 year time lag.)

This is a loud effort for the sole purpose going nowhere except to point fingers at the folks (again in House majority) who passed this $#!+ legislation to begin with.

Or, if you prefer, another one of those ""I watched the Ghandi documentary"" weak position gambits the kind-hearted, lovely, flailing-armed left is famous for.

<rant> I love you useless f*ckers, but grow some guts, would ya? Our head honcho is a guy who can't stay upright on a bicycle. We seriously voted for this jackass ONLY because he was the one person up for grabs who wasn't naturally bent toward starting a war for the sake of economics.

Maybe one day, this Republic will honor the individual citizen's voice rather than their wallet. Maybe we'll approach democracy some day. </rant>"
dangshnizzle,Wow. How many years late? Damage very much already done
JackStephanovich,If they are pushing an amendment then just go all the way and push for publicly funded elections.  We need to get money out of politics for good.
LakewoodHayandGrain,"The Democrats can add this to their arsenal of sane and popular projects and have all of 2023 and most of 2024 to hammer the message home to voters while the GQP does nothing but obstruct, obfuscate, and obstreperate."
limb3h,At least fucking require the donors to be published.
Philly2_1_5,"I challenge anyone to point to another single policy change that would improve the lives of more people on planet earth than ending the influence of outside money in American political campaigns. 

There is not a single issue you care about, nor a single problem you think needs fixing that elected officials who aren’t influenced by monied interests wouldn’t make better. 

This is the key to saving our country. Doesn’t matter what your politics are. Nothing else matters more than this."
Ok_Effective_2536,We need this more than anything.
