author,comment
JeromesNiece,"Two things are true at once:

1. CEO pay growth has grossly outpaced pay growth for the average worker, and the current ratio of CEO pay to average worker pay is obscene.

2. This guy is absolutely correct; a $22 minimum wage for fast food workers in California would be costly and job destroying, and this would be true even if the President of McDonalds worked for free.

Many redditors seem totally unable to conceptualize the difference in magnitude between a 50% wage hike for tens of thousands of workers vs. a CEO salary. The former is on the scale of hundreds of millions of dollars per year. The latter is below ten million dollars per year. You cannot fund a 50% wage increase for tens of thousands of workers by cutting the CEO's salary. The math just doesn't work."
Impossible-Key-2212,"The equation for automation is very simple

Add up the yearly wage, taxes paid by corp, training, vacation, retirement and you have a good number to start.  At 22 an hour an individual would cos the company approximately $52000.00 year.  If the restaurant is open for 16 hours a day the wage is $104000.00.  This is based on a 2000 hour work year.  40 hours a week for 50 weeks.

A kiosk order station costs about $15000.00.
A line cook robot is less than $150000.00 per unit.
The return on investment is often time less than one year.  

No one will have a job at a fast food restaurant except a person to unload the truck and put the food away.

https://finance.yahoo.com/news/mc-donalds-automated-drive-thru-is-just-the-latest-sign-of-robots-taking-over-fast-food-170158300.html

This guy is going to get a bonus for automating the restaurants.

Here is a fully automated McDonalds

https://www.reddit.com/r/Damnthatsinteresting/comments/10odp8f/a_mcdonalds_location_has_opened_in_white/?utm_source=share&utm_medium=ios_app&utm_name=iossmf"
orbitalaction,"Anyone that thinks they do not deserve to make more, should have to survive for a year on their salary.

Edit: People keep arguing how a business shouldn't be forced to operate at a loss... well, NO ONE, living in the u.s. can live on 7.25 an hour. So humans can operate at a loss, but not corporations that barely pay taxes?  No, pay a living wage or close. Irdc."
grixorbatz,Translation:  paying workers $22/hour will take a big wet bite out of my lust for McYachts and McMansions.
Green-Cardiologist27,I generally think corporations pay way too much for C-Suite types. But $20MM for the global CEO of McDonald’s isn’t extremely low relative to industry peers. And $22/hr is really high for an entry level job. More and more of this stuff is going to be forced towards automation.
custardbun01,Works in Australia. Maccas is still cheap.
HodlMyBottle,That's how he gets those bonuses. Welcome to (super-)capitalism.
ArtisanJagon,"McDonald's makes 10+ billion a year in profits and spends billions on paying out dividens and stock buybacks every single year.

But yes. Paying workers a living wage is the issue here."
trophylies,"ITT: literally nobody read the article, or the article posted the other day about the referendum. The companies (mcdonalds, chipotle, etc) are not saying that THEY can't pay these wages. They are saying that the bill, which ONLY affects fast food chains, will make it nearly impossible for *small businesses* to attract labor. You can work at McDonald's for $22/hr or you can work at George's Family Restaurant for $15.50. It's not the fast food conglomerates' bottom line that is troubled by a nearly 50% wage increase, it's the small business who is competing with them already for labor. 

You have got to take a step back from the ""fuck CEOs and corporations and capitalism"" table and start to think about second order effects of these things. This is going to end up with the ""road to hell is paved with good intentions"" bucket and this comment section is cheering it on."
Thatwazmeen,Fast food is demanding work. They deserve it.
LessonNyne,"You know what else is costly Joseph Erlinger...

Rent, buying a House, Gas, Food, Raising Kids, Medication.

So Mr. McMillionaire, you can shove your ""job-destroying"" rhetoric. Capitalism is doing a fine job of destroying jobs. Not, paying people people a living wage.

Edit typo"
arnicticon,"He's right, there's a cost and technology point where tech is going to eliminate 80pct of those jobs in favor of automation."
IhatePredators,Two things can be true at the same time.
iamthpecial,If McD paid $22 an hour I would more than happily work there tbh.
CameraguySD,It's all about responsibility and most of these executives are performance based on the stick price.
xDARSHx,"Interesting, because I personally find that paying the people at the top millions while barley paying low level employees (the ones actually making the company money)  to be ""costly and job destroying""."
,"Then end it. Like a small business kicking and screaming in the dirt that they’ll go bankrupt if they have to pay their employee another .50 an hour to ensure they can eat, where really the owner would need to delay the installation of a barrel sauna at their waterfront cottage and the invariable suffering of another human being is worth it? Then end it. Shutter the doors. The exaggeration and lies for the sake of profit for some are only valuable to those who are in the position to take, and take, and take, and take, and take, and take, and take. 

And take, and take, and take. 

Over a goddamned sandwich shop. We’ve made his life, and he would deny yours. For sandwiches."
CouchHam,They already cut out employees with their shit kiosks. And paying the rest a living wage is too much. I live a block from McDonald’s and have only eaten there twice in 5 years when my mom brought it for nostalgia. Fuck fast food.
katieleehaw,"If it’s destroying jobs that don’t pay enough to live, then good."
Tamirel963,Destroying a non-viable work 3 jobs to survive job? Oh no. Why doesn’t McDonald’s free up 7 million and find a way to no have a CEO?
Epstiendidntkillself,"Don't ever forget about this.     

https://www.youtube.com/watch?v=LZnMOAwTPEs"
narwhalyurok,"Based on a 'normal' 40 hour work week this CEO cretin makes $3557.00 an hour.
I do believe paying grease and fry cooks $22 an hour won't hurt his bottom line."
rp2784,Per 40 hour work week that’s $3557.69/hour
looselaugh,Everyone saying the math is total number of employees times 16 hours a day doesn’t understand math. Every employee doesn’t work 16 hours a day.
HobsNCalvin,What about the McDonald’s in Texas that is automatically made and served by A.I
d_e_l_u_x_e,"Not in some European countries though, just in the richest country can we not afford to pay our workers."
mostlygroovy,"There’s nothing that destroys my support of our current capitalist structure than executive pay.

Meta’s value (at one point) tumbled by 75% and Zuckerberg was still making a base salary of $28M"
Originalfrozenbanana,"Assuming the average wage at a McDonalds is $15/hr, just fire the CEO and subsidize 1 million worker hours worth of salary increases. Still job destroying, but this time it's only the CEO whose job gets destroyed. I'm cool with it."
moradinshammer,"They pay these higher wages elsewhere in the world, often with higher taxes and they do it because they can still be profitable doing it"
Jacque_Hass,The paradigm shift is long overdue
bshepp,Every corporation has decided how much of your money they deserve while none of them are willing to give you that kind of money.
Please_do_not_DM_me,"There's too much subsidizing of these industries going on. TBH if we pull back and 50% of the franchises go under that's healthy. The remaining business can become more productive, charge more, and we'll have fewer fat people.

Like where I live, there's 5 restaurants (EDIT: it's actually over 8 I forgot about the DelTaco across  the street and a chinese place down the road.) within walking distance. Under 12 minutes one way to the farthest one. Realistically there should be like 2.

(EDIT: Oh, and there's 2 more being built 100 yards from me. So a total of 9 in the next few years...)"
tacky_pete,Won’t someone think about the shareholders!!
Outrageous_Fall_9568,Strike!
screenmasher,That's great. I'm all for it. People will work honestly for good pay. Last time I went to McDonald's the 14 year old behind the register was on his cell phone and couldn't be bothered. I don't blame him for 8 bucks an hour
BackwardsColonoscopy,"I guess I really am just that poor, but I can't imagine making MILLIONS in a year and thinking, 'okay i need more than this'. Some perspective, it'd take me 12-15 years to make 1 million if I could save my entire paycheck. This guy makes more money than most people will make in a lifetime and doesn't stop to think for a moment, huh, maybe I finally have enough. 

I'm not entirely convinced rich people are fully human. But I am convinced this system can't continue like this much longer."
MrTBirdGaming,Why is this in politics?
dustwanders,"So? $18 is costly and life destroying to your worker

They only care about themselves"
Cult_Chief,"Imagine making over 3k an hour every workday and being like ""AH yeah, these workers that worked harder than I? They can have this petty change c:""

Seriously. With that sort of money the man basically makes a regular years wage in a single day."
barth_,"Denmark would like a word about this ""job destroying"" thing."
BeastOfTheField83,r/latestagecapitalism
lnin0,"Companies can pay outrageous salaries to their CEOs,  buy back billions in stock and make sure to never cut a shareholder’s dividend but when it comes to workers, fuck ‘em."
Upper-Application583,They make so much revenue.. they can pay it.so easy :(
BlueMANAHat,"Mcdonalds corp would not pay these wages as they dont hire restaurant employees directly. The brunt of the cost would go to franchise owners.

But with that said its important to note that Finland or Poland I forget which mcD pays the equivalent of 22 an hour and their big mac costs less than ours..."
_Oooooooooooooooooh_,"22 per hour, 40 hours per week would be ~45760 dollars per year

That is 160 workers, they could have paid that, instead of paying him. lol"
Alarmifdfgh,the President of McDonald’s makes only $7 million a year.
TravelingHero2,Exploitation by Capitalist scumbags at its finest.
giosthebest,Thats how hes able to make 7.4 a year
Jumbalayaq,Keeping it in the top 1%. Lol.
3ye0f8alor,"It is because the higher ups want their bonuses and incredibly high salaries. That’s what bothers me about all of these bailouts over Covid and the banking crisis. If these companies just saved their excess money for losses, the government wouldn’t have to bail them out or have massive layoffs. Greed. That’s our problem. Greed"
EmmaLouLove,Billionaires who call working class Americans lazy and then tell workers to eat cake is getting a little old.
-bferis-,McDonald's should just close up shop in California.
Hellige88,"So if this guy works 40 hours per week, he’d be making $3,557.69 an hour. That’s over 160 times the pay rate that he’s saying is “too much!”"
BilfordWimley,"Dude. I get paid 20$ to run two industrial air fryers. In a kitchen that's only been open for 7 months and makes a couple thousand a week, instead of millions a month, all around the world. This guy sounds like he needs to wake up with a Ronald McDonald head godfather style"
Rensi,Now that's how you write a headline
routerg0d,"Maybe it’s time to pass a law where the highest paid employee at a company including the board if compensated, cannot exceed a multiple of 10. Then I bet these CEOs would figure out how to do raises. The savings could pay for 150 more 22 a hour employees just from his pay."
M142Man,Wealthy executives aren't reading the room
tomfrost13,He’s full of shit evidenced by the healthy wages McDonald’s pays their workers in some other countries with very minimal price differences for customers
UUtch,"I mean looks like McDonald's has over 11 million employees just in the United States, so considering he could give away his entire yearly salary and each employee would get less than a dollar as a Christmas bonus, I must say I don't see how his salary shows where the money could come from without cutting hours"
3Quondam6extanT9,"""I'm wealthy. We can't pay people more money because that would make me a fraction less wealthy and that is unacceptable."""
fthotmixgerald,"The idea that CEOs earn more because they work harder is one of the most obvious lies in history. I've worked with multiple CEOs and these people don't do shit.

Woker-owned cooperatives are more efficient, more productive and more resilient against closure. Get rid of the standard hierarchy ASAP."
