author,comment
AutoModerator,"
As a reminder, this subreddit [is for civil discussion.](/r/politics/wiki/index#wiki_be_civil)

In general, be courteous to others. Debate/discuss/argue the merits of ideas, don't attack people. Personal insults, shill or troll accusations, hate speech, any suggestion or support of harm, violence, or death, and other rule violations can result in a permanent ban. 

If you see comments in violation of our rules, please report them.

 For those who have questions regarding any media outlets being posted on this subreddit, please click [here](https://www.reddit.com/r/politics/wiki/approveddomainslist) to review our details as to our approved domains list and outlet criteria.
 
 **Special announcement:**
 
 r/politics is currently accepting new moderator applications.  If you want to help make this community a better place, consider [applying here today](https://www.reddit.com/r/politics/comments/sskg6a/rpolitics_is_looking_for_more_moderators/)!

***


*I am a bot, and this action was performed automatically. Please [contact the moderators of this subreddit](/message/compose/?to=/r/politics) if you have any questions or concerns.*"
GoatboyTheShampooer,"The GOP tried to kill it in 2017 as well.

This all spurs from the [GOP getting into massive trouble for being bribed](https://www.csmonitor.com/2006/0109/p02s02-uspo.html)

I wonder who else could be bribing the GOP these days."
Pholusactual,"If this is the first priority they had I think it's funny as shit they didn't mention it when campaigning -- they were pissing and moaning about how crime was out of control and inflation was ruining them and immigration was a threat to the nation.

They get in and their first priority is not to fix the supposed crises but instead they rush to remove any accountability mechanisms they might run afoul of.

There is no other conclusion than Republicans are lowlife scum and trash."
kayak_enjoyer,Ex-president and undisputed MMA champion George Santos?
jkwah,So much for 'accountability is coming'.
Lurkerphobia,Why would Republicans need ethics? They just get in the way of doing the things they want to do.
2_Spicy_2_Impeach,"How do their supporters reconcile ""draining the swamp"" when they gut ethics bodies?"
lew_rong,George Santos personally studied ethics with Aristotle.
Mugsyjones,People don’t understand the modern Republican Party is a nihilistic group. The goal is to destroy our government. It’s the only way to continue with minority rule
efnPeej,"It blows my mind that they are not only doing this, but also talking about it, as if it's a win or something. And just because McCarthy gave away every fever dream the crazies wanted just so he could have a fucking portrait in the hall. 

And people will continue to vote for this because apparently Democrats are going to make being transgender mandatory or some shit. wtaf."
drunkcowofdeath,Who needs The Onion?
old-hand-2,"This vote make it seem that republicans don’t like ethics and oversight. 

Why’s that?"
BstintheWst,Make the government so dysfunctional and openly corrupt that everyone is ready to burn it down and then use that opportunity to create a system that firmly entrenches the oligarchy.
drunk-on-the-amtrak,"Tony Gonzales (R-TX 23) the lone Republican NAY vote, interestingly he represents the Uvalde area."
buttfunfor_everyone,"It’s like none of them read 1984.

What you’re SUPPOSED to do is run an “ethics committee,” appoint all of your buddies, and then use it as branch of government that enforces and justifies your unethical behavior.

It is truly idiot amateur hour. If you’re going to be an evil disney villian at least be fucking good at it."
,[deleted]
Samurai_gaijin,">Town bank removes all security measures, local bank robber calls it fantastic."
No-Satisfaction78,"It's... Its just a disaster. They're gonna mess shit up so bad. They always do. I do NOT understand how some of these people keep getting elected, despite screwing over their very own constituency multiple times."
westdl,"As the party in charge, they are responsible for running these committees. Since they have NO ethics, they have no idea how to run that committee. Honestly, they have no idea how to run anything other than criminal organizations but I don’t think there is a House Criminal Organization Committee…yet."
vim0971,Why the “f” does any governmental body have the authority to slash any investigative body into their own ethics?  Investigate them all.  24/7 audits.  Nothing should be off limits for those that legislate for the rest of us.
pottman,Hold on to your butts people. The next two years are going to be a wild ride.
gogojack,"I don't think it was intentional, but the nexus of Santos and the vote to gut the ethics office is peak GOP at this point.

Think about it.  They have a near-perfect test case.  A newly minted Congressman who lied about literally everything.  I'm not convinced he's even from the district, or even New York.

He's at once a nobody and everybody.  If he stays in office even after everything that's come out, they've won.  They can run someone who has no qualifications, no qualms about lying, there's no mechanism for holding him responsible, and if the voters are okay with it?

It's a win-win. If they pull this off, they will never have to answer to anyone ever again."
Lawmonger,Right off the bat the GOP votes to prevent ethics investigations. All you need to know.
2u3e9v,What an enormous piece of shit
Timpa87,Foxes vote to be allowed to guard the hen house. Call it 'fantastic'
gwthrowaway2121,"Well, I think that’s enough political doom scrolling for me this year - it’s really taking a toll on my mental health. 

It’s so incredibly depressing that there’s people dumb enough to not see through this and continue voting for literal criminals and conmen, who are openly gutting the seemingly only committee able to hold them accountable. 

Today, I am not proud to be an American."
tashurcam,"George Santos Calls It 'Fantastic'

That's cause the slimy sleazy worm has no ethics."
krichard-21,"Republicans, the Rock Bottom Party.

Their moto, ""We hit bottom, so let's start digging!!!"""
NotOK1955,"Sounds a LOT like 1933 Germany and the passing of the “Enabling Act”. Don’t dismiss it…Germans did so back then and remember what followed.

https://encyclopedia.ushmm.org/content/en/article/the-enabling-act"
moodyblue8222,"No ethics, just how republicans like it! Lie, cheat, treason….they live it all!"
OddWorldliness989,With all the lying and doing unethical things he knows a thing or two about ethics.
macgruff,"So, gut any accountability, and defund the IRS so they cannot audit… stellar two days, impressive.  I give it 9.5/10 on the fascism scale.

“It’s a bold strategy Cotton, let’s see if it pays off for ‘em”"
N0T8g81n,"Well, that's 1 true thing Santos has said in 2023. From his perspective.

Fortunately, the FEC isn't under direct control of the House of Representatives."
dennydelirium,"This guy is shameless and disgusting..not to mention the fact that he pays women to fart on his face, allegedly."
pattydickens,It's what Jesus would do.
cmgchamp2,"Sooooooooooooooo let me get this straight.

The party that green lighted fraud, cheating, obstruction, larceny, embezzlement, racketering, bribery, and laundering.................

guts ethics committee.

Okay, I can see that.   Right Repubs?"
LogicalManager,The punchlines speak for themselves
Papazigzags,"It's not just Santos who agrees.mccarthy let's half of the house off the hook, from the ethics committee that couldn't do anything anyway. Santos will be a hero, for a minute or two, the sedition caucus already welcomed him with open arms.This is a another step to tear apart democracy."
sevens-on-her-sleeve,So is this what was whispered into Matt Gaetz’s ear before he changed his vote?
nosotros_road_sodium,"A little nitpick: The article misleadingly suggests Belinda Pinckney is a former member of Congress because her name is after ""former Reps."". [She never served in Congress](https://oce.house.gov/about/board-and-staff/belinda-pinckney). But the other two members named, [Mike Barnes](https://en.wikipedia.org/wiki/Michael_D._Barnes) and [Karan English](https://en.wikipedia.org/wiki/Karan_English), did.

Also, the reporter *had* to have intentionally sought out a quote from *George Santos* of all possible representatives."
AngryFungus,"Drain the swamp, eh?

The hypocrisy of Republicans should be staggering, but by now it’s just laughably predictable."
ProveItorStuffIt,This is what happens when those that attempt to overthrow our nation are put in charge of it.
Oghier,"Santos simply thinks the House should adopt the principles laid out in *Groundwork of the Metaphysics of Morals,* which he co-authored with some guy named Kant."
frostfall010,I guess this will fix soaring rent prices and plenty of other issues that the average American faces every day. The Republican Party is a complete joke and has no interest in governing.
Natoochtoniket,"The Executive should announce:

1. The President believes that ethics in government are essential;
2. The tax return of every elected official will be fully audited every year;
3. Reward for information leading to arrest and conviction of any elected official;"
randomnighmare,"So called, ""party of responsibility"" my ass..."
VECBlows,That should fix inflation.
baddfingerz1968,"Repugnicans are a morally bankrupt band of SOCIOPATHS and CRIMINALS, and they don't even try to hide it anymore."
sonoma4life,"ethics = bible

everything else is crt."
polaromonas,Only frauds don't see this as a huge conflict of interest.
QuestionMarkyMark,Have Republicans *ever* gave a shit about ethics?
Lord_Blackthorn,Why do I get the feeling this weasel is the most dangerous one there and we don't really grasp the full picture yet?
Frangiblepani,"How are they going to go after ""the corrupt Democrats"" they promised to catch without this?"
7fingered-meatcutter,"If my bank publicly announced it was gutting its ethics rules, I'd certainly still trust them with my money. Wouldn't You?"
midnight_reborn,"It's gonna be bad, guys. House GOP will do everything in its power to cover the asses of all criminals who are within their ranks. Thank All Goodness that Dems at least control the Senate and the Executive so that laws can be stopped."
Slippinjimmyforever,"George Santos truly represents the worst of us. 

I didn’t think pathetic officials like MTG and Boebert could be topped. I stand corrected."
MalumOptimatium,There is no such thing as an honorable Conservative. Each and every single one are fascists.
colocasi4,Why is lying Santos still hanging around? lol
jay105000,Nobody is above the law!!..:: wait a minute….
leonpinetree,What a POS😹
OlderThanMyParents,"And once again, they beat The Onion to the story."
Hpmec,"They are proud that they are morally bankrupt, and their fans cheer them on."
BrownEggs93,They have no ethics.  They supported a coup.
gideon513,Every single candidate blathered on about “draining the swamp” and the first thing they do is remove accountability. Lol. The idiots that vote for these people…
Twiny,"To all the fucking morons who voted for Republicans, you proud of yourselves yet?"
arroe621,Fuck Republicans
wordsthatrhymewithox,I need to get off Reddit
codon011,"“We’re crooks, liars, and cheats and we won’t stand for accountability! The only thing we stand for is political Snipe Hunt^(rebidenslaptop)s!”"
teddykaygeebee,"Of course he does. Why is the face of the GQP people who can get out of cheating and scheming? Why are they such a piece of shit? Ffs, work for the people and not power you think you can grab. Fuck America. If they wanted it to work for everybody, it would but greed rules all here."
scott042,Wow and people voted these idiots into office. Hope whatever criminal crap they will be doing somehow gets caught. Why else would you do away with the ethics body?!?
Local-Talk-3831,Bunch of fucking meat swinging ball washers. So Sad !!
TrashScientist,“…. and then they said ***‘drain the swamp’*** — LMAO!”
kljfahu,"This ends with Santos as president, yeah?"
scjackets,Why need ethics committee when prayers works
-CJF-,"Republicans are united on hobbling oversight. The fact that these people can win elections, even with gerrymandering, tells a sad tale about the state of our country."
Ok-Exchange5756,"Republicans: CRIME IS OUTTA CONTROL! 
Also Republicans: WE MUST HOBBLE THE ETHICS OFFICE! 
What a buncha fucks."
SuperDuperBonerific,These motherfuckers are like Hydra lurking inside S.H.I.E.L.D. One of these days they are going to unleash their master plan upon the world.
Crazy_Pineapple8282,Reinforces my belief that American Republicans are real life supervillains.
TheZooCreeper,George Santos is like if the Riddler wasn't that smart
Dr-Chris-C,Santos wrote the constitution so he knows a thing or two about lawmaking
MagicaDispelica,Destroy and Abolish the Republican party
Kflynn1337,Of course they did that. The GOP sees no need for an Ethics Committee as they don't have any.
Darkdoomwewew,Fascists through and through.
Fryceratops,Santos is the new Boebert/Gaetz/Greene in that he has no power as a new member of Congress and he is there to provide a distraction.
Fun-Cupcake4430,Ethics in politics?
AnInsolentCog,"Wow. Just when I thought republican politics could not get more low or disgusting, they get more low and disgusting. I shouldn't be surprised, and yet I am"
CaptainAwesome06,"Nobody seemed to care the last time they voted on this years ago. Luckily, smarter Republicans squashed that at the time because of the bad optics. Now, they don't care at all about optics."
figgityfuck,The party of law and order. LOL
jml2,get these fucking criminals out of power
Loitering4daCulture,Let’s gut the House while we are at it. We don’t need checks and balances.
0tt0attack,Lol. You cannot make this shit up. And some MAGA idiot will come here and claim that the democrats are stealing  their country.
Rungi500,Traitors of Democracy. Put them on a bus and send them to the Taliban.
Kite_sunday,this reminds me when matt gaetz voted against protecting teens from human trafficking.
restore_democracy,Why do you need an ethics body when you have no ethics?
Armyman125,"Democrats need to talk about this. The Republicans have no problem spreading their lies, but it seems to me that Democrats aren't loud enough or incessant talking about the crazy excesses of the Republican party."
Dr_Tacopus,I’m genuinely curious how a republican voter can see this as a positive?  Would a republican please explain how eliminating ethics oversight is a good thing for government officials?  Why would you vote for people who would do that?
DaSaw,"I found myself wondering what Republican outlets are saying about this. I am still wondering. I checked redstate.com and Fox News and didn't see anything about it on their front pages. Also tried using google to search the site. Nothing. Indeed; they're not talking about Congress all.

What are they talking about? Apparently some classified documents were found at some Biden Institute in Pennsylvania? Headline compares it to Trump's documents thing, but the actual article, their own article, reports that the find was immediately reported to the records office and the documents returned shortly after... which is what people are supposed to do when classified documents get misplaced.

So, yeah. They don't even have an excuse for this Congressional Ethics Office thing. They're too busy still trying the ""no u"" defense."
devildocjames,Russia doesn't need physical weapons.  Shit is going downhill towards a civil war again and fast.
Sea_of_Blue,Republicans stripping even the smallest ethical oversight away? Color me shocked. Oh wait they [do that every time they get in power now. ](https://www.nytimes.com/2017/01/02/us/politics/with-no-warning-house-republicans-vote-to-hobble-independent-ethics-office.html)
ClobetasolRelief,The GOP are so fucking corrupt and anyone who supports them is a traitor to America
Bhimtu,"House GOP showing its true colors. They are unconcerned with running our country or doing much for the American People besides whipping us like the dogs they think we are.

Kevin McCarthy was elected Speaker to ensure that GOPers involved in the J6 insurrection are NEVER held accountable, or exposed for being the traitors they are. McCarthy touted the ""power of the subpoena"" as I passed the TV and I exclaimed ""WHAT POWER?"" <-because they defied subpoenas all over the place, and don't want to have to explain to the American People WHY:  [https://www.msn.com/en-us/news/politics/gop-preemptively-strikes-down-ethics-probe-into-actions-of-four-republicans/ar-AA16aFFS?rc=1&ocid=winp1taskbar&cvid=b50040df56704e399711e9df624ecc5a](https://www.msn.com/en-us/news/politics/gop-preemptively-strikes-down-ethics-probe-into-actions-of-four-republicans/ar-AA16aFFS?rc=1&ocid=winp1taskbar&cvid=b50040df56704e399711e9df624ecc5a)

Because they're traitorous criminals, that's why. And now you have trump's stooge, McCarthy, leading the ""WE WON'T BE HELD ACCOUNTABLE"" charge of their criminal brigade.

Good luck, America. We're gonna need it."
jtscira,GOP is pretty much a terrorist organization at this point.
Senior-Sharpie,"Oh, and by the way, they are back to trying to gut the IRS to protect their super rich overlords from paying taxes."
bobbertwest,Republicans have absolutely no honor.  fucking pathetic
AdkRaine12,"Who is their Grifter-in-Chief?  Who told how many lies?  Who supports the Christo-Fascist and bigots of this country?  Who are the members of his party who hope to inherit this lovely base?  

They are his party is he is their hero.

They are telling us who they are.  Again."
Cultural-Bug6675309,"Just when I think how I can never vot for a member of the GOP again, they just go out so themselves one more time!"
Purrade,"Tried to post this in r/conservatives and it said it was already shared, yet I tried to look for the post and could not find it…"
Present_Crew_713,"Kill the ethics committee?

They don't have any ethics the way it is now.

Devoid of emotion, and morally bankrupt."
AceCombat9519,Completely unacceptable and for the Republicans they see themselves above the law
bruceki,"""the party of law and order"""
Pandaspoon13,"Fuck the GOP in their corrupt, ignorant, controlling, projecting, idiotic, stupid, racist, and dumb asses. All of them for fucking ever."
TemporaryConfusius,Republicans are easily the worst
SushiPants85,Republican 🗑
1984R,People vote for these ghouls.
Differential_moron,At this point the republicans are a parody of a political party
EyeRepresentative327,Defund the tax police and gut the ethics body.  Trump’s in control of the house GOP for sure.
BigStatus8740,The will of the people.  Toilet country.  Still 0 guaranteed paid days off too.
ayriuss,"I really don't understand Republican voters. I really don't. If Democrats did this, they would be getting hell from their voters. I would literally not vote for my Rep  in the next election if she supported this. Oh wait my Rep is a Republican so im not anyway, opps."
bluebastille,"""Republican ethics""  . . . an oxymoron that we all need to live with."
gtechfan1960,Republican and ethics are words that do not belong in the same sentence. Unless it’s “ republicans lack ethics “.
comcoast,I hope the state of New York charges him and throws him in jail
ChrisNYC70,This just shouldn’t be how government works. They are just evil.
Yitram,Did they ever read the Constitution?
hamsterfolly,“Who needs ethics? Not us!” -Republicans
PenguinSunday,Democrats should run on establishing an outside watchdog group to hold congress accountable that isn't easily gutted.
phoneguyfl,Not surprising. Republicans have no ethics and certainly wouldn't want anyone officially noting that.
ConsiderationOk7513,This guy gonna go to prison ever?
Local-Talk-3831,What a pathetic society we are selves to.
wubwub,You can’t have ethics violations if no one is there to observe the ethics violations.
Maleficent-Elk-3298,Breaking news: Man set to be hung ecstatic over banning of gallows.
GadflyMagoo,"The news media needs to stop giving Santos airtime, stat. His opinion is meaningless."
deusirae1,"George “I’ll Suck Ya” Santos. He’ll possibly suck off anybody for a dollar, or a million."
,[deleted]
canadianleroy,Can we all agree to STOP GIVING A FUCK what George Santos says?!
deadpanxfitter,One doesn’t need an ethics body when one has no ethics.
Howhytzzerr,"All this does is make them look petty and small minded. Santos will lose his primary in 18 months, so that’s a possible flip for the Democrats already and they haven’t even done anything yet. None of their ridiculous proposals or bills will get through the Senate, so this just vindictiveness, just any impeachment proceedings they try to do, there’s no chance they make it through the Senate, but it does waste a lot of the people’s time."
TheBrettFavre4,"Haven’t you heard, they’re all “Forgiven™️”"
Tandran,Won’t stop him from getting extradited to Brazil. Moron.
Frogmarsh,"Why would they need an Ethics body, when they have no ethics."
butttabooo,There is no life in his eyes when he smiles. It’s creepy.
ArchieMedoggie,Hopefully he’ll get extradited to Brazil soon where he’ll face criminal charges.
Actual-Journalist-69,"All I can picture is Ron Swanson trying to cut all government programs, hehehe"
montex66,"Yet another scandal hand delivered to Democrats in a beautifully wrapped package with a perfumed note written on it that says ""For your pleasure""

And they won't do a damn thing about it."
nsomnac,"You see this is the low effort way to “Making America Great Again”. 

You gut ethics and then you can redefine what “Great” means.

Easy peezy!"
BradleySigma,"> “Interestingly, he does want to know if we have an ethics committee,” said Stibbons.  
“Since we don’t have any, I don’t think we need one,” said Ridcully.

\- Terry Pratchett"
Heijoshinn,"So the purported playbook is:

> put forward by House Speaker Kevin McCarthy

With Republicans agreeing to:

> re-imposes eight-year term limits for the OCE's board members, made up of former members of Congress

And...

> The practical effect of that will be the immediate removal of three of four Democratic-appointed board members

With a side effect of...

> rules prevent the office from hiring new staff after one month and require four board members to sign off on any staffing decision

But the current ethics body...

> *operates independently* of Congress and has *generally been more effective at investigating* wrong-doing than [self-policing Ethics Committee in the House or Senate](https://www.businessinsider.com/january-6-senate-ethics-complaint-josh-hawley-ted-cruz-unsettled-2022-12)

And Santos says...

> ""I think it just gives them more power,"" he said. He added that the newly-imposed rules wouldn't ""allow people to sit there without term limits,"" apparently referring to the board members. ""I believe in term limits.""

He believes in term limits on committee members; the same members that are dedicated to investigating congressional job performing fallacies. Because of the general political slogan of...

> ""I believe in term limits.""

Yet...

> He also brushed off the staffing restrictions, saying it would allow ""new members of the board to *pick their discretionary members*""

Again, put forward by Republicans. I can't help but wonder if they'll try replacing those Democratic seats with Republican ones in order to consolidate party power further. Hm.  

And **his** comically **hypocritical conclusion** is:

> ""It's a **good** thing **for transparency**, it's a good thing for Americans,"" 

Even though this article injects some opinion in it's writing, Santos' duck-face can unconsensually get anally knuckle busted.  
I hate this guy *and* the voters that endorse insidious tactics like this to advance political careers. **** him."
xparta300,Bottom of the barrel caca
Pristine-Proposal155,Republicans are some sort of fecal species that don't understand anything. Somehow they'll defend this.
Excellent-Shock7792,He looks like a perfect psycho.
Datokah,"I think the main problem isn't so much that these idiots want fascism, but that the Americans who vote them in to power want it too."
Chrissy_Bigg,"This exact thing has just been done by the Conservatives in the UK aswell. [Source](https://www.theguardian.com/politics/2022/dec/22/sir-laurie-magnus-named-rishi-sunak-independent-adviser-ministers-interests)

Ethics advisors to the Prime minister kept resigning after refusing to approve proposals that broke international law. Until the Conservatives just never appointed a new one for 6 months.

Finally a new one has been appointed, a staunchly tory banker. In addition he is no longer to investigate the government anyway, so the position has basically been disbanded.

Disregarding of ethics to allow for performative cruelty and corruption seems to be a mainstay of ""conservative"" politics now."
Prudii_Skirata,"If people walked into this thinking the GOP had anything planned besides grabbing for the power to set up every road block they could find between themselves and the DOJ, they haven't been paying attention."
Chinaroos,"Anything George ""The Confirmed Liar"" Santos likes can't be good for the country"
fvtown714x,"Haha imagine being this big of a stain for your own party, I love it"
seakae,The smarmiest of fucks.
United-Cockroach-980,"Drain the swamp? 

Pepperidge farm remembers."
Digby-Dog-101,"Oh look, another right wing accelerationist fool.

These people are brainwashed."
