author,comment
FoxRaptix,"Not surprising, one of his concessions to get the speakership was to allow trumps Allie’s to interfere with the *ongoing* federal investigations in to him.  Same thing they did with the mueller investigation, where they used their congressional authority to sneak trump details the investigators had."
Melodic_Ad_6870,"After McCarthy thanked, trump just gave me reason to NEVER trust him (McCarthy)!!!  2 years of chaos  are coming!"
spacegiantsrock,I wonder if that was one of his concessions to the psychos.
out2seeagain,Get ready!
BecauseBassoon,Can’t get the stink off.
Zeronaut81,"What. An. Embarrassment. Spineless, feckless, coward."
Pieceman11,"You’ve got to worry about the ones that will do anything to secure power for themselves. No moral compass leading the way, no principals, just a lustful obsession for power at any cost."
nooksak,He was forced
hackingdreams,Welcome to the next two years of your life folks. McCarthyism 2.0.
a-really-cool-potato,"So, he just made himself ineligible to act as a member of Congress then?"
my_name_is_24601,I’m old enough to remember when you had a speaker election NIGHT not week. Clearly massive voter fraud. /s
g2g079,Trump's Congressional endorsements took just enough power away from the House GOP that they needed him to get a tiny bit of it back.
CatAvailable3953,"I have no idea where this post will end on the stream. You would have a difficult time writing a script to begin the end of Republican control 
in both houses of congress. 
This is a performance directed at their base. But why? They won’t accomplish much if anything until the debt limit. 
If they ruin the government’s good faith and credit I cannot imagine a good outcome. As for taking Social Security and Medicare (not to mention military retirement benefits) and putting them under discretionary spending seems a recipe for defunding. As would a combination of voluntary contributions. 
Voters need to get up to speed."
kljfahu,"Great, so Biden impeachment (for reasons) in 5 4 3...."
findingmike,So just convince the Trump lovers that the GOP is dissing Trump and the GOP won't be able to pass legislation?
michael_polk,Repeat
theblackbeltsurfer,McCarthy is spineless
No-Beat-263,Two years to late
ChemicalObjective216,Explain to me like I am 5. Why didn’t the vote end the first time when Jeffries had the most votes for speaker?  If you can nominate anyone for this position what is the point of having an election until you get the results one guy wanted?
Hartache14,"One of traitor Trump's loyal suckbutts would like to thank traitor Trump - for helping traitor Kevin McC. secure enough treasonous votes to ensure a cowardly, lying traitor is now Speaker of the House, thereby allowing for more treasonous activity to flourish at the highest levels of our government. Trump's stench continues to permeate every level of our governing bodies."
Pitiful_Computer6586,Jan 6 lol
redditwb,The real question is who will replaced McCarthy when he gets indicted in April.
devo00,There will be nonstop no-confidence votes as soon as the house reconvenes…
Roadglide114-,"The question that I haven’t heard being asked throughout this whole thing, is why does he want the speakership so badly? and after raising $500+ million for the RP who is he indebted to? How many deals have he made to donors we no nothing is free. So who is he/ republicans working for really?"
Turbulent_Cricket497,"Total noob to this sub so sorry in advance if this is a dumb question.  It is my understanding that McCarthy had to make lots of concessions/agreements with the holdouts to get their votes.  So my question is, what happens if he reneges on what he promised?  I mean he agreed under severe duress.  Are there meaningful repercussions?"
