author,comment
PowerAlwaysReveals,">”My instinct at the time was that we had really bad people in the form of James Comey, McCabe (whose wife was being helped out by Crooked Hillary while Crooked was under investigation!), Brennan, Peter Strzok (whose wife is at the SEC) & his lover, Lisa Page. Now add McGonigal & other slime to the list. Who would you choose, Putin or these Misfits?”

Um…weren’t the vast majority of these people no longer employed by the government by the time of the Trump/Putin press conference in question? (Not sure what the footnote about Mrs. Strzok being an SEC employee has to do with anything. A government employee, yes, but working out of a very different wheelhouse)."
HumphreyLee,The most treasonous public figure in decades continuing to be so openly to hails from his supporters that he’s “the most American president we’ve ever had!” God I hate this place.
baconeggsandwich25,"Said it again, you mean. He already took Putin’s side over his own country’s *when he was its fucking president*."
the_TIGEEER,"How the fuck will r/conservative twist tgis one?
... they will probably just ignore it"
sbaggers,How's that shocking? Definitely on brand
itsnotthenetwork,"Why is this shocking?  
  
If this is shocking to you then I only have one question, where have you been the last 6 years?"
corvidae21,It's not even the first time he's said something to that effect
boot2trucha,Shocking?? He was saying shit like this before he was elected.
fanfpkd,"My fucking god, the hand is so far up his ass Trump’s dentist gives Putin’s manicures."
BoysenberryShort574,Not shocked. Russian asset.
Unknown__Content,Once a traitor…
crackheadwilly,Trump knows Putin put him in power. Trump will side with Satan himself if it earns him the Presidency
Stormcrow6666,How is this blatant Russian stooge not in prison? Holy fuck!!!!
PalpitationNo8356,My god. What does he have to do get locked da fuk up. Please put this man away. Or send him to Russia to live with his boyfriend. But do SOMETHING!!!
United-Cockroach-980,Putin’s bike rack
AdSufficient780,"Never been a fan of Reagan, but it's truly crazy to think Reagan's party has become the Trump party and Russia's lapdogs lol"
Puncharoo,Nothing about this is shocking
gettinguud,Revoke his American citizenship and send him to Moscow already
HelicopterQuiet3023,Him and all of the GOP think this way
Aggravating_Impact97,"Traitor. 
Straight up worse than Benedict Arnold."
meatballlover1969,Can we stop giving this pos our attention already?!?!?
WillyBeShreddin,Just like he did 4 yrs ago in Helsinki. He's a Russian lackey.
wintremute,Throw this fucking traitor in Guantanamo.
rmpumper,Shocking to whom? Fuckers already forgot the time when he said it while being in office?
BockTheMan,Remember that time he wanted to disband NATO?
JohnnyGFX,Years ago this would have been an absolute disqualifying statement by any Presidential candidate. These days MAGA hats exist.
Vincevega1972,It’s always about the money.   Putin has promised him something… $billions in Russian land?
jimmyhatjenny,This is 100% not shocking.
insidmal,"He didn't believe them when he was in charge of them, so why would he believe them now?"
EternalTeaTime,"I’m shocked! Shocked!! Well, maybe not that shocked."
tksopinion,Shit like this is why I moved to Canada.
mathfacts,"Mr Trump, have you no shame, sir?"
swipichone,I still see him as a sleeper agent for the kgb
Zirie,Shocking to whom? Are you new here?
DanER40,He's trying to pretend like McGonigal is not on his team.
DrMorry,"""Shocking"""
anonymous_delta,"Say what you like about the FBI, DOJ and intelligence community but who the hell thinks Putin has even a microcosm of credibility at this point after invading Ukraine? Apparently a former president does and that should be more than enough reason to disqualify him from office."
palmpoop,"He calls it trusting Putin. 

I call it aiding and abetting a foreign power that undermines US democracy."
explision,Still don’t understand how this guy isn’t locked up
Hobowookiee,"I'm shocked I tell you! Shocked! Don't worry folks he ""could"" be facing charges soon. Fuck this media cycle. He'll be dead before he stops saying dumb shit, he gets held accountable for anything and  the media stops talking about this shit bucket of a fuck stain. Fuck off."
wheelofka,No one is shocked. That is his daddy.
SnooPies9008,Tell me ur a russian pawn without telling me ur a russian pawn.
Mike_Kermin,"I wouldn't call it shocking but specifically par for the course.

Kinda fucked up, sure. But not shocking."
Kflynn1337,"Well, we know who Trump is working for, and now it sounds like it's voluntarily, rather than because of something Putin has on him."
cheesypotatoflakes,I wonder who is funding his 2024 campaign?
SidratFlush,"Is anything Trump does or says shocking any more?

The only shocking thing is how slow the criminal indictments have been progressed.  Anyone else would have had a trial a year ago, like those who have been convicted for their role in the run on the White House."
SpecificSomewhere393,Kompromat.   Plain and simple.
joy3r,"Russian asset

it's amazing that Russian intelligence services hooked Trump... whether he knows it or not

sadly no one in the states has been able to do much about it either, he's still working for them"
,"Must be so difficult to rationalize giving undying loyalty to someone who has betrayed America.

Put 40 American flags outside your house. Put them on your car. Do whatever you feel is needed to make you FEEL like an American, because there are immigrants to this country who espouse the values of our great nation more than you could ever dream too. It’s no wonder the American flag isn’t the only flag you fly."
systemic-void,I. I just can’t do this again. Please make him stop.
coollord789,Are we even surprised anymore? Putin owns this guy.
ciccioig,It would be surprising if nobody knew he is Putin's bottom b*tch.
Staklados,When life imitates South Park
throwaway83759372,This bozo needs to go back to playing golf at Mara Lago
doshu99,Putins puppet. Fuck Trump!
1Eternallylost,"Let this be your daily reminder that Trump lied over 20 times per day during the entirety of his 4 years in office.  30,500+ fact checked and verified lies.

[Trumps lie count - Washington post](https://www.washingtonpost.com/politics/2021/01/24/trumps-false-or-misleading-claims-total-30573-over-four-years/)

He also called everyone who died defending our country ""losers"" and ""suckers"".

And here he says he trusts Putin - arguably one of the greatest threats to freedom and liberty in the world - over the entire US intelligence community.

It's clear to me who the loser and sucker is.  Trump and those who still believe in him."
Spin_Quarkette,"Yesterday he trashes the military, and today he trashes the IC, claiming he trusts Putin more. Does anyone need more evidence that this guy is a serious threat to the country?  I certainly hope Georgia does all of us a favor and throws him in prison."
BrownEggs93,"Remember, he still speaks for the republican party no matter how hard they might try and pretend otherwise.  This bastard needs to be in prison."
staiano,Shocking to who?  The right wants this and the left knows he will say it to stir his base.
StoneheartedLady,"This should be ""Trump continues to make"" seeing as he's been saying the same thing for years."
Di20,"This dude is looking for an exit ramp, so he can avoid jail time."
rexmorgany,"If he doesn’t trust the US intelligence community, why did he keep so many of their top secret documents after being evicted from the White House?"
skeeter04,The most dangerous man in the USA.
Pascalwbb,"so these ""patriots"" are so proud of their country that they believe the enemy more. Lol."
Lynda73,Why is this shocking? This isn’t even the first time he’s said this.
Teenager_Simon,Why won't Republicans just move to Russia to own the libs?
socokid,"Uh, he did that in Helsinki many years ago, [on a world wide stage.](https://www.politico.com/story/2018/07/16/trump-russia-putin-summit-722418) 

> “I have President Putin, he just said it’s not Russia,” 

The man could not care less about America. He only cares about Donald. Period."
CrystalJizzDispenser,"Imagine being dumb enough that'd you'd listen to this complete clown and take anything he says seriously.

The guy is an absolute fucking moron."
dae_giovanni,"""shocking"" only if you've been in a coma for the past handful of years..."
Intelligent_Ad_7797,And those moron supporters of his genuinely think he would have stopped putin from attacking the Ukraine
UncertainlyUnfunny,"Wagner Group has a commercial out… recruiting J6ers… to go to Russia… to fight Ukraine.

I have no problem with it: two birds, one stone.

[Watch the ad.](https://twitter.com/blackrussiantv/status/1619769832156860416/mediaviewer)"
GlenAllen_2010,"The dude is sick in the head, and frankly so is anyone that supports him. Does anyone really want a Dictator running this country? I am a Democrat, but I do believe in some Republican policies, and I use to support some Congressional Republicans, but no more. The Republicans will have a landslide loss in 2024. Unless Trump dies or goes to prison, I see no way out for them, but you know what? They put themselves here!"
Cool-County-5696,One day hopefully soon Trump will be gone but his 33% to 40% will still be around and that is why we are the most disgusting population in a major country that is still a democracy.
RickTracee,"Would you expect anything less from a TRAITOR?

What is the difference between Donald Trump and Benedict Arnold?

Benedict Arnold was a hero during the American Revolutionary War but felt he never received the recognition he thought he deserved. In turn, he became a TRAITOR and defected to the British Army.

Donald Trump had 5 draft deferments to avoid military service during the Vietnam war. In addition, he has stolen top secret documents and led an insurrection against the USA. Trump is just a TRAITOR who has never served the US honorably."
