author,comment
7fingered-meatcutter,"The Talented Mr. Santos rundown:  not mentioned in this article, or I missed it, is he has not yet produced a birth certificate yet and NY law prevents anyone else but the birthee access to that information.  So we really have no idea who this man really is. imo

 [https://nymag.com/intelligencer/2023/01/the-everything-guide-to-george-santoss-lies.html](https://nymag.com/intelligencer/2023/01/the-everything-guide-to-george-santoss-lies.html)"
MagicaDispelica,Burn it all down
MagicaDispelica,"Blacklist, reject, and overthrow the GOP by every means necessary."
wonkalicious808,Republicans love corruption. It's why they want to weaken the IRS so it's less able to help non-rich people and less able to go after rich tax cheats. It's why they voted for Donald Trump. It's why their policies resemble the policies of authoritarians like the Chinese Communist Party.
jar1967,Ethics and Republicans don't mix
afCeG6HVB0IJ,Who the hell cares what George Santos thinks or says
TreeChangeMe,Here comes the third Reich
solitarium,This congress is tantamount to knowingly having a root system growing in your septic tank
PathoTurnUp,Do they have the power to pardon trump or can only the president do that?
1benevolent,They can't pass this right
Immediate_Catch_9924,Speaks volume about the voters that put these morons in power
SpiralCuts,"Jeez, following up on the Supreme Court, this is the YOLO house.  Everything’s a smash and grab now"
,And their idiot knuckle dragging voters will hail this as a brilliant move to “own the libs”.
