author,comment
humter01,why did you hit the bird
Matix777,"""Heh, I don't think he sees me""

*looks away for a second. Spider is gone*"
Dog-5,Thats what you deserve for smacking the bird
spacebobster,"Haha, look at those fornite reflexes ;)"
Efficient-Speech7669,Lol. Dude started playing fortnite
thetrickypickle,I did not expect the Fortnite reaction at all lmao
Healthy_Potato_4070,Only go to the Red Forest higher than these guys jump. Use platforms until you get better weapons and Jetpack.
EGH6,DIDNT KNOW THIS GAME WAS A FORTNITE GAME
Niebosky,It's not Fortnite either
Darklordofbunnies,"At this rate, Coffee Stain is going to implement a feature where the game accesses your webcam the first time it spawns a spider in & posts the results to Reddit."
LucheriniHD,My man got scared into fortnite
Willamanjaroo,dad
maxmax12629,![gif](giphy|Sux3kje9eOx1e)
ayllmao123,Do not turn on arachnophobia mode it makes it even worse
occupyOneillrings,That panic at the end lmao
Madhighlander1,When you go to find something to swat the spider and it's not there when you come back
Stallos11,"Basic fortnite gameplay, no fight but a lot of walls before dying."
databeast,"those guys are protecting a uranium node at the bottom of that valley, and I swear those Elite stingers that spawn there have their aggression turned up way beyond the defaults."
Howl_UK,"Lol the panic stairs! I was expecting some frantic nut-eating… which, sounds worse than it is."
doctor0,Never take your eyes off the enemy
OzzieGrey,The fuck is this... space fortnight?
HappyScripting,"hotkey on truck building it is for me. Put down truck, park on spider, run away."
korpulentkraken,The PANIC building
The-Wylds,Got what you deserved for hitting the bird. Gets chomped by a Cat and then starts playing Minecraft. This clip has it all.
Asio0tus,thats what you get from randomly abusing local fauna
Quality5521,payback for hitting the bird
StopCommentingUwU,That's what you get for hitting that poor birb
MrUniverse1990,That's what you get for abusing that poor flower bird.
GreyVersusBlue,So I just saw these for the first time two nights ago. Didn't know they existed. My wife came running into the room at how loud I yelled when it jumped at me.
WhatsDatdo,1000 hours in and that's still my reaction to seeing one of them.
Kilo1125,"The failed ""Dad come pick me up I'm scared"" save, the random ass Fortnite building (seriously, what did you expect to happen?).

Such a beautiful comedy of errors."
Adezar,You deserved everything that happened after touching that bird you fucking monster.
What_U_KNO,What did the parrot do to you? That was fuck around and find out my man.
SirHuddy,"Man was cranking 90s since he was born,but yea their is a texture pack that reskins spiders to cats which tbh I find more terrifying haha"
TheChaseLemon,"I really wish I had that meme right now with the two space dudes. Except this one would say

“When did Satisfactory become a horror game”

And the space dude holding the gun would say

“Its always been a horror game”"
dup3,Holy Fortnite Batman.
Aggressive_Glove2335,"You hit the bird, you deserved the spider!"
EffYeahSpreadIt,Yeetus deletus
keepitcivilized,"In my stupid and innocent days i murdered a bird and a lizard doggo. I instantly felt bad after both kills. Never again.. 
I killed one of those beanwhales too.. didn't feel as sad about those.. they're in my shit all the time and annoying."
WinterMajor6088,Found the Fortnite player.
Brucilx,Scared so bad op started playing fortnite
Alien2080,Fucking lol
RLToro,Tried cranking 90's I am DEAD hahaha
QuantumSupremacy0101,So how was the years addicted to fortnite?
PyroYeet0808,Bro played too much fortnite
cchooper1,"Oh, you're not going to *build* your way out of this one..."
Delicious-News-9698,There are immortality mechanics in this game - panic building platforms isn’t one of them lmfao
SC_Gunwise,Tried to Fortnite the shit out of that to escape! LMAO
kullre,this is why i can't play this game
remirixjones,"This sort of thing happened to me *when we had people over*. I was in the next room playing, and got absolutely blindsided by a big ol' spidoo.


I would pay good money to have the audio from that encounter. I'd also pay good money to see the reactions of my neighbours...I went full feral, idk man."
ecksdee58,Homie went Fortnite mode
VesseloValhalla,Dude got hit one time and built like it was fortnight
bunnings-snags,Bro started fortnite building
Desperate-Fix-9930,Those things are the only video game enemy that truly terrifies me
DaddySturm,"The fortnite building was hilarious, but yeah screw those bugs... and don't hit the birds, that's just rude lol"
Doggxs,Did he just try to Fortnite his way out of it?
HoneyBezu,Xenokarma for hitting the bird
___Maggi___,Did you play Fortnite before? It looked like it when you are building foundations like hell
Sug_Madi,"I understand you completly. I am new to the game(bought long, started playing last week) and i came upon a cave, which was quite dark and full of poison so double dark with gasmask on.

Now, so far i have only seen standart hogs and like 3 standart spitters. I didnt know spiders were a thing.

So i went in, expecting some hogs or spitters, but it was clear. And then sudenly that thing spawned right next to me with 3 normal size spiders ass a back up.

I had the same panic attack, only with rebar gun instead of building gun and sprinted outside the cave as fast as i could. That thing followed me, so i killed it outside, but man, with headphones on, playing in the dark during the night and without any knowledge that spiders were a thing in a game, let alone that thing, my heart rate was throuht the roof.

I still get elevated heart rate when i see one now and goosebumps, when i hear another fking artifact."
MrPrez124,Man started fortnite building
Peakomegaflare,Spöder. Truth be told I regularly go on a genocidal rampage on the spiders. They fuel me
KlaVra1,"That's reason one I don't do the caves or anything like that in the server we play, i do skybridges with arachnophobia mode on and just chuck nobelisks like my name was USA in 1945..."
arowz1,Rofl - engage fortnite mode
Anon4711,Repost
Pale_Prior_3763,Your best bet is placing large pillars behind you
MrPifo,"Idk whats more terrifying, spiders or the CATS"
CapSevere7939,"Yeah after I learned there were crawling spider type creatures of any size, I decided it was a horror factory manager game"
TransgenderAvenger,dad
Shaman_Shanyi_222,"Crap this made me remember when i was scouting the jungle one time and had to afk for a little bit, and lucky me i stopped at a tree, when i came back, a small MF was staring right a tme almost at the middle of my screen...

Legit wanted to burn the whole forest down. :D"
clarissa_au,"oh frick-

that’s why I have Peaceful Mode mod installed to delete all of the scary mobs and items so that I can build a factory without these scary spiders"
Han_Solo_V,LOL. I did the first time around that place too.
pirocao_do_neymar,bro got so spooked he started cranking 90s
tidematz,Scariest moment when you look away and he’s gone.
KBoxter,you deserve that and worse for hitting the bird
sendintheotherclowns,That’s what you get for killing the bird
svanegmond,You were looking at a tree.  Put the tree between you and the spider.
tibricel,"Yeah, no. Arachnophobia mode got turned on as soon as I found out it existed."
Fluf_hamster,Lol that panic save cracked me up 😂 honestly your best move when a spider disappears like that
HornyRacist,First time I saw one of the spiders I nearly had a heart attack wasn’t to aware they were in the game
timascus,Lol.  That’s just Bill.  He was saying hi.
EX7mattchew7X3,"It can be whatever you want it to be, baby! ;P"
tren0r,"so i was building a bridge for my trains above this swamp area near the desert start of the game, and there was some copper, far below me along the bridge that i needed to create the aluminium alloy sheets locally. i dont think ive ran faster than that before in satisfactory after being confronted by 3 gigantic spider demons simultaneously"
Inviz1mal,You deserved it after hitting the bird
MYTK87,I love how the escape strategy is \*build platforms like I'm in freaking Fortnite\*
justintime505,I avoid the red forest at all costs. If I do have to go in there I tend to kit myself up like Rambo.
UndeadMunchies,"You angered Grule, Protector of Birb."
Nervig2001,That what you get for bonking the birb
lorissaurus,"You can turn in arachnophobia mode and they are nicer looking, but yes A LOT more content is coming incoming the native creatures, check out inside of the caves some time, you'll find some creepy creepy stuff and objects that don't have purpose yet involving the biters"
JoeyDaBearGaming,bro started cranking 90s
Pug_Pancakes,This is exactly why I play with arachnophobia mode on
D1gitalFox_,u/savevideo
Orvvadasz,My bro just reverted to fortnite when he got hit.
Pigg69,Bro started playing fortnite
_Victide,Dude trying to play fortnite
the_doll_in_ur_room,why the fuck did you hit the bird
MLGcobble,Man started cranking 90s in satisfactory lmao
wolf_draven,"*Spider uses jumpscare!*

*It's super effective!*

*Fortnite skills intensifies!*"
schwimm3,"Dude this is satisfactory, not Fortnite"
HistorianPristine,"It seems like, that you also didn’t knew, that you aren’t playing Fortnite."
TheOnlyJustTheCraft,I could feel your heart rate when you looked back and it was gone. 😂
Da_Schaefer,Bro playing oldschool fortnite with his build defense :D
JohnyWasTaken,Bro got so scared that he started playing fortnite
FreeRacing5,I laughed way too hard at this
Justin-Krux,"you went straight fortnite mode in your panic, lol"
BantramFidian,"Oh my sweet summer child. 
I hope you never see the true terror of this game, which is arachnophobia mode."
Dr-Sawdust,"God damn, its no damn fortnite 😅"
juberish,Way to fortnight your death
sselesUssecnirP,Not the guy trying to crank 90s
Gunk_Olgidar,Complains about videogamekarma after hitting bird
arrynyo,What. Is. This. Game.
dshatneriii,"The flightless bird is endangered you bastard. 

Also... Horror game yes... Fortnite this is not..."
Correct_Memory8914,bawb the stinger
realamericanhero2022,Lol it’s not unless you have a problem differentiating real from fake.
notshaye,"I love the fortnight building, your clearly much better than me"
JellyfishUnable,This man started Fortnite building 🤣
itsactuallyjiff,Satisfortnite
BrubMomento,Man thought he was playing fortnite
WREN_PL,Man so scared he went fortnite
SubNauTiOs,Bro started playing fortnite
Hoovas,He Suddenly played Fortnite
