author,comment
DislocatedLocation,"The moment the screen went black, I tensed up waiting for that oh-so-familliar cart ride through a snowy land."
defaultgameer1,I am so damn happy about this haha. I saw the original post on this and knew it was a missed opportunity.
Sheersanctity,Hahahaha i fn called it; idc how old this joke gets it always will please me.
Stevejazzy,All roads lead to Skyrim
Metalutionary,Okay you got me lmao. I was expecting stickbug or rick rolling lol
Gunk_Olgidar,"Yes, this.  

I was expecting this the first time.

![gif](giphy|hVazFLob1BnLpuWoXx|downsized)"
Anvisaber,"I love this meme so much, I’ll never get tired of it"
NinjaBr0din,"Hey, look, someone found my first attempt at a hyper cannon.

Weird, when I did it Becky punched a hole in spacetime and took out the dinosaurs, you did it and brought back dragons... I wonder what will happen when the next person does it. Reptilians maybe?"
Zenvarix,"At this point, I'm hoping a different game does the ""start with the player slowly waking up from a black screen to some easily iconic (but different) dialogue"", if only so there'd be some variety to spice the ol' black screen with the chance that it could be one or the other. I suggest ""man, what will they cook up next"" for characters waking up from a wild high.

I took a pinch of salt with the title (you showed a bit of your hand) but at the blackout I was preparing to eye roll. 

Well done. Somehow you are my first Skyrim cart ride of 2023! (There is no sarcasm intended in this last section, and only light sarcasm meant in the rest of the comment)"
Special_Grocery3729,"Todd Howard, you did it again."
whalenailer,This is a repost from yesterday when you went to space
jurgen-,![gif](giphy|11FiDF2fuOujPG|downsized)
offensive_loons_fan,Scientists hate him!
JustPlay060,I KNEW IT
YourAverageSnep,"First time watching this, reddit crashed"
FleetStreetsDarkHole,This is now a Rickroll. It must never die.
Yuri__01,"I can't upvote because the votes are on 666 

That's the place you went xD"
LegosMc,I'm kind of surprised that LGiO didn't do this as a bit with his hyper tube cannon.
WarBreaker08,Clang resides here
Kullet_Bing,![img](emote|t5_gs464|9160)
DCodedLP,r/rorikroll
b4dger5,Definitely expecting to be rickrolled
ProtoBacon82,When lets game it out did this he crashed
