author,comment
ImprobablePianist,It looks like a planet from Ratchet and Clank.
UsefulEmptySpace,Hopefully coffee stain makes satisfactory 2: industrial revolution
MrGradySir,I was really hoping one of these was just gonna be a pile of spaghetti noodles on a plate.
epicdude312,"Hmm, interesting. The artstyle almost reminds me of Titanfall for some reason."
LaurelRaven,"Looks a lot more like Outer Worlds, but I really like it"
TheChaseLemon,It’s official. The dev team has to recreate all the models in this image.
trailmixorz,"It’s like we’re looking out into the world in which Satisfactory takes place. Different regions, designs, technologies, cultures"
Mr-Mne,Satisvictorio
spencerpo,I could swear this is DLC or a new planet in Borderlands
PuddleOfMud,"It almost reminds my of myst worlds, but industrial. It's beautiful."
GuyWithLag,"Ok, now place these in Nvidia's 3d model extractor ai...."
jtr99,"Hmm, now I want a Satisfactory mod where older buildings and machines get worn and dented and rusted over time."
BecauseGame,It's like a glorious Satisfactory/Star Wars/steam punk mashup
greglefox,I love the slight cartoon effect
ivovis,it got it all wrong in such a perfectly right way.
xlkikilx,Looks a bit like No Man's Sky.
potatoboi7543,Honestly looks like the game but more like in real life
renchiks2001,Gives me subnautica vibes. I like this
DrAgonit3,I'm getting heavy Borderlands vibes from this.
edmos70,This was when Fixit inc. went through their steam punk phase.
TheOnlyJustTheCraft,Looks like No man sky
sharndrinst,Reminds me of volcanoids
Some_Random_Pootis,Looks like scrap mechanic fused with satisfactory
Darth-Regnos,...why have I never thought of using in game screenshots for background generation in Stable Diffusion. Thanks for this! Looks beautiful
Johnny_Blaze000,"These are getting better, very quickly."
MakerGaming2022,Love this. I was so close to getting MidJourney until I realized how much time it would probably steal from Satisfactory. Lol.
Saaihead,"Satisfactory on acid, pretty cool!"
Temporal_Illusion,"**Very Interesting**

1. [MidJourney](https://www.google.com/search?q=midjourney+ai+art&sxsrf=AJOqlzVuE9iILznpzM3u-9eWdEdnxHyoyQ%3A1675463601290&source=hp&ei=sYvdY8yDDr2tqtsPl-ODgAs&iflsig=AK50M_UAAAAAY92ZwergdpQw5MDhrSKZtgnN9pp3Vy3x&oq=mid&gs_lcp=Cgdnd3Mtd2l6EAEYADIECCMQJzIQCAAQgAQQFBCHAhCxAxCDATIKCAAQsQMQgwEQQzIECAAQQzILCC4QgAQQsQMQgwEyBQguEIAEMggILhCABBCxAzIFCC4QgAQyBQguEIAEMgUIABCABDoLCAAQgAQQsQMQgwE6CwguEIAEEMcBENEDOhEILhCABBCxAxCDARDHARDRA1AAWNIDYKkZaABwAHgAgAFdiAHvAZIBATOYAQCgAQE&sclient=gws-wiz) is the ultimate art tool for anyone looking to make AI art that has a monthly subscription to use.
2. AI Art is a growing phenomena and it is interesting to see how various AI's view Satisfactory the Game.
   1. View [this related Reddit Post](https://www.reddit.com/r/SatisfactoryGame/comments/vqjazo/i_generated_concept_art_for_satisfactory_using_ai/) for another Midjourney AI Art related to Satisfactory the Game.
   2. View [this related Reddit Post](https://www.reddit.com/r/SatisfactoryGame/comments/vi13gk/satisfactory_game_on_dalle_mini/) for a Dall-E AI Art related to Satisfactory the Game.
3. The use of AI Art can be inspirational for those Players of Satisfactory the Game.

Adding to the Topic of Discussion 😁"
MosquitoEater_88,beautiful! it's so exciting to watch this technology flourish
zhaDeth,wow
Vencam,"Well, how does it look at the end of the journey? ![gif](emote|free_emotes_pack|thinking_face_hmm)"
kemh,I am so tired of AI generated shit cluttering up Reddit.
Endr9,Reminds me of Volcanoids for some reason
wigenite,"is that the exact wording used?

different results between ""Satisfactory screenshot from the game."" vs ""screenshot from the game Satisfactory.""?"
zetaxxprod,pretty realistic
Knowen91,tbh i like the art style.
CeruleanDragon1,Looks closer to outerworlds. However I can definitely see the satifactory elements.
Beware_Enginear,Now ask how it sees the spiders in satisfactory
Kogge34,This looks so good
Fantastic_Ask,Man can we get texture packs? Please? 🤩
Terrorr404,I’m getting outer world mixed with slime rancher vibes with this
Ruchson,Holy shit nice new Steampunk game Coffie Stains need to think about this
